timestamp,platform,label1,label2,label3,diff,content
2024/9/26 10:50,bili,0,0,0,0,"大家保持吃瓜没必要站队 都是一丘之貉，那个打假博主谈不妥了想着30万私了就不把这个事情曝光了，本质上还是利用民众的生意
看看之后的事情，这里怎么解决吧"
2024/9/26 10:50,bili,1,0,1,1,靠打架吃饭挣钱的人！！说的话，发的东西，，，，必有断章取义
2024/9/26 10:51,bili,0,0,0,0,"大家保持吃瓜没必要站队 都是一丘之貉，那个打假博主谈不妥了想着30万私了就不把这个事情曝光了，本质上还是利用民众当生意
看看之后的事情，这个千万博主这里怎么解决吧"
2024/9/26 10:51,bili,0,0,0,0,看完两方的话，我觉得红薯粉丝应该确实是有点问题，雨姐是不是明知还虚假宣传就不知道了。那伙人是借着打假敲诈勒索也是真。我估计借着雨姐这事儿已经去敲诈名单上的其他人了。是狗咬狗还是雨姐被搞要看后续了
2024/9/26 10:51,bili,1,0,0,1,好了  我信了  你自己自己说的假一赔万  开始吧 履行自己诺言
2024/9/26 10:53,bili,0,0,0,0,形容亮子的第一个字，真的是是我最近的猜想疑惑[笑哭]
2024/9/26 10:54,bili,1,1,1,0,卖惨老登
2024/9/26 10:54,bili,1,0,0,1,好假哦哈哈哈哈 这个声明
2024/9/26 10:54,bili,1,0,0,1,最关心的话题一句不提啊，人家职业打假人，打你红薯粉是假的，打着了吗？是真的是假的？你们打架斗殴的事，关消费者屁事
2024/9/26 10:55,bili,0,0,0,0,他们是东北哪里人？
2024/9/26 10:55,bili,1,1,1,0,夹烟 走路的姿势多像黑老大
2024/9/26 10:56,bili,1,1,1,0,这干嘛的，日本相扑选手吗？
2024/9/26 10:56,bili,0,0,0,0,家里装监控录像呗，各个角落都装上，也花不了多少钱
2024/9/26 10:56,bili,0,0,0,0,加油雨姐，正义会在终点等待着所有人
2024/9/26 10:57,bili,0,0,0,0,雨姐如果真如你所说的这样，那你收集证据可以去告他们敲诈勒索
2024/9/26 10:57,bili,0,1,1,-1,错了还 犯[doge]
2024/9/26 10:58,bili,1,1,1,0,长的就像个黑社会
2024/9/26 10:58,bili,1,1,1,0,雨将军
2024/9/26 10:58,bili,0,1,0,-1,离开东北的人出现[doge]
2024/9/26 10:59,bili,0,0,0,0,展示的东西有点奇怪，那是双方手印，别人发来文书要钱，自己不答应但是还按了手印。
2024/9/26 10:59,bili,1,1,1,0,双方没一个好东西，都进去净化一下网络挺好的
2024/9/26 10:59,bili,1,0,0,1,哎呀家人们，看看雨姐的99元东北大鹅带不带派就完事了。
2024/9/26 11:00,bili,1,1,1,0,哪有一个好人
2024/9/26 11:01,bili,1,1,1,0,雨姐为代表的东北黑社会 需要国家法律的制裁
2024/9/26 11:02,bili,0,0,0,0,支持雨姐，状告他们敲诈勒索，追究他们刑事责任
2024/9/26 11:02,bili,0,1,0,-1,他就算为了自己这么打假  也对
2024/9/26 11:03,bili,1,1,1,0,雨将军:爱谁谁！都多余了[吃瓜]
2024/9/26 11:03,bili,0,1,0,-1,《无意中》《详细行程》，还有打人事件也没回应到底打没打人啊
2024/9/26 11:04,bili,1,1,1,0,配料表嘎嘎干净，红薯淀粉一点没有[喜极而泣]
2024/9/26 11:05,bili,1,1,1,0,好像一群土匪，你就看后面几个人拉个脸子，阴沉沉的看着就不像好人
2024/9/26 11:05,bili,1,1,1,0,虽然不想讨论长相，但是她的面相真的很让人观感不适
2024/9/26 11:06,bili,0,0,0,0,这是道歉吗
2024/9/26 11:06,bili,0,0,0,0,支持你，因为我是吃木薯粉长大的[OK]
2024/9/26 11:06,bili,1,0,0,1,虽然但是，你们不是打人了吗
2024/9/26 11:07,bili,0,0,0,0,加油雨姐，网络就是这样，做好自己，永远支持你和姐夫
2024/9/26 11:07,bili,1,0,0,1,假一赔万还算不算。老铁
2024/9/26 11:08,bili,1,1,1,0,"卖货时：家人们，相信我，我给家人谋福利。
出事时：我也是一个受害者，是团队对商品品控没有严格把关，和我没关系。"
2024/9/26 11:09,bili,1,1,1,0,说句实话，这方面我山东人迷惑性更强[笑哭]
2024/9/26 11:10,bili,1,1,1,0,好像黑社会啊
2024/9/26 11:11,bili,1,1,1,0,这个玉姐是老头吗
2024/9/26 11:11,bili,1,1,1,0,退网吧
2024/9/26 11:12,bili,1,1,1,0,关键红薯粉的事没说
2024/9/26 11:13,bili,1,1,1,0,这男的女的？
2024/9/26 11:14,bili,0,1,0,-1,喜欢我大姐
2024/9/26 16:22,wb,1,1,1,0,看着像黑社会
2024/9/26 16:25,wb,1,1,1,0,法外之地，打了人甚至道歉都是被迫的
2024/9/26 16:29,wb,1,1,1,0,当手里掌握了别人掌握不了的资源就不知道自己是谁了
2024/9/26 16:32,wb,1,1,1,0,哎，你竟然拍我录我，那我只能揍你了
2024/9/26 16:34,wb,1,1,1,0,谁信
2024/9/26 16:34,wb,1,1,1,0,抓重点，以后谁再说就是整她，恶意剪辑，这锅盖的
2024/9/26 16:35,wb,1,1,1,0,所以红薯粉是假的对吧
2024/9/26 16:37,wb,0,0,0,0,信东北雨姐
2024/9/26 16:37,wb,0,1,0,-1,啥都别说，就大华的那个模样，就是老实肯干的孩子，咱这一家人都是忠厚老实的模样，事情一出，就猜到那边打着敲诈的意思，没有想到事情发展更狗，人咋能这样呢，太坏了
2024/9/26 16:38,wb,1,1,1,0,一句不说自己卖假货
2024/9/26 16:38,wb,0,1,0,-1,我觉得打人事件雨姐这边解释的应该是事实
2024/9/26 16:40,wb,0,1,0,-1,雨姐:公关文案可算出来了，憋死我了
2024/9/26 16:41,wb,1,0,0,1,震惊，太震惊了
2024/9/26 16:43,wb,1,1,1,0,这爷们和娘们一样
2024/9/26 16:45,wb,0,0,0,0,其实问题很简单：1:他们进入雨姐家偷录视频肯定不对2:雨姐团队在被激怒的情况下确实爆粗口和打人了3:雨姐这个视频发出来详细地说明了事情的来龙去脉4:这个视频对于网友们最关心的带货产品的质量问题没有做出任何回应！总结什么都说了就是回避产品的质量和安全性问题！避重就轻呗！
2024/9/26 16:47,wb,1,0,0,1,只说别人上门录影录像不对，就不说自己带货的问题，制假售假不谈；甚至双方都爆发肢体冲突了。 还一上来就“本来不想回应的，”你为什么不回应？本就该回应啊，而且听你你的意思， 别人都不对，就你对。
2024/9/26 16:49,wb,1,1,1,0,卖假货怎么说
2024/9/26 16:49,wb,0,1,0,-1,就说红薯粉是不是假的吧
2024/9/26 16:51,wb,1,0,0,1,你自己好好看看你评论区，大伙说的那些话。
2024/9/26 16:55,wb,1,1,1,0,都是些什么阿猫阿狗
2024/9/26 16:58,wb,0,0,0,0,@石骄傲不骄傲
2024/9/26 17:01,wb,0,1,0,-1,不可能吧！雨姐的声音当时不可一世的样子，不像他们现在说的这个事啊！
2024/9/26 17:02,wb,1,1,1,0,上面那排有点像黑社会
2024/9/26 17:02,wb,0,1,0,-1,这些人看着
2024/9/26 17:05,wb,1,1,1,0,幽默
2024/9/26 17:07,wb,0,1,0,-1,回复@重精求儿子:都不看视频的嘛？最后不是说了粉条的事情、
2024/9/26 17:08,wb,1,1,1,0,一个造假?一个讹人
2024/9/26 17:08,wb,0,1,0,-1,红薯粉的事儿呢
2024/9/26 17:09,wb,1,1,1,0,还是把粉条解释清楚吧 打人不是大家非常在意的点
2024/9/26 17:11,wb,1,1,1,0,卖螃蟹也就是剧本，真假啥都都不用管，演完就发一点事没有。那你为什么不去当个演员呢？
2024/9/26 17:13,wb,0,0,0,0,相信东北雨姐！
2024/9/26 17:15,wb,1,0,0,1,买到假货可以直接找相关部门告，也可以自媒体发出来让大家知道，自然会有官方处理，拿着专业设备上门拍视频，明眼人一看就知道目的是什么，大张旗鼓的去人家家里偷拍，能拍到粉条制作过程吗？能拍到人家配方吗？
2024/9/26 17:16,wb,0,0,0,0,1
2024/9/26 17:17,wb,0,0,0,0,就是
2024/9/26 17:17,wb,0,0,0,0,真的
2024/9/26 17:17,wb,1,0,0,1,如果是私闯民宅，那就是正当防卫，没毛病。
2024/9/26 17:18,wb,0,0,0,0,一方拿一万买衣服
2024/9/26 17:19,wb,1,1,1,0,就是啊看不到一点诚意
2024/9/26 17:20,wb,0,1,0,-1,姐啊，很久我没刷微博，原来你微博还有号呢，你应该是被盯上了，我估计就是那种职业打假的，后边选品签供货合同，时间来得及，先检测一下，关键词之类的也注意下，他们上门就是为了激怒你们，不然有问题直接去工商等部门就好了，防人之心不可无
2024/9/26 17:21,wb,0,0,0,0,就是
2024/9/26 17:22,wb,0,1,0,-1,相信雨姐，现在的人为了钱什么没底线的事都能做出来，
2024/9/26 17:25,wb,1,1,1,0,黑社会一样
2024/9/26 17:26,wb,1,1,1,0,看这一堆人的面相 我是真怕 家人多买点啊
2024/9/26 17:27,wb,0,1,0,-1,弱弱问一句，怎么证明你们送检的跟卖的是同一批次呢
2024/9/26 17:29,wb,0,1,1,-1,看了评论一水黑   就有问题   支持雨姐 不让小人得逞  多看看好的评论  不要让那些不好的评论影响心情  这个世界傻子太多
2024/9/26 17:34,wb,1,1,1,0,卖假货还行得正坐得端
2024/9/26 17:35,wb,0,0,0,0,我觉得最不能做的就是欺骗消费者
2024/9/26 17:35,wb,0,0,0,0,无论怎么样，让更多人看到了盘锦河蟹这就是一种成功
2024/9/26 17:35,wb,0,0,0,0,必须要不欺骗消费者
2024/9/26 17:35,wb,0,0,0,0,千万不要欺骗消费者
2024/9/26 17:36,wb,0,0,0,0,首先，我没买过任何直播的东西，就会淘宝拼多多我看视频，纯粹就是看人家怎么做饭吃饭，至于带货买假货，这个似乎很常见，所以大家买东西擦亮眼睛。我呢，不支持也不抹黑，我是纯粹学做饭的
2024/9/26 17:36,wb,1,0,0,1,如果真的没有做错事的话，就不怕被别人说
2024/9/26 17:37,wb,0,0,0,0,雨姐宣传的不错很佩服的
2024/9/26 17:37,wb,0,0,0,0,作为主播，还是要对消费者负责的
2024/9/26 17:38,wb,0,0,0,0,卷入是非都不能更新了。我从来不买不看任何直播，但是爱看雨姐做饭视频，希望早日查明真相
2024/9/26 17:38,wb,1,0,0,1,都签了和解书还想讹钱，真的是无底线
2024/9/26 17:40,wb,0,0,0,0,就是
2024/9/26 17:41,wb,1,1,1,0,颠倒黑白，人家不曝光你也不会去查红薯粉吧。
2024/9/26 17:42,wb,1,1,1,0,神经吧，厂家不都承认含木薯，他还质检啥呀
2024/9/26 17:44,wb,1,1,1,0,有预谋的
2024/9/26 17:46,wb,1,1,1,0,跟他妈土匪一样
2024/9/26 17:50,wb,1,1,1,0,卖点好东西吧，哪怕贵点呢，品质最重要，主打一个绿色，定位不准，品控不行，就挺艰难的，谁家还吃不起个破粉条
2024/9/26 17:53,wb,0,0,0,0,雨姐以后做好品质，我们继续购买
2024/9/26 17:54,wb,1,1,1,0,谁是你家人？
2024/9/26 17:56,wb,1,0,0,1,红薯粉条真有问题会假一赔万吗
2024/9/26 17:57,wb,0,0,0,0,挺雨姐！传播正能量的视频本来就不多，雨姐是做的最好的，每次看完雨姐的视频就浑身能量满满一身干劲！希望雨姐团队能保持初心，做出更多更好的小视频。但是雨姐说以后打不还手，骂不还口这事还是有待商榷，咱不能怂到人家都欺负上门了还和颜悦色的……该揍还得揍，咱不是软柿子！也对不起咱直爽的性格
2024/9/26 17:57,wb,1,1,1,0,网红直播应该全部取缔，这些垃圾就是在收割韭菜，不知道国家为何不出手，是嫌实体和平台电商还不够惨吗？
2024/9/26 17:58,wb,1,1,1,0,后面一排七个不服八个不愤的 一点也没感觉到认错
2024/9/26 18:01,wb,0,1,0,-1,一个谎言需要一百个谎言来解释
2024/9/26 18:06,wb,0,1,0,-1,为啥要看
2024/9/26 18:08,wb,1,1,1,0,别丢人了
2024/9/26 18:13,wb,0,1,0,-1,不吹不黑。就是看看视频~
2024/9/26 18:14,wb,1,0,0,1,这是想好理由了
2024/9/26 18:16,wb,0,0,0,0,相信你，你的视频给我们带来了干劲！
2024/9/26 18:18,wb,1,1,1,0,封杀吧
2024/9/26 18:22,wb,0,1,0,-1,这是黑吃黑吗？？
2024/9/26 18:23,wb,1,1,1,0,卖假货不封杀吗
2024/9/26 18:26,wb,1,1,1,0,评论区地域歧视怪全都狗带了
2024/9/26 18:27,wb,1,1,1,0,红薯粉的事都没整明白，然后把人打了给广大网友道歉？ 网红现在真是个贬义词！ 你真是网红里的头子！
2024/9/26 18:28,wb,1,1,1,0,搞这一出黑社会帮派啊
2024/9/26 18:29,wb,1,1,1,0,拜托赶紧封杀吧 一个直播间土匪黑社会样
2024/9/26 18:30,wb,1,1,1,0,支持雨姐！打家里来不可能不还手。就是想讹钱！
2024/9/26 18:32,wb,0,0,0,0,没毛病网红虽然挣钱多。但是也是人。所以不让录就别录了
2024/9/26 18:34,wb,0,0,0,0,坚定不移站雨姐！这伙人一看就是有组织有预谋的。也等粉条检测报告，配料表到底有没有造假
2024/9/26 18:37,wb,1,1,1,0,相信雨姐，眼红就努力，别他妈整阴损事儿
2024/9/26 18:39,wb,1,1,1,0,真有意思，提红薯粉了吗
2024/9/26 18:40,wb,1,1,1,0,打架不行吗？故意拍摄不行吗？知假买假犯罪吗？
2024/9/26 18:41,wb,0,1,0,-1,不是很了解这个事情，不过买到假货就投诉真没必要上门（对自己不安全）这个粉条她带货但不是她生产的吧反正最后也说了会处理等两天呗，至于最后对方让她赔30万，不就是为了钱吗，就是这事儿从一开始在网上发酵就是为了要钱，重点根本就不是红薯粉。
2024/9/26 18:42,wb,1,1,1,0,虽然喜欢看做菜的视频，庆幸没关注过这位，这位一看就是假豪爽，真狡诈。
2024/9/26 18:43,wb,1,1,1,0,这比???勇敢啊..
2024/9/26 18:44,wb,1,1,1,0,大肥猪不男不女真是坏种
2024/9/26 18:47,wb,1,1,1,0,光道歉不赔偿，玩得一把好太极。
2024/9/26 18:52,wb,1,1,1,0,面相一点不善良
2024/9/26 18:54,wb,1,1,1,0,不是，你们还真的会去下单吗
2024/9/26 18:56,wb,0,0,0,0,看完了，非常有诚意非常细致。最近这一阵，这一套组合拳加热搜一看就是有备而来搞你，相信邪不压正。他们能用粉条做切入口，说明食品安全这一块还是有疏漏，以后带货要更细心，不能辜负粉丝和观众的信任
2024/9/26 18:58,wb,0,0,0,0,东北雨姐事件，理性看待，包容给机会。
2024/9/26 18:58,wb,0,0,0,0,东北雨姐诚实道歉，期待大家的理解与支持。
2024/9/26 18:58,wb,0,0,0,0,东北雨姐道歉，大家理性包容，改过自新。
2024/9/26 18:58,wb,0,0,0,0,关注东北雨姐，理性包容，改过自新。
2024/9/26 18:58,wb,0,0,0,0,希望道歉能得到理解和支持，引以为戒。
2024/9/26 18:58,wb,0,0,0,0,争议中的东北雨姐需要大家理性包容。
2024/9/26 18:58,wb,0,0,0,0,知错能改就好，请说到做到！
2024/9/26 18:59,wb,0,0,0,0,东北雨姐应该反思，大家也要理性包容。
2024/9/26 18:59,wb,0,0,0,0,以理性包容的态度给予改过自新的机会。
2024/9/26 18:59,wb,0,0,0,0,东北雨姐道歉，理性包容给她改过自新的机会。
2024/9/26 18:59,wb,0,0,0,0,言行思辨，包容理性，寓意深远。
2024/9/26 18:59,wb,0,0,0,0,雨姐应该反思，大家也要包容。
2024/9/26 18:59,wb,0,0,0,0,东北雨姐道歉，希望大家理性包容。
2024/9/26 18:59,wb,0,0,0,0,东北雨姐道歉，希望大家能够理性包容。
2024/9/26 18:59,wb,0,0,0,0,东北雨姐事件，理性包容，希望她改过自新。
2024/9/26 18:59,wb,0,0,0,0,希望雨姐能反思，大家宽容给机会。
2024/9/26 18:59,wb,0,0,0,0,东北雨姐道歉值得被理解和包容。
2024/9/26 18:59,wb,0,0,0,0,东北雨姐态度褒贬不一，需改善言行。
2024/9/26 18:59,wb,0,0,0,0,希望雨姐能改过自新，大家也理性包容。
2024/9/26 18:59,wb,0,0,0,0,东北雨姐道歉，理性包容，改过自新。
2024/9/26 18:59,wb,0,0,0,0,东北雨姐道歉，求包容给改过自新机会。
2024/9/26 18:59,wb,0,0,0,0,东北雨姐要好好反省，给改过自新的机会。
2024/9/26 18:59,wb,0,0,0,0,给予人改过自新的机会是值得赞扬的。
2024/9/26 18:59,wb,0,0,0,0,理解且包容，期待她改过自新。
2024/9/26 18:59,wb,0,0,0,0,东北雨姐事件，理性包容，改过自新。
2024/9/26 18:59,wb,0,0,0,0,争议事件，期待雨姐积极改进。理性包容，给予改过机会。
2024/9/26 18:59,wb,0,0,0,0,姑且相信她的道歉吧，未来留下更好的形象。
2024/9/26 18:59,wb,0,0,0,0,东北雨姐要道歉，有些人支持有些人反对。希望她改正错误。
2024/9/26 18:59,wb,0,0,0,0,享受当下，快乐生活。
2024/9/26 18:59,wb,0,0,0,0,东北雨姐，吸取教训，未来更需谨慎。
2024/9/26 18:59,wb,0,0,0,0,以理性和包容的态度，给她改过自新的机会。
2024/9/26 18:59,wb,0,0,0,0,要学会理性看待事件，给人改过的机会。
2024/9/26 18:59,wb,0,0,0,0,东北雨姐应引以为戒，希望得到谅解。
2024/9/26 18:59,wb,0,0,0,0,希望东北雨姐能从这次事件中成长，未来更加谨慎。
2024/9/26 18:59,wb,0,0,0,0,希望东北雨姐能从中吸取教训，未来更谨慎。
2024/9/26 18:59,wb,0,0,0,0,东北雨姐，加油！未来会更好！
2024/9/26 18:59,wb,0,0,0,0,生活如诗，需细细品味。
2024/9/26 18:59,wb,0,0,0,0,支持东北雨姐，希望她改正错误。
2024/9/26 18:59,wb,0,0,0,0,理性包容，盼雨姐改过自新。
2024/9/26 18:59,wb,0,0,0,0,理性对待，给予改过机会，希望能反省。
2024/9/26 18:59,wb,0,0,0,0,东北雨姐能够改过自新，理性包容给机会。
2024/9/26 18:59,wb,0,0,0,0,东北雨姐能够勇于道歉，值得肯定与支持。
2024/9/26 18:59,wb,0,0,0,0,加油，东北雨姐，我们支持你！  不要轻易放弃，向前看！  为你的成长和进步点赞！
2024/9/26 18:59,wb,0,0,0,0,支持东北雨姐，理性包容，改过自新。
2024/9/26 18:59,wb,0,0,0,0,东北雨姐道歉，希望吸取教训，理性包容给她机会。
2024/9/26 18:59,wb,0,0,0,0,东北雨姐应引以为戒，积极改变。
2024/9/26 18:59,wb,0,0,0,0,东北雨姐值得大家给予改过自新的机会。 希望东北雨姐能借此事件教训改进自己。
2024/9/26 18:59,wb,0,0,0,0,东北雨姐，改过自新，理性包容，值得信任。
2024/9/26 18:59,wb,0,0,0,0,东北雨姐要吸取教训，理性包容给她机会。
2024/9/26 18:59,wb,0,0,0,0,东北雨姐反思，希望得到理解与支持。
2024/9/26 18:59,wb,0,0,0,0,支持东北雨姐，期待她改过自新。
2024/9/26 18:59,wb,0,0,0,0,东北雨姐，言行需审慎，改过自新。
2024/9/26 18:59,wb,0,0,0,0,应该原谅她，让她改过自新。
2024/9/26 18:59,wb,0,0,0,0,积极祝愿东北雨姐能改过自新。
2024/9/26 18:59,wb,0,0,0,0,东北雨姐要改正自己的错误。
2024/9/26 18:59,wb,0,0,0,0,东北雨姐应吸取教训，我们也要理性包容。
2024/9/26 18:59,wb,0,0,0,0,东北雨姐要改过自新，大家都应该包容。
2024/9/26 18:59,wb,0,0,0,0,男人觉得东北雨姐应该认错，并改过自新。
2024/9/26 18:59,wb,0,0,0,0,值得理性包容，给她改过自新的机会。
2024/9/26 18:59,wb,0,0,0,0,东北雨姐认错态度积极，值得理解支持。
2024/9/26 18:59,wb,0,0,0,0,东北雨姐应吸取教训，期待改变。
2024/9/26 18:59,wb,0,0,0,0,东北雨姐能反省改过，还行。
2024/9/26 18:59,wb,0,0,0,0,理性看待东北雨姐的道歉，给予改过自新的机会。
2024/9/26 18:59,wb,0,0,0,0,支持东北雨姐，希望她改过自新。
2024/9/26 18:59,wb,0,0,0,0,东北雨姐该反省，大家理性包容。
2024/9/26 18:59,wb,0,0,0,0,期待雨姐认错态度，大家理性心态面对。
2024/9/26 18:59,wb,0,0,0,0,秘书表示支持和鼓励东北雨姐的道歉和改进态度。
2024/9/26 18:59,wb,0,0,0,0,以理性和包容的心态给予改过自新的机会。
2024/9/26 18:59,wb,0,0,0,0,东北雨姐要虚心接受意见，向前看。
2024/9/26 18:59,wb,0,0,0,0,雨姐加油，我们支持你的改变和成长。
2024/9/26 18:59,wb,0,0,0,0,东北雨姐道歉事件，理性包容给予改过自新机会。
2024/9/26 18:59,wb,0,0,0,0,东北雨姐应引以为戒，大家理性包容。
2024/9/26 18:59,wb,0,0,0,0,理性包容，希望雨姐能吸取教训。
2024/9/26 18:59,wb,0,0,0,0,支持东北雨姐，希望她能吸取教训。
2024/9/26 18:59,wb,0,0,0,0,道歉是第一步，包容给她改过的机会。
2024/9/26 18:59,wb,0,0,0,0,东北雨姐事件，理性看待，给予改过自新的机会。
2024/9/26 18:59,wb,0,0,0,0,东北雨姐道歉值得肯定，希望能吸取教训。
2024/9/26 18:59,wb,0,0,0,0,争议中道出关键，引发共鸣，令人深思。
2024/9/26 18:59,wb,0,0,0,0,以理性包容的态度重新审视东北雨姐的言行。
2024/9/26 18:59,wb,0,0,0,0,东北雨姐，值得被包容和支持。
2024/9/26 18:59,wb,0,0,0,0,东北雨姐应认错并改正，理解包容给予机会。
2024/9/26 18:59,wb,0,0,0,0,东北雨姐勇于道歉，值得肯定和支持。
2024/9/26 18:59,wb,0,0,0,0,东北雨姐需反思，以理性包容给予改过机会。
2024/9/26 18:59,wb,0,0,0,0,东北雨姐要诚实面对自己的过错。
2024/9/26 18:59,wb,0,0,0,0,东北雨姐道歉，要理性包容给机会。
2024/9/26 18:59,wb,0,0,0,0,东北雨姐应从事件中吸取教训，大家理性包容。
2024/9/26 18:59,wb,0,0,0,0,理性包容待人宽容，改过自新本应是每个人的选择。
2024/9/26 18:59,wb,0,0,0,0,希望东北雨姐能真诚道歉，改正错误。
2024/9/26 18:59,wb,0,0,0,0,东北雨姐事件，理性看待，给改过自新机会。
2024/9/26 18:59,wb,0,0,0,0,希望她能真正反省并改正错误。
2024/9/26 18:59,wb,0,0,0,0,东北雨姐真诚道歉，值得我们给予理解和支持。
2024/9/26 18:59,wb,0,0,0,0,东北雨姐应该反思，希望她改过自新。
2024/9/26 18:59,wb,1,0,0,1,东北雨姐应谦虚反思，重整行为。
2024/9/26 19:00,wb,0,0,0,0,东北雨姐是好人
2024/9/26 19:00,wb,0,0,0,0,希望东北雨姐能吸取教训，未来更谨慎。
2024/9/26 19:01,wb,1,1,1,0,网红带货背后都是资本。它们介入的一般没啥好事
2024/9/26 19:01,wb,0,1,0,-1,那也是他做错了事情
2024/9/26 19:02,wb,1,1,1,0,真的失望，希望加强管理！货不对板还得挨揍？
2024/9/26 19:02,wb,0,0,0,0,希望诚信的 网红越来越少，社会更和谐，法律更有效。
2024/9/26 19:03,wb,1,1,1,0,说明本身人就不怎么样，所以才会塌
2024/9/26 19:03,wb,1,1,1,0,呵呵呵呵
2024/9/26 19:04,wb,1,1,1,0,这不是打假  典型的敲诈勒索外加赚流量  大家可以 但不能这么缺德吧
2024/9/26 19:04,wb,0,0,0,0,感觉还是要对得起粉丝和良心才对
2024/9/26 19:05,wb,1,1,1,0,现在的网红真容易塌房
2024/9/26 19:05,wb,0,0,0,0,首先要保证产品质量，再说其他的吧
2024/9/26 19:05,wb,0,1,0,-1,反正我没在她哪儿买过啥
2024/9/26 19:06,wb,0,0,0,0,真的是希望能够改正了吧
2024/9/26 19:06,wb,0,0,0,0,诚信经营才能留住粉丝
2024/9/26 19:06,wb,0,0,0,0,产品质量和服务质量一样重要
2024/9/26 19:06,wb,1,1,1,0,早点出来道歉不就好了
2024/9/26 19:06,wb,0,1,0,-1,当初她应该没有考虑好后果
2024/9/26 19:07,wb,1,1,1,0,卖假货的事儿怎么说？看风太大了害怕了？老话不会错:出来混迟早要还的
2024/9/26 19:08,wb,1,1,1,0,呸，没有她就没人认识辽宁了吗？
2024/9/26 19:09,wb,1,1,1,0,这些网红迟早的事情
2024/9/26 19:10,wb,1,1,1,0,少看这些网红，最后都是翻车
2024/9/26 19:10,wb,1,1,1,0,木薯粉对不对的起你的良心？木薯粉对不对得起你的家人？
2024/9/26 19:11,wb,1,1,1,0,她送检的能有问题？
2024/9/26 19:12,wb,1,1,1,0,根本没人懂
2024/9/26 19:12,wb,1,1,1,0,再回应也是摆拍事件啊
2024/9/26 19:14,wb,1,1,1,0,别整天弄这破玩意儿了。
2024/9/23 23:03,bili,1,1,1,0,那个9 18耗子和这个畸形都有几十上百万的粉丝，可见中国有多少大沙冰
2024/9/23 23:23,bili,1,1,1,0,恶人自有恶人磨
2024/9/23 23:25,bili,1,0,0,-1,网红
2024/9/23 23:36,bili,1,0,0,-1,代派不老铁?点个关注[呲牙]
2024/9/23 23:36,bili,1,1,1,0,你们通过手机看到的雨姐都是假的
2024/9/23 23:40,bili,1,0,0,-1,君子爱财取之有道，这不代表我们所有东北人！
2024/9/23 23:41,bili,1,1,1,0,不懂她的视频好看在哪
2024/9/23 23:43,bili,1,1,1,0,没打给钱，打了吃流量然后带货，怎么都是赢
2024/9/23 23:43,bili,1,1,1,0,你也不怎么样
2024/9/23 23:45,bili,0,0,0,0,看过315晚会，好像粉条这玩意市面上百分之90都有那个什么玩意木薯冒充一点成分，翻车了也正常
2024/9/23 23:53,bili,1,1,1,0,告诉你嗷，雨姐干啥都狠头
2024/9/23 23:54,bili,1,1,1,0,东白人总喜欢捧一些妖魔鬼怪当网红
2024/9/23 23:55,bili,1,1,1,0,b站大部分同时在dy直播卖货的up主，我看完直播回来一般都会取关[喜极而泣]
2024/9/24 0:05,bili,1,1,1,0,雨姐给你多少钱
2024/9/24 0:10,bili,1,1,1,0,你们团队应该是各大网红带货的品都买然后看那个有问题去敲一笔，这次没敲好被打了，我跟你说东北人竹杠真不好敲，东北人的性格容易挤眼，他可能瞬间不管自己卖假货这事直接问你是干啥的你算干啥的，至于你被囚禁好几个小时最后谅解了不知道出于什么原因，反正东北网红抽象的也多，而且东北人有个毛病人多了就沾点社会下次这种事直接举报相关部门，别自己去，也别想着敲一笔这本身就不对，打假跟勒索就一道线的事遇到狠人你就成勒索了。
2024/9/24 0:24,bili,1,1,1,0,那地方的有几个好人？
2024/9/24 0:26,bili,1,0,0,-1,身上有符文的都有点东西的[拥抱]
2024/9/24 0:27,bili,1,1,1,0,打一顿就好了老铁
2024/9/24 0:28,bili,1,1,1,0,虽然打人不对，但是打你活该，你有证据直接去举报啊，不是说有理就可以上人家门口骂人的，滚地龙出身的人，你伤人家财路，打你都轻的
2024/9/24 0:33,bili,1,1,1,0,吃粉条打粉丝没毛病老铁
2024/9/24 0:33,bili,1,0,0,-1,都是些什么人在买他们家的东西
2024/9/24 0:35,bili,1,1,1,0,找打
2024/9/24 0:35,bili,1,0,0,-1,雨姐干什么都狠头，带派不老铁！[doge]
2024/9/24 0:42,bili,1,1,1,0,太对了[辣眼睛]
2024/9/24 0:44,bili,1,1,1,0,该，你可以直接找警察，你是想讹人吗？怎么去他那了
2024/9/24 0:52,bili,1,0,0,-1,视频呢
