timestamp,platform,label1,label2,label3,diff,content
2024/9/25 13:32,bili,1,0,0,-1,其实正常来说，很多人都是在红薯粉里掺木薯粉，虽然也是卖假货，但毕竟也是很常见的现象，所以我确实也见怪不怪了。但是，重点在于这个博主发出来检验成分表里是检验出木薯成分，没有检验出红薯成分，我不知道是因为红薯成分过少检验不出来还是说直接干脆就压根全是木薯，这个很重要啊
2024/9/25 13:34,bili,1,1,1,0,"东北的大鹅沙东发，盘锦的螃蟹白天抓。
红薯的粉条没地瓜，沙包大拳头砸脑瓜。

农村就这生活，简简单单一顿揍。
带派不老铁！"
2024/9/25 13:34,bili,1,0,0,-1,里面是雨姐的声音吗
2024/9/25 13:43,bili,1,1,1,0,说的太多了都几把是生意流量，打假的带货的这帮大骗子
2024/9/25 13:58,bili,1,1,1,0,这发型说是女的，都勉强
2024/9/25 13:58,bili,0,0,0,0,好几个视频都拍到   那个破院子旁边有一幢很大的别墅  拐角是欧式那种柱子   保温是粉色的
2024/9/25 14:07,bili,1,0,0,-1,别打我求你了[大哭]
2024/9/25 14:09,bili,1,1,1,0,一瞅就不是好人呐，在北方女的如果她那种造型的十有八九都是混社会不是善茬
2024/9/25 14:20,bili,1,1,1,0,产品分儿b不值 这一百万都是消费者买单
2024/9/25 14:23,bili,1,1,1,0,雨姐的视频看一热闹就行，谁买我笑话谁一辈子[doge]
2024/9/25 14:40,bili,1,1,1,0,丢人现眼。装逼遭雷劈。
2024/9/25 14:41,bili,0,0,0,0,我之前也看到了那个红薯粉，因为我妈妈每年种很多红薯，我知道红薯粉产量低，我们家自己都不够吃的
2024/9/25 14:57,bili,1,0,0,-1,她谁啊哪个UP主啊
2024/9/25 14:58,bili,1,0,0,-1,https://b23.tv/wqEulpd
2024/9/25 15:04,bili,1,0,0,-1,甲壳虫汁
2024/9/25 15:26,bili,1,1,1,0,这长的可真他妈是个骑行中
2024/9/25 15:27,bili,1,1,1,0,"先做假大鹅，再蒸盘锦虾，端上木薯粉，打的直找妈，如果还粉她，那你就是瞎！

蟹不押韵，换成了虾[doge]"
2024/9/25 16:07,bili,1,1,1,0,刷到过东北雨姐，长相就像是个恶人相[喜极而泣]，但视频还是挺耐看的，这个打假博主也脑回路清奇，你逮到了就去告他啊，线下找人家干嘛，几千万粉丝挣得多想过去敲一笔吗[doge]
2024/9/25 16:10,bili,1,1,1,0,其实蛮有饼的，都检测出来了，不直接找官方，去送人头，笑拉了
2024/9/25 16:26,bili,1,1,1,0,东北黑势力大姐
2024/9/25 16:29,bili,1,1,1,0,雨姐不是好人 这打假的也不是好玩意 谁打假打到私底下去啊？不就是想要钱吗？[笑哭]
2024/9/25 16:47,bili,1,0,0,-1,@FoRinLo   小宝爱看的   说话
2024/9/25 16:54,bili,1,1,1,0,总结都没啥好玩意[吃瓜]
2024/9/25 16:58,bili,1,0,0,-1,说的太透了哈哈
2024/9/25 17:16,bili,1,0,0,-1,哈哈，吃瓜吃瓜
2024/9/25 17:25,bili,1,0,1,-1,假大鹅 洗澡螃蟹 假粉条[doge] 太多了
2024/9/25 17:31,bili,1,1,1,0,骗不下去了
2024/9/25 17:33,bili,1,1,1,0,这女的一看就超雄呀[吃瓜]
2024/9/25 17:57,bili,1,0,0,-1,我是觉得红薯粉条吃起来很怪了
2024/9/25 18:01,bili,1,0,1,-1,雨姐这狠人能打十个男人我都信
2024/9/25 18:12,bili,1,1,1,0,打假需要亲自带着摄像设备上门吗？这嘴上说着是打假，表现出来的是上门勒索啊。。。真犯法了还有帽子叔叔呢，感觉就是上门蹭流量蹭热度。
2024/9/25 18:37,bili,1,1,1,0,只为了挣钱，脸都不要
2024/9/25 18:55,bili,1,0,0,-1,看红薯粉过来的。
2024/9/25 19:09,bili,1,1,1,0,这是没讹到钱跑回来在发网上[笑哭]   而且这录音也太不全了  就这一句话   反正都臭了就都发出来让大家吃吃瓜啊
2024/9/25 19:21,bili,1,1,1,0,谁家好人长这样？没事老铁抗揍[doge]
2024/9/25 20:28,bili,1,0,0,-1,烙铁可真是太豪爽辣
2024/9/25 21:00,bili,1,0,1,-1,这人真是个女的吗
2024/9/25 21:09,bili,1,1,1,0,吃了你家的木薯粉力气能变大打人不[微笑]
2024/9/25 21:21,bili,1,1,1,0,卖假货怎么解决？
2024/9/25 21:33,bili,0,0,0,0,关注才能评论，懒得关注而已
2024/9/25 22:27,bili,1,1,1,0,带货的不是啥好东西 这些所谓打假的也是碰瓷的小丑罢了  用着打假的旗号到处碰瓷  我只能说被打纯活该
2024/9/25 22:38,bili,1,1,1,0,雨姐就是个黑恶势力团伙作案[打call]
2024/9/25 22:43,bili,1,1,1,0,别只光说人家雨姐打人问题，你上门也有问题
2024/9/25 22:44,bili,1,1,1,0,[doge]俩馒头踩一脚 没一个好饼
2024/9/25 23:09,bili,1,1,1,0,做人要诚实守信，这么大人了 还用人教。
2024/9/25 23:18,bili,1,0,0,-1,不是很明白，现在红薯怎么这么值钱啦。。以前在乡下，红薯除了拿来做淀粉或者红薯粉。大部分都拿来喂猪的。那玩意儿产量挺大的，我是真没整明白。
2024/9/25 23:27,bili,1,1,1,0,来东北，撞壁，你觉得有意思吗！不点你就怪了
2024/9/25 23:31,bili,1,0,0,-1,我们老家纯手工红薯粉比猪肉都贵都是散户自己做的去人家家里买。一般都是过年买点吃，炖菜什么的。
2024/9/25 23:37,bili,0,0,0,0,需要啥自己买不行吗？非要信网红，到底是哪些人在买不明白
2024/9/26 0:02,bili,1,1,1,0,热知识，你要是没假可打，这些打假的也不会直接去找你[doge]
2024/9/26 0:10,bili,1,0,0,-1,你说的对[呲牙]
2024/9/26 0:17,bili,1,1,1,0,正经人谁会留这种发型？
2024/9/26 0:19,bili,1,1,1,0,都是家人打你两下怎么啦！[吃瓜]
2024/9/26 0:28,bili,1,1,1,0,有没有东北人来给我解惑一下，我怎么感觉东北人很极端，好的很好，坏的很坏[笑哭][笑哭][笑哭]
2024/9/26 0:34,bili,1,0,0,-1,银银是影帝
2024/9/26 0:37,bili,1,1,1,0,不喜欢看，单纯的因为她丑[doge]
2024/9/26 0:53,bili,1,1,1,0,就是一群hsh
2024/9/26 0:58,bili,0,0,0,0,自家晒好的红薯粉看品相还要16-22一斤呢，吃是真的好吃[呲牙][呲牙]
2024/9/26 0:59,bili,1,1,1,0,不是挺好的 文体两开花直播口才好 线下拳头硬邦邦
2024/9/26 1:01,bili,1,1,1,0,带货网红对家人真好 那是真铿啊
2024/9/26 1:11,bili,1,0,0,-1,木薯红薯近乎五倍差价。
2024/9/26 1:12,bili,1,1,1,0,怎么说的，雨姐的体型和面相在农村就是不好惹的泼妇，我家林场就有挺多这样的，要么热心肠要么横着走不讲理，而且一开始的设定就是普通农村老百姓，但有几个普通农村老百姓会拍视频以及各种转场啥的，这种人设和之前星光大道的阿宝差不多，雨姐以前也许是种地的，但多少在那片有点实力，
2024/9/26 1:19,bili,1,1,1,0,长得就不像好人，家人们你们怎么看[呲牙]
2024/9/26 1:20,bili,1,0,0,-1,放到古代，打架那几个人估计已经死了[doge]
2024/9/26 1:26,bili,1,0,0,-1,其实也可以这么说互联网时代只有这样的人能赚钱
2024/9/26 1:27,bili,1,0,0,-1,哦，那会贾冰他们有个新电影，这衣服都是，趁热度宣传去了
2024/9/26 1:31,bili,1,1,1,0,打的好，那群所谓打假名为诈骗打死一个算一个
2024/9/26 1:38,bili,1,1,1,0,那是捡手机，憨批
2024/9/26 1:46,bili,1,1,1,0,删评论
2024/9/26 1:51,bili,1,1,1,0,看看她们耍猴就行了，干嘛要听她忽悠去买货？哪有什么真的东西？
2024/9/26 1:57,bili,1,1,1,0,豆腐西施看着老实，但是他拿起板砖的样子是那么的熟练。
2024/9/26 2:08,bili,1,0,0,-1,亮子你没看见视频里有纹身吗[doge]
2024/9/26 2:09,bili,1,1,1,0,问你抗揍不[doge]
2024/9/26 2:12,bili,1,1,1,0,这几个?，在东北就纯小地痞，该溜子那种的。
2024/9/26 2:16,bili,1,1,1,0,就这事央视不都说了这个事吗？红薯粉没红薯，有木薯粉的这事，从根本讲打假算造谣，我看这群打假的都没有一个好货，以前那个铁头不也是打假，你在看，打架的哪有做公益的，不是捞钱就是威胁捞钱，还特么有人给这帮打假网红站队[笑哭]
2024/9/26 2:18,bili,1,0,0,-1,抖音那会一堆看脸就知道忠厚老实的[doge]怎么看的？
2024/9/26 2:23,bili,1,0,0,-1,玩哔站吃瓜 好像不会被骗
2024/9/26 2:24,bili,1,1,1,0,这比到底男的女的？？？？？
2024/9/26 2:31,bili,1,0,0,-1,带派不，家人们
2024/9/26 2:33,bili,1,1,1,0,老蒯是幕后黑手
2024/9/26 2:39,bili,1,0,0,-1,标题党是吧，左神明明说的是“我之前，我对象老拉着我看”，你给写“我之前对象老拉着我看”P神会误会的[doge]
2024/9/26 2:40,bili,1,1,1,0,老蒯怎么下得去吊的
2024/9/26 2:51,bili,1,1,1,0,农村就这生活，简简单单一顿揍，带派不老铁[doge]
2024/9/26 2:56,bili,1,0,0,-1,"佩斯，上火枪！
让他知道咱们东北老铁的力量！"
2024/9/26 3:00,bili,1,1,1,0,我之前还看有人说她长的和庙里的菩萨一样，我都笑死了
2024/9/26 3:02,bili,1,0,0,-1,所以说带货主播卖的东西到底是谁在买啊[无语][无语][无语]
2024/9/26 3:04,bili,1,1,1,0,我只能说都不是啥好东西  狗咬狗一嘴毛[笑哭]
2024/9/26 3:05,bili,1,0,0,-1,看个乐呵得了，还真去抖音买啊
2024/9/26 3:11,bili,1,1,1,0,5斤27块钱……我们这找关系特别好的买也是十几块钱一斤，这怎么可能是真的[辣眼睛]
2024/9/26 3:15,bili,1,1,1,0,地痞流氓的模样我只能说[吃瓜]
2024/9/26 3:18,bili,1,1,1,0,假大鹅就被锤过吧，后面不了了之
2024/9/26 3:19,bili,1,1,1,0,佩斯，关门，一个不留[笑哭][笑哭][笑哭]
2024/9/26 3:19,bili,1,0,0,-1,哈哈哈狗咬狗
2024/9/26 3:20,bili,1,0,0,-1,我要打DNF
2024/9/26 3:21,bili,1,1,1,0,虽然不想说，但是，谁家好人这个发型[笑哭]
2024/9/26 3:25,bili,1,1,1,0,卖假货丧良心啊
2024/9/26 3:26,bili,1,1,1,0,雨姐干什么都狠头嘀
2024/9/26 3:30,bili,1,1,1,0,敢去找超雄人士讨说法？打你算轻的的！
2024/9/26 3:30,bili,1,1,1,0,来东北找雨姐，指定有你好果汁吃?
2024/9/26 3:33,bili,1,0,0,-1,山本的基地
2024/9/26 3:34,bili,1,1,1,0,这打假的也有不少心眼子谁家好人打假私下去人家里啊要换我我也得揍这打假的还得往死揍想捏人把柄让人听你的？有证据了不先找官方叫上官方再去谁都没损失
2024/9/26 3:38,bili,1,0,0,-1,当时我看程野都去了叫姐，我就感觉不简单。[喜极而泣][doge_金箍]
2024/9/26 3:44,bili,1,1,1,0,刷到过雨姐几次，光是看封面就不想点进去，看着就不像什么好人[笑哭]
2024/9/26 3:46,bili,1,1,1,0,这种网红暴雷直接封杀就老实了
2024/9/26 3:47,bili,1,1,1,0,网红和主播就是毒瘤！
2024/9/26 3:53,bili,1,1,1,0,前段时间还是吹捧的，这怎么就直接反转了[吃瓜]我之前还纳闷谁看这玩意呢。
2024/9/26 3:54,bili,1,1,1,0,买网红的产品的都是沙雕
2024/9/26 3:57,bili,1,1,1,0,东北的大鹅山东发，盘锦的螃蟹白天抓，红薯的粉条木薯刮，雨姐的拳头敲脑瓜，农村就这生活，简简单单一顿揍，带派不老铁[doge]佩斯，关门，上电炮
2024/9/26 3:59,bili,1,1,1,0,农村就这生活，简简单单一顿大电炮[吃瓜]
2024/9/26 4:11,bili,1,1,1,0,人家是之前去别的餐馆吃的木薯，你这倒好标题意思还以为是吃的东北雨姐的呢，你这种人真是看热闹不嫌事大[微笑]（4Rup
2024/9/26 4:11,bili,1,1,1,0,这猪b发型
2024/9/26 4:13,bili,1,1,1,0,一个月两个大网红出事[喜极而泣]
2024/9/26 4:17,bili,1,1,1,0,哪个男人打得过她 这块头 活生生把人打出脑震荡也不稀奇 反正视频拍的太夸张了 这么多人每天一起拍视频 都没个正经工作
2024/9/26 4:19,bili,1,1,1,0,马后炮
2024/9/26 4:23,bili,1,0,0,-1,不懂红薯粉条怎么作假。。这玩意还要做假
2024/9/26 4:32,bili,1,0,0,-1,家人们带派不带派。[doge]大东北是我的家乡，我就在这旮旯土生土长
2024/9/26 4:33,bili,1,0,0,-1,BGM笑死[笑哭]
2024/9/26 4:36,bili,1,1,1,0,[doge]已取关.从来没买过东西，那个翠花长的和猪八戒一样。哈，
2024/9/26 4:36,bili,1,1,1,0,一堆毒瘤组成的毒瘤！
2024/9/26 4:37,bili,1,1,1,0,B太就没发现他好姐姐直播带假货吗[doge]
2024/9/26 4:37,bili,1,1,1,0,假一赔万，冥币支付
2024/9/26 4:39,bili,1,1,1,0,售卖假货直接举报平台啊。千里迢迢跑去干啥啊？
2024/9/26 4:39,bili,1,1,1,0,家人们吃了吗。没吃，吃我一拳[doge]
2024/9/26 4:41,bili,1,1,1,0,[doge]都不是好东西，敲诈勒索碰到了黑社会。
2024/9/26 4:42,bili,1,1,1,0,都什么年代了，还有蠢蛋在直播间里买东西。
2024/9/26 4:43,bili,1,1,1,0,看雨姐那造型和块头就像东北黑社会一样 不像好人
2024/9/26 4:45,bili,1,0,0,-1,@东北雨姐 带派不？
2024/9/26 4:47,bili,1,1,1,0,太热情了老铁，还请你吃大砖头[doge]
2024/9/26 4:48,bili,1,1,1,0,不是，有问题你就举报啊，去人家家里骑脸？
2024/9/26 4:49,bili,1,0,0,-1,我们这里就有粉条厂，红薯的确实很少，大部分都是木薯粉玉米淀粉，所谓的红薯粉条其实根本就没有纯红薯的，除非是自己亲手做的，买的都不可信
2024/9/26 4:49,bili,1,0,0,-1,从来不在直播间买东西，浪费时间听主播讲，有时候还要抢，真是费力不讨好
2024/9/26 4:51,bili,1,0,0,-1,怎么样老铁？拳头铁不铁吧
2024/9/26 4:51,bili,1,1,1,0,什么人会在她店里买东西啊？看面相就不是好人。
2024/9/26 4:53,bili,1,1,1,0,看视频就看视频，去直播间买东西买到假了就得认，你就那个脑子[doge]
2024/9/26 4:53,bili,1,1,1,0,东北好人不会去做直播的，东北九年义务教育程度非常高，大学生也高。工业化最早的地方。结果都是这帮东西败坏名声。
2024/9/26 4:54,bili,1,0,0,-1,话说，东北雨姐以前是干啥的[吃瓜]
2024/9/26 4:55,bili,1,1,1,0,有些烂货还在洗，人家买到假货是 上门要赔偿有什么问题？某些烂货都说成是两边不是好人。这不就是在混淆视听嘛。
2024/9/26 4:56,bili,1,1,1,0,抖音平台一点责任没有呀
2024/9/26 4:57,bili,1,0,0,-1,这个红薯辛寄费是不是也带了啊[doge_金箍]
2024/9/26 4:59,bili,0,0,0,0,我们这土豆粉特好吃(可以看随便视频)一斤才2块多[尴尬]
2024/9/26 5:01,bili,1,1,1,0,都是些社会农村边角料，互联网赏给了这群乞丐一口吃的，还指望这些人呢？都是些纯纯边角料……
2024/9/26 5:01,bili,1,0,0,-1,【感受下千万网红东北雨姐的压迫感-哔哩哔哩】 https://b23.tv/dJVMCoY
2024/9/26 5:03,bili,1,1,1,0,超雄老姐?
2024/9/26 5:04,bili,1,1,1,0,[滑稽]买东西的时候你是我家人  来打假的时候不好意思 佩斯上电炮
2024/9/26 5:06,bili,1,0,0,-1,[星星眼]b太不是和她是好朋友吗[doge][打call]
2024/9/26 5:07,bili,1,1,1,0,真的有人觉得雨姐长得像善人[喜极而泣][喜极而泣][喜极而泣][喜极而泣][喜极而泣][喜极而泣][喜极而泣]
2024/9/26 5:08,bili,1,1,1,0,真他妈给东北人丢脸。带货的有一个算一个，90是坑人的东西。
2024/9/26 5:10,bili,1,0,1,-1,看他们视频只有佩斯和翠花看着是个好人样[妙啊]
2024/9/26 5:12,bili,1,1,1,0,我今天不让你倾家荡产 手底下的可不是徒弟都是打手
2024/9/26 5:14,bili,1,0,0,-1,木薯粉有毒，猫砂就有木薯成分
2024/9/26 5:15,bili,1,1,1,0,感觉他们就是一群皮笑肉不笑的。。。
2024/9/26 5:15,bili,1,1,1,0,有错没错都是树大招风
2024/9/26 5:17,bili,1,1,1,0,没事，从来没关注[滑稽][滑稽][滑稽]
2024/9/26 5:23,bili,1,1,1,0,无论工农，都不能脱产，否则就代表不了这群人。为什么稻田蟹的视频招人诟病？因为你不在生产第一线拍摄的。up说的好，当你的工棚变成了摄影棚，那谎言就只能验证谎言。当她握着流量，只会选择她获利最大的。木薯粉翻车也迟早的事，不是木薯粉，也迟早在她只看报价单的产品上翻车。
2024/9/26 5:26,bili,1,1,1,0,明面上，家人们呐～实际上，这小韭菜们奥～真是人傻钱多～[doge]
2024/9/26 5:30,bili,1,1,1,0,带货的尽头就是坑家人
2024/9/26 5:31,bili,1,0,0,-1,女兽人
2024/9/26 5:33,bili,1,1,1,0,看那个雨姐那气质，不肢解人就不错了[doge]
2024/9/26 5:33,bili,1,0,0,-1,9月是塌房月吗，看的乐子塌房了，看的游戏主播塌了，罗老师最近说也塌了[笑哭]
2024/9/26 5:35,bili,1,0,0,-1,绺子啊
2024/9/26 5:43,bili,1,1,1,0,长得跟受了辐射似的
2024/9/26 5:51,bili,1,1,1,0,最讨厌这些网红搞直播的屯子人败坏名声丢人。不过哈尔滨已经被外地屯子人占领了操着一口地道的东北话天天素质低下
2024/9/26 5:58,bili,1,1,1,0,B太没发现他好姐姐直播带假货吗[doge]
2024/9/26 6:01,bili,1,1,1,0,赚黑心钱都没好下场
2024/9/26 6:02,bili,1,0,0,-1,网红确实赚钱，雨姐一个60秒视频100万，那个251大可一个60秒视频39000，之前拖欠返点，现在评论区也没人提了，难怪大家都要做网红
2024/9/26 6:02,bili,1,1,1,0,买了内裤质量特别好，入口即化全家人都爱吃
2024/9/26 6:06,bili,0,1,1,1,买了，内裤质量特别好。入口即化全家人都爱吃
2024/9/26 6:15,bili,1,1,1,0,人家坑的是自己家人，没有坑其他人。
2024/9/26 6:20,bili,1,1,1,0,对西方什么新事物新产业不理解，统一判定为资本下棋割韭菜，然后自己只能卷直播带货，直播兴果战略[doge]
2024/9/26 6:21,bili,1,1,1,0,为啥和李炮儿合拍过段子的网红塌方的这么多。。。。
2024/9/26 6:23,bili,1,0,0,-1,根本就没关注这类人……
2024/9/26 6:24,bili,1,1,1,0,只坑家人们
2024/9/26 6:25,bili,1,1,1,0,给东北丢脸
2024/9/26 6:26,bili,1,1,1,0,买货的都是傻子，这种看看就算了，线上正规厂商卖的多的是
2024/9/26 6:28,bili,1,0,0,-1,墙倒众人推，树倒猕猴散。互联网你我都是看乐子的
2024/9/26 6:31,bili,1,1,1,0,雨姐面相太凶，发型也留的得太离谱
2024/9/26 6:32,bili,1,1,1,0,佩斯，电炮
2024/9/26 6:37,bili,1,0,0,-1,说实话也不是什么很大的事，停止售卖就行了，打人确实是最差的应对方式了
2024/9/26 6:39,bili,1,0,0,-1,合肥市监局带的好节奏啊，网红只是广告商[呲牙]
2024/9/26 6:40,bili,1,0,0,-1,我家有个盘锦亲戚，一直说给我们说盘锦的螃蟹可好吃了，每次来我家都拖家带口的，连吃带拿的，但是我都42了就没吃上盘锦螃蟹[笑哭]所以一直觉得东北人并没想象中的那么豪爽[笑哭]
2024/9/26 6:41,bili,1,1,1,0,打假打出了假货 为什么不第一时间去报告相关部门 而是偷摸的找到某大主播“要说法” 而被打了没有“要到说法”就曝光出来了 如果“要到了说法”是不是就不会曝光了 其次 作为大主播 如果真的这么打人了 那肯定是不对的 就算他是报着某些目的去要说法 那你打人了 肯定就没理了
2024/9/26 6:45,bili,1,1,1,0,还好这些带货网红只卖家人[滑稽][滑稽][滑稽]
2024/9/26 6:47,bili,1,0,0,-1,[喜极而泣]能在平台直接买非要让人过一手，不懂这些在主播买东西的家人
2024/9/26 6:48,bili,1,1,1,0,替三只羊转移视线？
2024/9/26 6:52,bili,1,1,1,0,网红终点是带货。记住只要带了货，就到终点了。很多网红团队水平真的不咋高，多少带货网红翻车都翻在选品上，一点记性都不长。
2024/9/26 6:55,bili,1,1,1,0,假货经济，我们的经济只能靠这些东西来支撑，明眼人都能看出来有问题的事情就是没人管你说奇怪不奇怪，以后我也要学会怎么坑人，反正不用负责
2024/9/26 6:58,bili,1,1,1,0,嗨，带货的有几个好人？再说了，别人只坑家人，是吧，家人们，来，给家人们上链接[doge]
2024/9/26 7:01,bili,1,1,1,0,老祖宗传下来的面相论还是有道理的，他们俩夫妻面相一个凶神恶煞一个阴险奸诈
2024/9/26 7:03,bili,1,1,1,0,傻子还是多，还是相信她，无语，一看就不是好人
2024/9/26 7:08,bili,1,0,0,-1,鲜香至佳
2024/9/26 7:09,bili,1,0,0,-1,雨姐教你怎么打[doge]
2024/9/26 7:11,bili,1,1,1,0,东北可不止一个园区[doge]，还是那句话，东北人不是活雷锋就是……[doge]
2024/9/26 7:12,bili,1,0,0,-1,发现土嗨还真挺好火
2024/9/26 7:14,bili,1,0,0,-1,感谢曝光
2024/9/26 7:15,bili,1,1,1,0,有的人闻着味儿就开始地图炮了，嗯嗯嗯对对对~你们地区从盘古开天地开始就全是好人了~从猿人时期你们地区就全是大善人了~全中国的坏事全是我们地区干的行了吧~监狱里关的人全是我们地区的人行了吧~
2024/9/26 7:18,bili,1,1,1,0,白瞎哪俩个胖娘们了，本来就找不到男人，这下更找不着了
2024/9/26 7:22,bili,1,1,1,0,全是厦鼻
2024/9/26 7:23,bili,1,0,0,-1,我感觉她是女同
2024/9/26 7:26,bili,1,0,0,-1,【三分钟详解！红薯粉条里到底能不能用木薯？【主播说三农】-哔哩哔哩】 https://b23.tv/Tw8FAQh
2024/9/26 7:27,bili,1,0,0,-1,不会来长沙打我吧？[doge]
2024/9/26 7:35,bili,1,0,0,-1,开头第一个是不是真人版的波刚[doge]
2024/9/26 7:37,bili,1,1,1,0,这面相，这发型，这体格，走在大街上都没人敢惹，还上门打假，纯送
2024/9/26 7:38,bili,1,0,0,-1,一直听人说东北人豪爽耿直，一直只信豪爽
2024/9/26 7:44,bili,1,0,0,-1,我的妈呀！那个地方千万不能再去了！[笑哭]
2024/9/26 7:49,bili,1,0,0,-1,死刑
2024/9/26 7:59,bili,1,1,1,0,面由心生，就那个老蒯一看就不是好人。
2024/9/26 7:59,bili,1,0,0,-1,男的怎么叫姐？
2024/9/26 8:04,bili,1,0,0,-1,就这体量好好做真诚一点，两三年赚的钱几十辈子都花不完，不理解。
2024/9/26 8:07,bili,1,1,1,0,去这种直播间买东西的人我是真不理解，不愁卖的东西也不需要吆喝，人一口一个家人们就用这些破玩意把你的子儿赚了你还以为自己捡多大漏了，那以后市场上没好东西了，产品质量还不如主播一句slogan重要，真就劣币驱逐良币[微笑]
2024/9/26 8:08,bili,1,1,1,0,[doge]主播只坑家里人，真好。
2024/9/26 8:09,bili,1,1,1,0,我就这样说吧，既然塌房过一次，就会有第二次。还是有人信那她当老铁，活该。  花惯100  怎么会去选择花10块呢。
2024/9/26 8:10,bili,1,1,1,0,谁好人留这发型啊，我还以为黑涩会呢[笑哭]除非搞艺术的和演员吧[doge]
2024/9/26 8:12,bili,1,0,0,-1,来喽[doge]
2024/9/26 8:12,bili,1,0,0,-1,前排围观
2024/9/26 8:12,bili,1,0,0,-1,2
2024/9/26 8:12,bili,1,0,0,-1,前排围观
2024/9/26 8:12,bili,1,0,0,-1,来了[星星眼]
2024/9/26 8:13,bili,1,0,0,-1,[打call]
2024/9/26 8:13,bili,1,0,0,-1,冲
2024/9/26 8:13,bili,1,1,1,0,哎，感觉只要扯上卖货，就没有一个是不塌房的[笑哭]
2024/9/26 8:13,bili,1,0,0,-1,你说的对但是东北的大鹅山东发，盘锦的螃蟹白天抓，红薯的粉条木薯刮，雨姐的拳头敲脑瓜，农村就这生活，简简单单一顿揍，带派不老铁。[doge]
2024/9/26 8:13,bili,1,0,0,-1,前排
2024/9/26 8:13,bili,1,0,0,-1,钱赚着，有良心就行，我还是相信你的，带派噢[doge]
2024/9/26 8:13,bili,1,1,1,0,百分之八十讨厌东北的人都是受短视频的影响，美拍时代的东北网红就开始当二波一，中期快手更是群魔乱舞了，搞的现在都成刻板印象了。网上说的重工业烧烤轻工业直播，灰色产业更是广为流传的一句 来老弟跟姐走上楼玩一会儿吧，全是拜这群网红所赐
2024/9/26 8:13,bili,1,0,0,-1,围观
2024/9/26 8:13,bili,1,1,1,0,我信了，我怕雨姐用木薯粉条揍我。
2024/9/26 8:14,bili,1,0,0,-1,吃瓜[吃瓜]
2024/9/26 8:14,bili,1,0,0,-1,一分钟前
2024/9/26 8:14,bili,1,1,1,0,对得起自己的粉丝，只骗粉丝好感动
2024/9/26 8:14,bili,1,1,1,0,别代表东北了，姐，改辽宁得了，行吗
2024/9/26 8:14,bili,1,0,0,-1,别删评论啊，标记一下
2024/9/26 8:14,bili,1,0,0,-1,老蒯都憔悴了
2024/9/26 8:15,bili,1,0,0,-1,[吃瓜][吃瓜]
2024/9/26 8:15,bili,1,0,0,-1,上监控
2024/9/26 8:15,bili,1,0,0,-1,雨将军，请下令吧[doge]
2024/9/26 8:15,bili,1,1,1,0,[吃瓜]卖假货怎么不说呢
2024/9/26 8:15,bili,1,0,0,-1,哈哈哈哈哈哈 老拐
2024/9/26 8:15,bili,1,0,0,-1,谁敢横刀立马，唯我雨大将军！
2024/9/26 8:15,bili,1,0,0,-1,刚从视频号过来[doge][doge][doge]
2024/9/26 8:16,bili,1,0,0,-1,[吃瓜][吃瓜][吃瓜]
2024/9/26 8:16,bili,1,1,1,0,那一句高低给你弄的倾家荡产，瞬间不喜欢了[吃瓜][吃瓜][吃瓜]
2024/9/26 8:16,bili,1,1,1,0,横你?呢
2024/9/26 8:16,bili,1,0,0,-1,人多了再来看看
2024/9/26 8:16,bili,1,0,0,-1,这不是特效扭曲，也不是截屏造成的。我想知道这是怎么长的[笑哭][笑哭][笑哭]
2024/9/26 8:16,bili,1,0,0,-1,说了十分钟，木薯粉条你是只字不提？
2024/9/26 8:16,bili,1,0,0,-1,八大金刚[笑哭][笑哭][笑哭]
2024/9/26 8:16,bili,1,0,0,-1,精彩
2024/9/26 8:16,bili,1,0,0,-1,tree花呢
2024/9/26 8:16,bili,1,0,0,-1,带派不，老铁[doge]
2024/9/26 8:17,bili,1,1,1,0,你要说负法律责任！
2024/9/26 8:17,bili,1,0,0,-1,[doge]这不就是李鹤彪事件么
2024/9/26 8:17,bili,1,0,0,-1,所以粉条是啥做滴[doge]？
2024/9/26 8:17,bili,1,1,1,0,主要是有问题也不能这样解决啊，这又不是民事纠纷，几个人直接上门录像明显就是打着名头来讹诈的，。
2024/9/26 8:17,bili,1,0,0,-1,小弟。大华。佩斯。老蒯。其他人认不出来了
2024/9/26 8:17,bili,1,0,0,-1,前排
2024/9/26 8:17,bili,1,0,0,-1,相信雨姐，顶
2024/9/26 8:17,bili,1,0,0,-1,你们应该和三只羊联动
2024/9/26 8:17,bili,1,1,1,0,无意点开，呵呵
2024/9/26 8:17,bili,1,1,1,0,从来不道歉，闹大了才出来解释事情经过。一次两次大家还勉强愿意信你，现在第三次了嗷[doge]
2024/9/26 8:17,bili,1,0,0,-1,我就是看段子，别的不管，人红是非多不稀奇，段子我很喜欢
