timestamp,platform,label1,label2,label3,diff,content
2024/9/26 17:35,wb,0,0,0,0,结局还是让人非常的能理解很有意思的
2024/9/26 17:35,wb,1,0,0,-1,可是她打人也是真事啊
2024/9/26 17:35,wb,0,0,0,0,是遇到这样的事也是让人非常的不理解
2024/9/26 17:36,wb,0,0,0,0,希望以后不要再出现这种欺骗的行为了
2024/9/26 17:35,wb,0,1,1,1,以后不要把消费者当傻瓜骗
2024/9/26 17:35,wb,0,0,0,0,这些网红怎么隔三差五出事呢？
2024/9/26 18:44,wb,0,1,1,1,救命 怎么感觉后面的人都是一脸横肉
2024/9/26 17:36,wb,0,1,1,1,在此之前你连辽宁都不知道？
2024/9/26 19:03,wb,0,0,0,0,咋这样呢
2024/9/26 19:04,wb,0,1,1,1,道歉就是要接着赚米
2024/9/26 19:02,wb,0,1,1,1,直播带货得不严吗？这种伤害得多大呀。
2024/9/26 19:02,wb,0,0,0,0,说得对，希望平台能真正管理起来。
2024/9/26 19:02,wb,0,1,1,1,带货不能为所欲为 道歉也没有 用，严重点才行
2024/9/26 19:02,wb,0,0,0,0,同意，这种影响太坏了，应该严惩！
2024/9/26 17:16,wb,0,0,0,0,无语了
2024/9/26 17:27,wb,0,1,1,1,打假人有问题，雨姐卖的假冒伪劣产品也有问题，而且很多产品都有问题，大哥不笑二哥
2024/9/26 17:20,wb,0,0,0,0,对啊
2024/9/26 17:23,wb,1,0,0,-1,阅
2024/9/26 17:19,wb,1,0,1,-1,她谁
2024/9/26 18:59,wb,1,1,1,0,离谱
2024/9/26 19:04,wb,0,0,0,0,希望东北雨姐能从中吸取教训，未来更加谨慎。
2024/9/26 19:03,wb,0,0,0,0,期待雨姐未来更成熟。
2024/9/26 19:00,wb,0,0,0,0,希望东北雨姐能从中成长，未来更谨慎。
2024/9/26 19:00,wb,0,0,0,0,希望东北雨姐能从这次事件中成长，未来更谨慎。
2024/9/26 18:59,wb,0,1,1,1,希望雨姐能吸取教训，重视自己言行。
2024/9/26 18:59,wb,0,0,0,0,东北雨姐态度诚恳，未来改进。理性包容给机会。
2024/9/26 18:59,wb,0,0,0,0,东北雨姐加油，吸取教训，未来更精彩！
2024/9/26 18:59,wb,0,0,0,0,东北雨姐更新态度，值得信任。
2024/9/26 18:59,wb,0,0,0,0,东北雨姐需要反省，希望大家理性包容。
2024/9/26 18:59,wb,0,0,0,0,东北雨姐加油，未来会更好！
2024/9/26 18:59,wb,0,0,0,0,东北雨姐加油，相信你会越来越好！
2024/9/26 18:59,wb,0,0,0,0,东北雨姐自我反省，需要大家包容理解。
2024/9/26 18:59,wb,0,0,0,0,积极正能量，珍惜改过机会。
2024/9/26 18:59,wb,0,0,0,0,东北雨姐：下次记得带伞，别让雨淋湿了心情！???
2024/9/26 18:59,wb,0,0,0,0,支持道歉态度，期待改变和成长。
2024/9/26 18:59,wb,0,0,0,0,理解并支持东北雨姐的自我反思。
2024/9/26 18:59,wb,0,0,0,0,东北雨姐加油，改过自新，未来可期！
2024/9/26 18:59,wb,0,0,0,0,言行未慎，诗人谅解宽容，期盼改过。
2024/9/26 18:59,wb,0,0,0,0,东北雨姐应该好好反省再做出改变。
2024/9/26 18:59,wb,0,0,0,0,东北雨姐已认错，观众宽容给她机会。
2024/9/26 18:59,wb,0,0,0,0,对东北雨姐的行为持谨慎态度。
2024/9/26 18:59,wb,0,0,0,0,对东北雨姐表示理解和希望她能改正。
2024/9/26 18:59,wb,0,0,0,0,午后阳光，花香四溢，惬意享受生活。
2024/9/26 18:59,wb,0,0,0,0,道歉态度积极，希望大家理性包容。
2024/9/26 18:59,wb,0,0,0,0,东北雨姐，反思成长，理解包容，共创更好。
2024/9/26 18:59,wb,0,0,0,0,东北雨姐应该反思并改正，大家也理性包容。
2024/9/26 18:59,wb,0,0,0,0,东北雨姐道歉事件，理性包容给予改过机会。
2024/9/26 18:59,wb,0,1,1,1,东北雨姐，希望你能改过自新。
2024/9/26 18:59,wb,0,0,0,0,尊重她的选择，期待她改进。
2024/9/26 18:59,wb,0,0,0,0,积极向上，希望她能改过自新。
2024/9/26 18:59,wb,0,0,0,0,东北雨姐道歉了，希望她能够吸取教训，回归正途
2024/9/26 18:59,wb,0,0,0,0,东北雨姐态度有待改善，理性看待事件。
2024/9/26 18:59,wb,0,0,0,0,快来体验现在的乐趣吧！
2024/9/26 18:59,wb,0,0,0,0,花开如期待，春天如期而至。
2024/9/26 18:59,wb,0,0,0,0,雨姐的言行引起公众关注，需反思
2024/9/26 18:59,wb,0,0,0,0,希望东北雨姐能反思并改过自新。
2024/9/26 18:59,wb,0,1,1,1,东北雨姐要学会改过自新。
2024/9/26 18:59,wb,0,0,0,0,乐观积极，享受当下，珍惜每一刻。
2024/9/26 18:59,wb,0,0,0,0,东北雨姐应引以为戒，处理更谨慎。
2024/9/26 18:59,wb,0,0,0,0,花香树影，笑脸阳光果香，美好无限。
2024/9/26 18:59,wb,0,0,0,0,东北雨姐要好好反省，大家都希望她能改过。
2024/9/26 18:59,wb,0,0,0,0,雨姐应反思，希望大家理性包容。
2024/9/26 18:59,wb,0,0,0,0,快来感受当下的乐趣吧！
2024/9/26 18:59,wb,0,0,0,0,#雨姐事件#理性包容，改过自新，给予机会。
2024/9/26 18:59,wb,0,0,0,0,希望雨姐能改过自新，大家理解包容。
2024/9/26 18:59,wb,0,0,0,0,东北雨姐应该思考反省，大家也应理性包容。
2024/9/26 18:59,wb,0,0,0,0,东北雨姐希望大家理性包容，给机会。
2024/9/26 18:59,wb,0,0,0,0,作为小说家，我觉得这段评论很平实但有感染力。
2024/9/26 18:59,wb,0,0,0,0,理性包容，给予改过机会，相信她能成长。
2024/9/26 18:59,wb,0,0,0,0,积极反思，理性包容，改过自新。
2024/9/26 18:59,wb,0,0,0,0,东北雨姐已认错态度诚恳，希望大家包容。东北雨姐态度诚挚，望大家以包容心态对待。
2024/9/26 18:59,wb,0,0,0,0,希望雨姐能反思言行，大家包容理性对待。
2024/9/26 18:59,wb,0,0,0,0,东北雨姐应引以为戒。愿她改过自新。
2024/9/26 18:59,wb,0,0,0,0,出错后的反思和包容态度值得赞赏。
2024/9/26 18:59,wb,0,0,0,0,东北雨姐态度认真，值得信任。
2024/9/26 18:59,wb,0,0,0,0,东北雨姐应该虚心接受指教，改进自己。
2024/9/26 18:59,wb,0,0,0,0,东北雨姐道歉值得尊重，改过自新经得起等待。
2024/9/26 18:59,wb,0,0,0,0,悠米呼吁理性和包容，是一种高尚情操。
2024/9/26 18:59,wb,0,0,0,0,尊重态度，呼吁包容和理性对待。
2024/9/26 18:59,wb,0,0,0,0,东北雨姐要反省道歉，大家也要理性包容。
2024/9/26 18:59,wb,0,0,0,0,言行不慎需反思，宽容给予改过机会。
2024/9/26 18:59,wb,0,0,0,0,东北雨姐道歉，未来自省改过，理性包容。
2024/9/26 18:59,wb,0,0,0,0,秘书愿意看到雨姐能真诚道歉并改正。
2024/9/26 18:59,wb,0,0,0,0,理性包容，给予改过机会，东北雨姐道歉。
2024/9/26 18:59,wb,0,0,0,0,请大家理性包容东北雨姐，给她改过自新的机会。
2024/9/26 18:59,wb,0,0,0,0,东北雨姐，言行自省，理性包容，改过自新。
2024/9/26 18:59,wb,1,0,0,-1,富翁注重原则，期待她认错并改进。
2024/9/26 18:59,wb,0,0,0,0,态度褒贬不一，但期待她改进。
2024/9/26 18:59,wb,0,0,0,0,道德诚信，改过自新，理性包容。
2024/9/26 18:59,wb,0,0,0,0,东北雨姐道歉事件，我们应理性包容给与改正机会。
2024/9/26 18:59,wb,0,0,0,0,东北雨姐要好好反省哦，希望她能改进。
2024/9/26 18:59,wb,0,0,0,0,东北雨姐要诚实面对错误并改正。
2024/9/26 18:59,wb,0,0,0,0,东北雨姐事件，希望大家理性包容。
2024/9/26 18:59,wb,0,0,0,0,东北雨姐应该反思，大家也要宽容。
2024/9/26 18:59,wb,0,0,0,0,东北雨姐应吸取教训，大家理性包容。
2024/9/26 18:59,wb,0,1,1,1,希望雨姐能改过自新，大家都还来者不拒。
2024/9/26 18:59,wb,0,0,0,0,东北雨姐态度值得肯定，理性包容，给机会。
2024/9/26 18:59,wb,0,1,1,1,东北雨姐要虚心接受反思，重新做人。
2024/9/26 18:59,wb,0,0,0,0,东北雨姐道歉，诚恳敬业向前看。
2024/9/26 18:59,wb,0,0,0,0,道歉态度需诚恳，理性包容给予改过机会。
2024/9/26 18:59,wb,0,0,0,0,东北雨姐应该吸取教训，改过自新。
2024/9/26 18:59,wb,0,0,0,0,积极的态度，希望能够改过自新。
2024/9/26 18:59,wb,0,0,0,0,东北雨姐应该反思并改过自新。理性包容给机会。
2024/9/26 18:59,wb,0,0,0,0,东北雨姐道歉，希望大家能以理性包容的心态看待。
2024/9/26 18:59,wb,0,0,0,0,东北雨姐道歉，乐观看待改过自新的可能性。
2024/9/26 18:59,wb,0,0,0,0,东北雨姐道歉，理性包容给她改过的机会。
2024/9/26 18:59,wb,0,0,0,0,积极面对，希望未来能更好。
2024/9/26 18:59,wb,0,0,0,0,积极面对错误，包容给予改正机会。
2024/9/26 18:59,wb,0,0,0,0,态度分歧，期待雨姐改过自新。
2024/9/26 18:59,wb,0,0,0,0,东北雨姐要认真反省，大家也要包容理解。
2024/9/26 18:59,wb,0,0,0,0,东北雨姐应引以为戒，大家宽容包容。
2024/9/26 18:59,wb,0,0,0,0,东北雨姐态度诚恳，希望大家给予理解和支持。
2024/9/26 18:59,wb,0,0,0,0,东北雨姐积极面对事件，期待改过自新。
2024/9/26 18:59,wb,0,0,0,0,东北雨姐道歉，值得理解和支持。
2024/9/26 18:59,wb,0,0,0,0,东北雨姐道歉，期待她改过自新。
2024/9/26 18:59,wb,0,0,0,0,东北雨姐诚挚道歉，期待大家理解包容。
2024/9/26 18:59,wb,0,0,0,0,把握教训，包容和理性对待，共同进步。
2024/9/26 18:59,wb,0,0,0,0,以包容的心态，给她一个改过自新的机会。
2024/9/26 18:59,wb,0,0,0,0,希望雨姐能吸取教训，理性包容给她机会。
2024/9/26 18:59,wb,0,0,0,0,积极正面的态度值得肯定。
2024/9/26 18:59,wb,0,0,0,0,坚信她会重振旗鼓，期待她更成熟。
2024/9/26 18:59,wb,0,0,0,0,东北雨姐态度认错诚恳，其受欢迎程度或可得到提高。
2024/9/26 18:59,wb,0,0,0,0,希望她能改过自新，理性包容。
2024/9/26 18:59,wb,0,0,0,0,东北雨姐应反思，大家要理性包容。
2024/9/26 18:59,wb,0,0,0,0,东北雨姐已经意识到错误，未来定会改进。
2024/9/26 18:59,wb,0,0,0,0,理性看待，给予改过自新的机会。
2024/9/26 18:59,wb,0,0,0,0,东北雨姐要认识错误，做得更好。
2024/9/26 18:59,wb,0,1,1,1,东北雨姐应该认识到己过，重新做人。
2024/9/26 18:59,wb,0,0,0,0,希望大家都能给她改过的机会。
2024/9/26 18:59,wb,0,0,0,0,雨姐要虚心接受教训，大家要宽容理解。
2024/9/26 18:59,wb,0,0,0,0,坚信东北雨姐可以反思，重新做人。
2024/9/26 18:59,wb,0,0,0,0,理性对待，给予改过机会。
2024/9/26 18:59,wb,0,0,0,0,东北雨姐，改过自新，理性包容。
2024/9/26 18:59,wb,0,0,0,0,以包容态度反思并追求改善。
2024/9/26 18:59,wb,0,0,0,0,理性包容，相信她改过。
2024/9/26 18:59,wb,0,0,0,0,东北雨姐道歉，期待她能改过自新。
2024/9/26 18:59,wb,0,0,0,0,东北雨姐道歉，理性包容给改过自新机会。
2024/9/26 18:59,wb,0,0,0,0,东北雨姐道歉，希望大家包容和理解。
2024/9/26 18:59,wb,0,0,0,0,东北雨姐已经意识到错误，希望大家能理解。
2024/9/26 18:59,wb,0,0,0,0,理性包容，东北雨姐会更加努力的。
2024/9/26 18:59,wb,0,0,0,0,东北雨姐事件，希望她能吸取教训，改过自新。
2024/9/26 18:59,wb,0,1,0,1,东北雨姐应该反思自己的行为。
2024/9/26 18:59,wb,0,0,0,0,东北雨姐要好好反省改进自己。
2024/9/26 18:59,wb,0,0,0,0,理性包容，期待东北雨姐改过自新。
2024/9/26 18:59,wb,0,0,0,0,东北雨姐，态度褒贬不一，求包容与改进。
2024/9/26 18:59,wb,0,0,0,0,支持东北雨姐，希望她能改正错误。
2024/9/26 18:59,wb,0,0,0,0,道德正义，每个人都该得到改过自新的机会。
2024/9/26 18:59,wb,0,0,0,0,东北雨姐要好好反省，适当给她一点机会。
2024/9/26 18:59,wb,0,0,0,0,挺理智的态度，给她改过自新的机会。
2024/9/26 18:59,wb,0,0,0,0,支持东北雨姐的成长和改变。
2024/9/26 18:59,wb,0,0,0,0,愿东北雨姐痛定思痛，步步谨慎，得人谅解。
2024/9/26 18:59,wb,0,0,0,0,东北雨姐应认识到自己的错误，改正行为。
2024/9/26 18:59,wb,0,0,0,0,东北雨姐已经道歉了，希望大家可以宽容些。
2024/9/26 18:59,wb,0,0,0,0,东北雨姐值得原谅和改正。
2024/9/26 18:59,wb,0,0,0,0,支持东北雨姐，希望她反思成长。
2024/9/26 18:59,wb,0,0,0,0,希望雨姐能吸取教训，做事更谨慎。
2024/9/26 18:59,wb,1,0,0,-1,东北雨姐错误，希望得到大家的体谅和改正。
2024/9/26 18:59,wb,0,0,0,0,东北雨姐要改过自新了，我们应该理性包容。
2024/9/26 18:59,wb,0,0,0,0,言者不知，听者辨明。反思，改过，宽容。
2024/9/26 18:59,wb,0,0,0,0,道歉态度应该诚恳，改正错误更重要。
2024/9/26 18:59,wb,0,0,0,0,请原谅她，为她的悔改给予支持。
2024/9/26 18:59,wb,0,0,0,0,态度有好有坏，但相信她能改过自新。
2024/9/26 18:59,wb,0,0,0,0,东北雨姐应该认识到错误并改正。愿她得到理解和支持。
2024/9/26 18:59,wb,0,0,0,0,支持东北雨姐，态度理性包容，相信她能改过自新。
2024/9/26 18:59,wb,0,0,0,0,东北雨姐道歉，希望大家能包容理解。
2024/9/26 18:59,wb,0,0,0,0,东北雨姐应引以为戒，大家也要包容。
2024/9/26 18:59,wb,0,0,0,0,东北雨姐积极改过自新，值得支持。
2024/9/26 18:59,wb,0,0,0,0,东北雨姐诚恳道歉，值得原谅与支持。
2024/9/26 18:59,wb,0,0,0,0,理解雨姐，希望她改过自新。
2024/9/26 18:59,wb,1,0,0,-1,悔过态度值得鼓励，期待改正行为。
2024/9/26 18:59,wb,0,0,0,0,东北雨姐应该更加谨慎，态度要诚恳。
2024/9/26 18:59,wb,0,0,0,0,态度褒贬不一，望雨姐吸取教训，理性包容给机会。
2024/9/26 18:59,wb,0,0,0,0,东北雨姐应该虚心接受并改进自己。
2024/9/26 18:59,wb,0,0,0,0,东北雨姐道歉值得信任的态度，理解大家都有过错。
2024/9/26 18:59,wb,0,0,0,0,支持东北雨姐，理性看待事件，给予改正机会。
2024/9/26 18:59,wb,0,0,0,0,东北雨姐已经道歉，希望大家能包容理解。
2024/9/26 18:59,wb,0,0,0,0,东北雨姐应反思，大家理性包容给机会。
2024/9/26 18:59,wb,0,0,0,0,悠米希望东北雨姐能改过自新。
2024/9/26 18:58,wb,0,0,0,0,东北雨姐要好好反省，希望大家给机会。
2024/9/26 18:58,wb,0,0,0,0,关注东北雨姐事件，呼吁理性对待，包容理解。
2024/9/26 18:59,wb,0,0,0,0,态度褒贬不一，给她改过自新的机会。
2024/9/26 18:59,wb,0,0,0,0,东北雨姐感性道歉，理解包容，共同成长。
2024/9/26 18:58,wb,0,0,0,0,支持东北雨姐，期待她的改变。
2024/9/26 18:58,wb,0,0,0,0,支持东北雨姐，给她改过的机会。
2024/9/26 18:58,wb,0,0,0,0,真诚的道歉，需要给予改过自新的机会。
2024/9/26 18:58,wb,0,0,0,0,东北雨姐释放道歉，值得理解和支持。
2024/9/26 18:58,wb,0,0,0,0,东北雨姐诚恳道歉，值得被理解和支持。
2024/9/26 18:58,wb,0,0,0,0,支持东北雨姐道歉，希望她能改正。
2024/9/26 18:58,wb,0,0,0,0,东北雨姐道歉，值得给她改过自新的机会。
2024/9/26 18:58,wb,0,0,0,0,东北雨姐应该反思自己的言行，但也可谅解她的手忙脚乱之时发生的失言
2024/9/26 18:58,wb,0,0,0,0,希望雨姐真能吸取教训，大家理解体谅她吧
2024/9/26 18:58,wb,0,0,0,0,哎，人非圣贤错多矣。希望东北雨姐真心悔悟。下次注意点行不？
2024/9/26 18:59,wb,0,0,0,0,积极向上的态度，希望雨姐能吸取教训。
2024/9/26 18:59,wb,0,0,0,0,希望雨姐能吸取教训，大家理性包容。
2024/9/26 18:59,wb,0,0,0,0,理性看待，给她改过自新的机会。
2024/9/26 19:00,wb,0,0,0,0,东北雨姐：下次记得带伞，别再淋雨啦！
2024/9/26 18:59,wb,0,0,0,0,东北雨姐：下次直播记得带伞，别让雨淋湿了你的幽默感！
2024/9/26 18:59,wb,0,0,0,0,加油，雨姐，我们支持你的改变！
2024/9/26 18:59,wb,0,0,0,0,东北雨姐应反省，理性包容给机会。
2024/9/26 18:59,wb,0,0,0,0,希望雨姐能改过自新，大家也理解包容。
2024/9/26 18:59,wb,0,0,0,0,你也看她直播吗
2024/9/26 18:59,wb,0,0,0,0,直播带货不好做了
2024/9/26 19:00,wb,1,1,1,0,不是知道错了 是怕赚不到钱了
2024/9/26 19:01,wb,0,0,0,0,东北的大鹅山东发， 盘锦的螃蟹白天抓， 红薯的粉条木薯刮， 雨姐的拳头砸脑瓜。
2024/9/26 19:01,wb,0,1,1,1,以前看过几期她的视频 目前已经拉黑
2024/9/26 19:05,wb,0,0,0,0,我都没有看过他直播
2024/9/26 19:10,wb,0,1,1,1,直播高速发展过程难免的乱象。很多人就是想浑水摸鱼罢了。
2024/9/26 19:03,wb,1,1,1,0,意思就是说打了人对不起了，因为我还得继续赚钱只能跟你们道个歉
2024/9/26 19:13,wb,0,1,1,1,原来挺喜欢看她做饭，最近不看了，道歉挽回不了昔日声誉，做好撤退打背包走人吧
2024/9/26 19:12,wb,0,0,0,0,直播带货诱惑力太大了，所以大家尽量还是别去看直播带货，很容易给带进去
2024/9/26 19:03,wb,0,1,1,1,打完家人道完歉，家人们的钱我还想赚
2024/9/26 19:12,wb,1,0,0,-1,从来也没有看过他。
2024/9/26 19:10,wb,0,0,0,0,雨姐是谁不认识，干什么的
2024/9/26 19:06,wb,0,0,0,0,我从没刷到过直播，一般都是出事我才认识
2024/9/26 19:01,wb,0,0,0,0,希望以后能注意点，选品严格一点，人设稳一点
2024/9/26 19:00,wb,0,0,0,0,现在这是怎么了
2024/9/26 19:00,wb,0,1,1,1,这到底是男的还是女的呀？
2024/9/26 19:03,wb,0,0,0,0,她哪里塌房了？？？她完整的道歉视频你们是一点没看！是这些人私闯民宅偷拍，不听雨姐多次劝阻还欺骗和先动手打了雨姐的家人！雨姐报警之后抓了他们！最后好心还给了钱！他们收了钱还勒索雨姐
2024/9/25 6:19,xhs,0,0,0,0,只看她干活很有劲，其他的都不感兴趣，也不关注，随缘刷哈哈哈哈哈
2024/9/25 5:50,xhs,1,1,1,0,还非法拘禁，打人[石化R]，越看越像黑社会性质组织[石化R]
2024/9/24 5:36,xhs,0,0,0,0,两边都挺搞笑的[笑哭R]
2024/9/25 4:36,xhs,0,1,1,1,不懂看她的人怎么想，我第一次看这个人面相就觉得是个狠人
2024/9/24 12:47,xhs,1,0,0,-1,她最新视频的台词……
2024/9/25 4:30,xhs,1,0,0,-1,啊[哭惹R] 我还是以为东北雨姐是那种特别 热情 豪爽 大方的人 因为她出去集市买东西 还会跟那些老板打招呼[哭惹R] [哭惹R]感觉没什么架子[哭惹R] 特别喜欢看她 还在她直播间买那些吃的[哭惹R]  有人说她身世很可怜也是假的嘛
2024/9/24 12:30,xhs,0,1,1,1,作为东北人，我一直不喜欢雨姐，那种明显是假大方，假豪爽的感觉让我浑身不适，这种人带货翻车迟早的事。作为相关人员，职业打假的也让我恨得牙痒，他们根本就不是所谓的为老百姓维权，就是纯敲诈，我们拿他们一点办法也没有。这个事我只能说打得好，最好他俩对打然后都进去冷静冷静
2024/9/24 7:10,xhs,0,0,0,0,维权为什么不找商家啊，感觉途径不对，除非是他们自产自销
2024/9/24 9:07,xhs,0,0,0,0,@MOB 那个雨姐
2024/9/25 2:16,xhs,0,0,0,0,?@乐乐（健身版）?当初感觉这个人莫名其妙就火了
2024/9/25 1:53,xhs,0,0,0,0,所以我从来不在任何网红直播间买东西[石化R]单纯信不过她们任何人
2024/9/24 12:50,xhs,1,0,0,-1,但是找上门好奇怪阿
2024/9/25 1:49,xhs,0,0,0,0,之前刷到还有明星去他家做客[石化R]
2024/9/25 1:38,xhs,0,1,1,1,前几天还在蛐蛐她[笑哭R][笑哭R]没想到今天就刷到塌房了[笑哭R][笑哭R]
2024/9/24 8:44,xhs,0,0,0,0,能成功的人我感觉多多少少都有点社会[捂脸R]
2024/9/25 0:45,xhs,0,1,1,1,@慢摇追夸父 雨姐都能塌房 行
2024/9/26 6:11,xhs,0,1,1,1,看过两集，不喜欢这种咋咋唬唬的调调，人设剧本一看就是演的，想让人感觉质朴真实啥的，太假了。
2024/9/24 11:43,xhs,0,1,1,1,我在小红书评论一下说看起来不是面善的人，被她的粉丝们各种骂，恶毒的话各种输出，我都懵了
2024/9/24 17:26,xhs,1,1,1,0,都不是啥好人……上门维权多新鲜，网络审判，啥心思。天天当网络是法院，一种恶和另一种恶掐
2024/9/24 3:58,xhs,1,1,1,0,上门维权[笑哭R]
2024/9/24 15:47,xhs,0,0,0,0,@假的卡皮巴拉 红薯粉条竟然也造假吗，到底什么东西比真红薯成本还低啊……好离谱
2024/9/24 9:06,xhs,0,1,1,1,好多这种所谓的下沉市场热爱的网红都一一翻车了。抖人最爱吹嘘那种包装成纯朴的，草根出身的，不管是网红还是明星，这类公众人物靠着这种出身人设，被抖人疯狂追捧，但是也很容易翻车[汗颜R]
2024/9/24 6:58,xhs,1,0,0,-1,淀粉提取物里本来就不该有基因啊
2024/9/24 15:27,xhs,1,1,1,0,社会盲流子当然只坑她的家人们啦～～[doge]
2024/9/24 8:21,xhs,0,0,0,0,歪个话题，我家就是做红薯粉的，手工红薯粉真的巨好吃[大笑R]
2024/9/24 8:46,xhs,0,1,1,1,维权没有售后客服，没有市场监督管理局，没有食品安全这些部门，渠道吗。上人家里去干吗？
2024/9/24 4:12,xhs,1,1,1,0,东北雨姐几次翻车了[笑哭R]要是造谣这个男的早就进局子了，他拍那个视频很多点都是故意放大东北人的行为习惯，不是自己家乡的玩意也得往上边靠，还得来一句在雨姐家乡奥[doge]但是这个男的肯定是想趁机搞一波流量或者要钱，没想到挨揍了
2024/9/25 0:20,xhs,1,0,0,-1,@六六
2024/9/24 14:18,xhs,0,0,0,0,看看段子就好，网红的东西我从来不买，大多都是三无产品。
2024/9/24 8:38,xhs,1,1,1,0,咦 黑社会吧这是 加深了我对那种造型的刻板印象
2024/9/24 14:08,xhs,0,1,1,1,确实，感觉她们那个团体有点吓人，会动手的样子
2024/9/25 23:28,xhs,1,1,1,0,能红的都是捧出来的，能是什么大善人吗
2024/9/25 17:19,xhs,0,0,0,0,@叫我33就好啦 朝阳县粉条
2024/9/25 8:55,xhs,0,1,1,1,我能理解大家有时候喜欢看这些网络丑角卖蠢卖丑，但是我不能理解为什么这种路子出来的都有商家找他带货，而且还真有人买.....[微笑R][微笑R][微笑R][微笑R]你看看就行了 买啥啊 看着就不靠谱的人还买他的东西 买到问题产品人家可是拍拍屁股走人的
2024/9/25 7:44,xhs,0,0,0,0,@Aihara 牛逼
2024/9/25 4:22,xhs,0,0,0,0,她家以前确实不富裕，要么说普通人唯一有机会起飞的途径就是自媒体呢，不过感觉现在社会挺癫的啊，各种有钱的装没钱的，没钱的装有钱的，各有一套收割的路子，真狠
2024/9/25 3:12,xhs,0,1,1,1,@捏你小肚子
2024/9/25 2:57,xhs,0,1,1,1,那体格子半扇猪都能抡的虎虎生风，估计是发生推搡了，如果真打起来估计都得出人命…
2024/9/25 2:29,xhs,1,0,0,-1,@地精 @+??+ [汗颜R]
2024/9/25 2:10,xhs,0,1,1,1,之前东北人说她卖的蟹都是假的呗，不是东北大河蟹
2024/9/25 1:50,xhs,1,0,0,-1,@我不打黑工??
2024/9/25 0:53,xhs,1,1,1,0,终于翻车了嘛
2024/9/25 0:48,xhs,0,1,1,1,我就问！我就问！大网红有几个是真的？流水线一样的剧本而已[笑哭R]
2024/9/24 23:46,xhs,0,0,0,0,图个乐得了呗，还买东西[抠鼻R]，这就是家人们的不对啦嗷[抠鼻R][抠鼻R]
2024/9/24 23:32,xhs,1,0,0,-1,为啥要互相道歉?举报者为啥要道歉?
2024/9/24 22:39,xhs,0,1,1,1,不说雨姐像村霸么  她这种长相  做事风格村里没人敢惹的
2024/9/24 22:39,xhs,1,1,1,0,首先两方都不是好人，其次职业打假人就是讹人钱的，参照那个铁头打假就知道了，讹人钱最后抓进去了[笑哭R]
2024/9/24 22:34,xhs,1,1,1,0,说实话她看着就一脸凶相 像村霸 做事感觉也很呜呜渣渣的
2024/9/24 22:18,xhs,0,1,1,1,我一听老蒯俩字儿就全身难受
2024/9/24 21:01,xhs,1,1,1,0,看上去像黑吃黑
2024/9/24 16:25,xhs,1,1,1,0,现在就是网络文化低俗化，什么牛鬼蛇神都出来了[扶墙R][扶墙R][扶墙R]我都不看这些网红带货，看这一个个都没念过书的样子，以低俗没教养为荣，欣赏不来
2024/9/24 16:15,xhs,0,1,1,1,网红在我眼里就是贬义词。
2024/9/24 16:12,xhs,0,0,0,0,谁在喜欢反差感老铁t啊
2024/9/24 15:40,xhs,0,1,1,1,还好我从一开始就很讨厌雨姐（）
2024/9/24 15:29,xhs,1,0,0,-1,@CC
2024/9/24 15:22,xhs,0,1,1,1,雨姐的面相说实话就不是很好[笑哭R]
2024/9/24 15:20,xhs,1,0,0,-1,以前的痞子流氓，现在的网红
2024/9/24 15:15,xhs,0,0,0,0,我记得之前有爆出过卖的东北大鹅是假的呀[石化R]，都没有人说嘛，而且好像没有后续
2024/9/24 15:03,xhs,0,1,1,1,@天天胃口大开 @Hellozhao?? 蛙趣 还打人
2024/9/24 15:00,xhs,1,1,1,0,就是农村地痞流氓吧，一般都是立个仗义实诚粗粗咧咧的人设。
2024/9/24 14:44,xhs,1,1,1,0,俗称农村二流子
2024/9/24 14:41,xhs,1,0,0,-1,[石化R]
2024/9/24 14:31,xhs,0,0,0,0,我老公在东北读的书，他说他老师还有他们课题组里的人都特好，他都毕业很多年了，有机会都会回东北看望老师，注意，他一直用回这个词，另外同门的师兄弟们也都很好，谁结婚谁生孩子都商量着尽量去，他一直说，东北的本地人真的是很热情很好，他有一次坐公交车没有零钱司机师傅直接说别掏了e给了，事情过去很多年了他一直记得。
2024/9/24 14:22,xhs,0,0,0,0,老家买的红薯粉条用手基本一折就断了，外面城市买的粉条不管是菜市场的还是超市里的反正折不断，得用剪刀剪
2024/9/24 14:09,xhs,0,1,1,1,雨姐卖的还有别的假货呢[doge]
2024/9/24 13:56,xhs,1,1,1,0,[失望R]抖音网红全是二流子，社会气超重，打黑往抖音去一打一个准。
2024/9/24 13:44,xhs,0,1,1,1,这个人也有问题，为啥上门维权，而不是直接举报，也有所图吧
2024/9/24 13:34,xhs,0,1,1,1,一直觉得她们那一伙人个个看面相上都不是善茬[笑哭R]反正现实碰到的话我都得躲远点。
