timestamp,platform,label1,label2,label3,diff,content
2024/8/18 2:28,dy,1,1,1,0,天堂的景区，地狱般的生存环境
2024/8/18 2:28,dy,1,1,1,0,青岛很美，青岛人就不美了
2024/8/18 2:28,dy,0,1,1,-1,穷人就不要难为穷人了但摆摊的人也应该自觉不要占道经营，乱丢垃圾，缺斤少两和噪音扰民。不是说这个大学生而是说全国摆地摊的人
2024/8/18 2:28,dy,1,1,1,0,这老头神态动作，一看就是泼皮无赖
2024/8/18 2:28,dy,0,1,1,-1,看情形老家伙在那群保安中职位最大[看]
2024/8/18 2:28,dy,0,1,1,-1,退休工资领太多了嚣张跋扈
2024/8/18 2:28,dy,0,1,1,-1,为什么要说，大爷，就是大爷呢。红袖章一带，两个字，牛逼。
2024/8/18 2:28,dy,0,1,1,-1,这人是不是山东人？
2024/8/18 2:28,dy,1,1,1,0,不带袖章就是社会流氓[打脸]
2024/8/18 2:28,dy,1,1,1,0,那老头一付小人得志的样子
2024/8/18 2:28,dy,0,1,1,-1,这要是在口罩期间，这大爷指不定有多牛呢
2024/8/18 2:28,dy,0,1,1,-1,真的碰到奸淫掳掠的黄大爷他跑得比鬼都快[偷笑]
2024/8/18 2:28,dy,1,1,1,0,好大的官威
2024/8/18 2:28,dy,0,1,1,-1,你大爷还是你大爷，何况是红袖章大爷
2024/8/18 2:28,dy,0,0,0,0,切
2024/8/18 2:28,dy,0,1,1,-1,这大爷真牛，这权利真大有点飘了
2024/8/18 2:29,dy,0,1,1,-1,有的人手上只要有一点权利。就高高在上，自以为是了。
2024/8/18 2:29,dy,1,1,1,0,流氓老了戴了袖章穿个马甲更流氓
2024/8/18 2:29,dy,0,1,1,-1,狐假虎威
2024/8/18 2:29,dy,0,1,1,-1,用的着别人抹黑吗，他们自己就玩自黑了
2024/8/18 2:29,dy,0,1,1,-1,青岛天价大虾还没降温，这两位青岛大爷让青岛文旅局无地自容
2024/8/18 2:29,dy,0,1,1,-1,老是青岛，青岛是怎么了？
2024/8/18 2:29,dy,0,0,0,0,中国好大爷
2024/8/18 2:29,dy,0,1,0,-1,这还不明显还调查
2024/8/18 2:29,dy,0,0,0,0,你这纯属个人偏见，不是当事人，不是旁观者就不要说的头头是道
2024/8/18 2:29,dy,1,1,1,0,有点权利就翘尾巴，嘴了显露的琳琳紧致
2024/8/18 2:29,dy,0,0,0,0,青岛火了
2024/8/18 2:29,dy,0,1,1,-1,这就叫有权不使，过期作废！
2024/8/18 2:29,dy,0,1,0,-1,满满的恶意
2024/8/18 2:29,dy,0,1,1,-1,你帮问问那位大爷，受过毒打没[抠鼻][抠鼻]
2024/8/18 2:29,dy,0,1,1,-1,权力是个好东西呀[捂脸]
2024/8/18 2:29,dy,1,1,1,0,这老头一看就没干过什么好事
2024/8/18 2:29,dy,0,1,1,-1,青岛绣章不美，环境很美
2024/8/18 2:29,dy,1,1,1,0,人横必有所倚靠，阎王好说小鬼难缠。
2024/8/18 2:29,dy,0,1,1,-1,青岛用抹黑吗？
2024/8/18 2:29,dy,1,1,1,0,要是我，我就偷着跟着这老头的家，后面的你们想象，
2024/8/18 2:29,dy,0,1,0,-1,土水越来越多了[发怒][发怒][发怒]
2024/8/18 2:29,dy,0,1,1,-1,这种人的退休金是不是可以不发了？
2024/8/18 2:29,dy,0,0,0,0,傲慢
2024/8/18 2:29,dy,0,0,0,0,所以说，战争来了我干嘛去参军用命保护这帮人？
2024/8/18 2:29,dy,1,1,1,0,青岛还用抹黑吗？[捂脸][捂脸][捂脸]
2024/8/18 2:29,dy,1,1,1,0,不会摸黑青岛的，因为哪都一样[笑哭]
2024/8/18 2:29,dy,1,0,0,1,青岛很好，不去就是了
2024/8/18 2:29,dy,1,1,1,0,不久，这老家伙就会是五保户
2024/8/18 2:29,dy,1,1,1,0,这个老人就是日本人
2024/8/18 2:29,dy,0,1,1,-1,进一步核查[尬笑] 真要找 连10分钟都用不了[捂脸]
2024/8/18 2:29,dy,1,1,1,0,这样的老头  应该是五保户
2024/8/18 2:29,dy,0,1,1,-1,退休金发的太高了
2024/8/18 2:30,dy,1,1,1,0,他们家根本没有孩子，就一孤老头子
2024/8/18 2:30,dy,0,1,1,-1,现在的人越来越冷漠，社会的温暖度，不知道跑哪里去了
2024/8/18 2:30,dy,0,0,0,0,在现在的环境下。已经没有勤工俭学的这个说法了。
2024/8/18 2:30,dy,0,1,0,-1,青岛最近挺火呀[捂脸]
2024/8/18 2:30,dy,0,1,1,-1,有点权利就豪横
2024/8/18 2:30,dy,0,1,1,-1,这老家伙就是和谐社会救了他，就这德性早晚会遇到狠人教育他的
2024/8/18 2:30,dy,0,1,0,-1,临时工[捂脸]
2024/8/18 2:30,dy,0,1,1,-1,大爷太狂躁[呲牙]
2024/8/18 2:30,dy,0,1,1,-1,职能部门的缩影拿着鸡毛当令箭
2024/8/18 2:30,dy,1,1,1,0,那是，难得可以为难别人的机会！[赞]
2024/8/18 2:30,dy,0,0,0,0,正常驱离不对么
2024/8/18 2:30,dy,0,1,1,-1,手里有点权力，运用到极致。
2024/8/18 2:30,dy,1,1,1,0,青岛今年好出名个人素质，就这样
2024/8/18 2:30,dy,0,1,1,-1,这孩子上辈子真是老头大爷。
2024/8/18 2:30,dy,0,0,0,0,大爷就是大爷[赞]
2024/8/18 2:30,dy,1,1,1,0,无德老人，怎么配佩戴红袖章
2024/8/18 2:30,dy,0,1,1,-1,青岛牛二
2024/8/18 2:30,dy,0,0,0,0,问题边上那几个…大家没看见吗？
2024/8/18 2:30,dy,0,0,0,0,[666][666][666]
2024/8/18 2:30,dy,0,1,1,-1,别去青倒就是了嘛。
2024/8/18 2:30,dy,0,0,0,0,这绝对不是黑社会
2024/8/18 2:30,dy,1,1,1,0,有些东西只要有一点点权力就会最大限度的为难别人。
2024/8/18 2:30,dy,0,1,1,-1,严查这大爷背后的保护伞.不是一般的大爷。青岛是人可以居住的好城市。[捂脸][捂脸][捂脸][捂脸][捂脸][捂脸]这是什么时候说的来？[捂脸][捂脸][捂脸][捂脸][捂脸][捂脸]
2024/8/18 2:30,dy,0,1,1,-1,我家小孩和他的同学在青岛旅游，不会碰到这样的人吧[呲牙]
2024/8/18 2:30,dy,1,1,1,0,青岛这是怎么了，突然间就多了那吗多的豪横大爷？
2024/8/18 2:30,dy,0,1,1,-1,现在老百姓日子真的不好过了，到处都在管老百姓。
2024/8/18 2:30,dy,1,1,1,0,青岛很美，青岛人….呵呵呵
2024/8/18 2:30,dy,0,1,1,-1,这种都是拿着退休工资还干着这种兼职你觉得合适吗？
2024/8/18 2:30,dy,0,0,0,0,[赞][赞][赞]
2024/8/18 2:30,dy,1,1,1,0,看来青岛永远比不上淄博了
2024/8/18 2:30,dy,0,1,0,-1,权利的游戏
2024/8/18 2:30,dy,1,1,1,0,青岛那边小日子留下的种，没法讲的！！
2024/8/18 2:30,dy,0,0,0,0,大河向东流啊，天上的星星参北斗[比心]
2024/8/18 2:31,dy,1,1,1,0,让你体会什么是小人得志，什么叫基层老油条
2024/8/18 2:31,dy,1,1,1,0,青岛很美，美在哪？美在大爷身上吗？美在压迫上吗？
2024/8/18 2:31,dy,0,1,1,-1,让这老头回家抱孩子去
2024/8/18 2:31,dy,1,1,1,0,它有女法官厉害吗？
2024/8/18 2:31,dy,1,1,1,0,小伙子要是少数民族的，那就好玩了[奸笑]
2024/8/18 2:31,dy,1,1,1,0,这老头太多管闲事了，品德有问题是无疑的。
2024/8/18 2:31,dy,1,1,1,0,@青岛老刘忙。
2024/8/18 2:31,dy,0,0,0,0,等看后续
2024/8/18 2:31,dy,0,1,1,-1,怎么觉得现在霸凌的老年人居多了？是退休工资拿多了没事干？还是有钱就敢欺负弱者？
2024/8/18 2:31,dy,0,0,0,0,支持你，后续点一下
2024/8/18 2:31,dy,0,0,0,0,青岛是一个文明城市！可惜嘞！
2024/8/18 2:31,dy,1,1,1,0,青岛大虾
2024/8/18 2:31,dy,0,0,0,0,这是什么身份还用调查吗？
2024/8/18 2:31,dy,1,1,1,0,老家伙有前科的，监狱坐傻了[呲牙]
2024/8/18 2:31,dy,1,1,1,0,青岛那年不出点洋相
2024/8/18 2:31,dy,1,1,1,0,权利至上[抱拳]
2024/8/18 2:31,dy,1,1,1,0,大爷   有人[呲牙]
2024/8/18 2:31,dy,1,1,1,0,你大爷就是你大爷
2024/8/18 2:31,dy,0,1,1,-1,这种人早点回家了！
2024/8/18 2:31,dy,0,1,0,-1,主播这个地方能不能卖东西
2024/8/18 2:31,dy,0,1,1,-1,这就是现实的社会，权利这真是好东西，想干嘛就干嘛。
2024/8/18 2:31,dy,0,0,0,0,[赞][赞][赞]
2024/8/18 2:31,dy,0,1,1,-1,呵呵，青岛，我很后悔去青岛上了四年大学
2024/8/18 2:31,dy,1,1,1,0,我支持你[微笑]大爷[赞][赞]当官就是要有当官的样[赞]要霸气[鼓掌][鼓掌][鼓掌]，当官就是要有特权[赞]
2024/8/18 2:31,dy,1,1,1,0,看看这锤子社会
2024/8/18 2:31,dy,0,0,0,0,官方肯定说大爷没问题
2024/8/18 2:31,dy,1,1,1,0,为老不贞，可恨。
2024/8/18 2:32,dy,0,0,0,0,你是我最喜欢的主播[666][666][666]
2024/8/18 2:32,dy,1,1,1,0,青岛下一个马家军，青岛不要去了，拉黑
2024/8/18 2:32,dy,1,1,1,0,这老头自以为是，习惯了！其实自己啥也不是！
2024/8/18 2:32,dy,1,1,1,0,那个皮笑肉不笑，有恃无恐的嘴里确实让人记忆犹新的恶心，估计很多人都不一定忍得住
2024/8/18 2:32,dy,1,1,1,0,有点权利赶紧用，过期做废怎么办？
2024/8/18 2:32,dy,1,1,1,0,有点权利他爹妈都不认识了[打脸]
2024/8/18 2:32,dy,1,1,1,0,这大爷没有挨过打，没有领教过，，
2024/8/18 2:32,dy,0,1,1,-1,现在不都是这样吗？平头老百姓已经习惯了
2024/8/18 2:32,dy,0,0,0,0,明明是个小商贩，你要说是同学，对于大爷来说还需要区分小商贩学历？你这视频明显掐头去尾的，讲什么？
2024/8/18 2:32,dy,0,0,0,0,你说错了 人家小伙说我是你爷 爹是那老头自己认得[捂脸][捂脸][捂脸]
2024/8/18 2:32,dy,0,1,1,-1,青岛接二连三啊[捂脸][捂脸]不不不，他是中国青岛，和山东没关系[看]
2024/8/18 2:32,dy,1,1,1,0,有一点点权利就去难为他人，难道这不是普遍现象吗？
2024/8/18 2:32,dy,1,1,1,0,给青岛人丢人，立马开除，就想知道什么单位敢用这种人
2024/8/18 2:32,dy,1,1,1,0,青岛大虾变青岛大爷[捂脸]
2024/8/18 2:32,dy,1,1,1,0,领导的爸爸
2024/8/18 2:32,dy,1,1,1,0,人性最大的恶，就是哪怕有丁点大的权力也要最大限度的刁难人[流泪]
2024/8/18 2:32,dy,0,0,0,0,支持点赞[赞][赞][赞][赞][赞][赞][赞][赞][赞]
2024/8/18 2:32,dy,0,1,0,-1,删不了，哎删不了[捂脸]
2024/8/18 2:32,dy,1,1,1,0,青岛大爷和北京大妈一样令人讨厌！
2024/8/18 2:32,dy,1,1,1,0,不服就干
2024/8/18 2:32,dy,0,1,1,-1,戴红标就能啥都管，这大爷戴黑标能管啥？
2024/8/18 2:32,dy,0,1,1,-1,像疫情期间的部分小区保安！
2024/8/18 2:32,dy,1,1,1,0,这老头以老卖老[石化]
2024/8/18 2:32,dy,0,1,0,-1,规矩给谁立的
2024/8/18 2:32,dy,0,1,1,-1,这大爷真红了，人啊千万不能飘[捂脸]
2024/8/18 2:32,dy,0,0,0,0,国家必须倡导要提高国民的道德修养，势在必行，
2024/8/18 2:32,dy,0,1,1,-1,虚心接受，坚决不改，你奈我何
2024/8/18 2:32,dy,1,1,1,0,那就是老混混    儿子也是混子
2024/8/18 2:32,dy,1,1,1,0,这大爷没后代吧？
2024/8/18 2:32,dy,1,1,1,0,好像黑恶势力！
2024/8/18 2:32,dy,0,0,0,0,青岛大虾，青岛地铁大爷，青岛广场大爷，都气势汹汹。
2024/8/18 2:32,dy,0,1,1,-1,遇到狠的大爷就画上句号了
2024/8/18 2:32,dy,0,1,1,-1,顶多避风头歇两天或者换个地方继续干，放心吧
2024/8/18 2:32,dy,1,1,1,0,流氓转正了
2024/8/18 2:32,dy,0,1,0,-1,我就喜欢，没人，没监控的地方，??
2024/8/18 2:33,dy,0,1,1,-1,大爷说出了心里话，在他心中普通群众就是算老几，领导才是老大才应受到重视。
2024/8/18 2:33,dy,1,1,1,0,一副小人的轻狂
2024/8/18 2:33,dy,0,1,1,-1,杀鸡儆猴得了
2024/8/18 2:33,dy,0,1,1,-1,把录用他的人开了，为什么不严格审查素质教育
2024/8/18 2:33,dy,1,1,1,0,老头没有修养
2024/8/18 2:33,dy,0,0,0,0,[捂脸][捂脸]
2024/8/18 2:33,dy,0,0,0,0,青岛直辖市素质高
2024/8/18 2:33,dy,1,1,1,0,青岛有没有人管吗？鸡毛蒜皮的事那个小仔怎么这么凶？？要他抹黑社会？？高高在上的样子[流泪]
2024/8/18 2:33,dy,1,1,1,0,美中不足！！！
2024/8/18 2:33,dy,0,0,0,0,中国5000年传统文化
2024/8/18 2:33,dy,1,1,1,0,带来只袖套 就想飘
2024/8/18 2:33,dy,1,1,1,0,前有青岛大虾今有青岛大爷
2024/8/18 2:33,dy,0,1,1,-1,这个老头但凡当个村长，你再看看他的权力有多大！[呲牙]
2024/8/18 2:33,dy,1,1,1,0,流氓变老了，问题是谁雇佣老流氓，问什么要雇佣老流氓？
2024/8/18 2:33,dy,1,1,1,0,有一点点权利就无限放大自己，感觉自己就是最大的官[打脸][打脸][打脸]
2024/8/18 2:33,dy,1,1,1,0,他家肯定是没孩子他才会这样[捂脸]
2024/8/18 2:33,dy,0,0,0,0,为什么都在一边倒
2024/8/18 2:33,dy,1,1,1,0,不是，那群见了热点就强蹭的网红哪去了？把这老头工揪出来！
2024/8/18 2:33,dy,0,1,1,-1,地铁碰到这样大爷，要让座吗。
2024/8/18 2:33,dy,1,1,1,0,混混变老了！
2024/8/18 2:33,dy,0,1,1,-1,远离青岛
2024/8/18 2:33,dy,0,1,1,-1,就这地方谁敢去呀？
2024/8/18 2:33,dy,1,1,1,0,大家帮帮忙，找找这大爷的信息。看看他有没有孙子在外求学，咱给他孙子也上上强度
2024/8/18 2:33,dy,0,1,1,-1,老人家只是在找成在感，怕没人知道自己的权利。
2024/8/18 2:33,dy,0,0,0,0,是青岛大爷
2024/8/18 2:33,dy,0,1,1,-1,小小一点点权
2024/8/18 2:33,dy,1,1,1,0,手上有点权力为难别人就是他的乐子
2024/8/18 2:33,dy,1,1,1,0,骂你怎么了，为老不尊。
2024/8/18 2:34,dy,0,1,0,-1,可是，那老头是干什么的呢？谁给他的权力呢？
2024/8/18 2:34,dy,0,1,1,-1,这个老头的单位必须要把他，必须要撤掉他的职务
2024/8/18 2:34,dy,0,0,0,0,就服你美女[赞]赞赞赞
2024/8/18 2:34,dy,1,1,1,0,坚决抵制青岛。
2024/8/18 2:34,dy,0,0,0,0,很多很多
2024/8/18 2:34,dy,1,1,1,0,权权就是解释权[发呆]
2024/8/18 2:34,dy,1,1,1,0,青岛是美但人不美
2024/8/18 2:34,dy,0,1,0,-1,权利大[赞][赞][赞]
2024/8/18 2:34,dy,0,1,0,-1,只会进一步
2024/8/18 2:34,dy,1,1,1,0,青岛很美，这大爷更美。[赞][赞][赞][赞][赞][赞]
2024/8/18 2:34,dy,1,1,1,0,看看他那样，感觉不是什么执勤，简直就像个收保护费的小混混！
2024/8/18 2:34,dy,0,1,1,-1,我记得前段时间是套路宰外地游客。吃喝玩乐处处是坑啊！
2024/8/18 2:34,dy,1,1,1,0,人性最大的恶就是利用手中微弱的权利去为难他人。
2024/8/18 2:34,dy,0,0,0,0,跟我们老百姓没关系
2024/8/18 2:34,dy,0,1,1,-1,我是大爷邻居我证明：确实是他爹
2024/8/18 2:34,dy,0,1,1,-1,小商贩可真不少，可惜他管不了。[呲牙][呲牙][呲牙][呲牙]
2024/8/18 2:34,dy,1,1,1,0,青岛还需要抹黑？都上多少次热搜了，
2024/8/18 2:34,dy,1,1,1,0,真给青岛人丢脸，不去了，准备上青岛玩呢，不去玩去了？
2024/8/18 2:34,dy,0,0,0,0,看的多了就变的冷漠了。
2024/8/18 2:34,dy,0,1,0,-1,社区15块钱一小时请的志愿者[抠鼻]
2024/8/18 2:34,dy,0,0,0,0,每个城市都有这样的人，只是没有曝光出来！
2024/8/18 2:34,dy,0,0,0,0,后续后续，老头处理了吗？
2024/8/18 2:34,dy,1,1,1,0,鬼节怎么不收这种老头
2024/8/18 2:34,dy,0,1,1,-1,一把年纪了，手上的（红袖张）一点点小权利不要激怒了小伙，否则后悔来不及
2024/8/18 2:34,dy,0,1,1,-1,这是青岛观光区的景点?
2024/8/18 2:34,dy,0,1,1,-1,老汉代表咧青岛的名片！！
2024/8/18 2:34,dy,0,1,0,-1,有本事去单挑
2024/8/18 2:34,dy,1,1,1,0,这老头是五保户
2024/8/18 2:34,dy,0,1,1,-1,不管怎样，一个大学生给比你爹大的老人当爹就合适了吗？
2024/8/18 2:34,dy,0,1,1,-1,青岛打耶???！别去了！危险啊
2024/8/18 2:34,dy,0,1,1,-1,带红袖章真牛B啊
2024/8/18 2:35,dy,0,0,0,0,青岛还得向淄博好好学习[呲牙]
2024/8/18 2:35,dy,0,1,1,-1,这就是权力的魔力呀，任何人都对它趋之若鹜
2024/8/18 2:35,dy,0,0,0,0,小美青岛欢迎你[赞][赞]
2024/8/18 2:35,dy,1,0,1,1,欺负弱者是人性最大的恶
2024/8/18 2:35,dy,1,1,1,0,红孩儿来的
2024/8/18 2:35,dy,0,1,0,-1,支持大学生的勤工俭学[666][666][666]
2024/8/18 2:35,dy,0,1,1,-1,年轻人，需要你们的时候到了，手里的键盘是干什么的。
2024/8/18 2:35,dy,1,1,1,0,这个大爷我知道，他一辈子单身无儿无女，还有很多病，也是个可怜人[呲牙][呲牙]，我实在编不下去了
2024/8/18 2:35,dy,1,0,0,1,社会现状岂是一朝一夕能改的！
2024/8/18 2:35,dy,1,1,1,0,这老头这么狂，这同学都是他孙子辈的，人家勤工俭学社会实践，你说话这么大声干嘛？你家孩子出门在外让人家这么吼，感受好吗？不能摆不能好好说
2024/8/18 2:35,dy,1,1,1,0,大爷没孩子没后代他才这么牛呀！
2024/8/18 2:35,dy,1,1,1,0,这个老头子，这个架势是省级干部的架势
2024/8/18 2:35,dy,0,1,1,-1,这有什么好上新闻的，都见怪不怪的，这就是小小的权利，小小的一次任性，没什么大不了的。
2024/8/18 2:35,dy,1,1,1,0,小人得志，穷人总是欺负穷人，难为穷人。
2024/8/18 2:35,dy,1,1,1,0,有点权就漂了[捂脸]
2024/8/18 2:35,dy,1,1,1,0,这是抱着宁杀错勿放过对自己人要狠
2024/8/18 2:35,dy,1,1,1,0,青岛很美吗青岛好有这样的好大爷
2024/8/18 2:35,dy,0,1,0,-1,谁给的权力
2024/8/18 2:35,dy,1,1,1,0,大爷应该是五保户
2024/8/18 2:35,dy,0,1,1,-1,应该是退休干部
2024/8/18 2:35,dy,0,0,0,0,[鼓掌][鼓掌][鼓掌][玫瑰][玫瑰][玫瑰]
2024/8/18 2:35,dy,0,0,0,0,确实没有呀[呲牙]
2024/8/18 2:35,dy,0,1,1,-1,青岛年年黑料上热搜，也是服了[捂脸]
2024/8/18 2:35,dy,0,0,0,0,现在有些人太不人性化啦，现在社会有多少人太难啦！
2024/8/18 2:35,dy,0,0,0,0,[赞]
2024/8/18 2:35,dy,1,1,1,0,红袖章你以为是随便带的吗？没关系的人你想带都带不上
2024/8/18 2:35,dy,0,1,1,-1,嚣张跋扈领导要负责
2024/8/18 2:35,dy,0,0,0,0,[赞]
2024/8/18 2:36,dy,0,1,0,-1,又是青岛
2024/8/18 2:36,dy,1,1,1,0,怀人永远都是，哪怕是老了……
2024/8/18 2:36,dy,1,1,1,0,网爆三轮[捂脸]可以开始啦
2024/8/18 2:36,dy,1,1,1,0,不G青岛的脸  丢中国的脸
2024/8/18 2:36,dy,1,1,1,0,地皮流氓都是领导…
2024/8/18 2:36,dy,1,1,1,0,这老头身份不简单。[弱][弱][弱][弱][弱][弱][弱]
2024/8/18 2:36,dy,0,0,0,0,友持主播[赞]
2024/8/18 2:36,dy,1,1,1,0,人不美
2024/8/18 2:36,dy,0,0,0,0,必须严惩
2024/8/18 2:36,dy,1,1,1,0,老人家走夜路口哨怎么吹都不安全
2024/8/18 2:36,dy,1,1,1,0,青岛的该清理清理门户了
2024/8/18 2:36,dy,1,1,1,0,孩子？这德行的不配有孩子
2024/8/18 2:36,dy,1,1,1,0,红袖章就是底气[呲牙][呲牙][呲牙]
2024/8/18 2:36,dy,0,1,1,-1,执法无度
2024/8/18 2:36,dy,0,1,1,-1,这个应该是保安的头
2024/8/18 2:36,dy,0,1,1,-1,别问，一问就是临时工
2024/8/18 2:36,dy,0,1,0,-1,青岛好几个事了
2024/8/18 2:36,dy,1,1,1,0,它家还能有孩子？？？？！！！！
2024/8/18 2:36,dy,0,0,0,0,说的对[赞]
2024/8/18 2:36,dy,1,1,1,0,砸得轻了
2024/8/18 2:36,dy,0,0,0,0,别说山东也别说青岛 就说全国哪个市场的管理员不是这么嚣张跋扈  消费者可能感觉不到  问问那些小商贩有几个没受过气
2024/8/18 2:36,dy,0,1,0,-1,青岛跟淄博学习吧！
2024/8/18 2:36,dy,1,1,1,0,拿着鸡毛当令箭的人太多了
2024/8/18 2:36,dy,0,1,1,-1,文明城市不文明[发呆]
2024/8/18 2:36,dy,1,1,1,0,带红袖套的老头一看，年轻时候不是一个善茬。
2024/8/18 2:36,dy,0,1,1,-1,大哥的小弟
2024/8/18 2:36,dy,1,1,1,0,他家可能是无保户
2024/8/18 2:37,dy,1,1,1,0,在家被老太婆欺负惯了，在外头拿孩子撒气呢
2024/8/18 2:37,dy,0,0,0,0,总是想让年轻人感恩，感谁的恩
2024/8/18 2:37,dy,1,1,1,0,这个大爷这个时间做的对！不能让穷人好好活！
2024/8/18 2:37,dy,1,1,1,0,现在臧敖泛滥了吗？这么多
2024/8/18 2:37,dy,1,1,1,0,来，把那个老头子抖出来看看有多大能耐。
2024/8/18 2:37,dy,0,0,0,0,下遛了
2024/8/18 2:37,dy,1,1,1,0,青岛能不去就先别去了，最近事太多。
2024/8/18 2:37,dy,0,1,1,-1,学生就没问题？
2024/8/18 2:37,dy,0,1,1,-1,为什么不公布，是临时工？？？？
2024/8/18 2:37,dy,0,1,1,-1,老头以为自己是交通局长呢[捂脸]
2024/8/18 2:37,dy,0,0,0,0,人们要看结果
2024/8/18 2:37,dy,1,1,1,0,有点权就会治人
2024/8/18 2:37,dy,1,0,0,1,看他得意的
2024/8/18 2:37,dy,0,0,0,0,后续，，，
2024/8/18 2:37,dy,0,1,1,-1,这种大爷很多
2024/8/18 2:37,dy,1,1,1,0,那么多话干嘛，直接把大爷送走，还走了车身祸害人
2024/8/18 2:37,dy,1,1,1,0,拿着鸡毛当令箭！这是传统！！！
2024/8/18 2:37,dy,0,1,1,-1,这大爷没遇到狠人[捂脸]
2024/8/18 2:37,dy,0,0,0,0,在中国这种情况很普遍，无奈
2024/8/18 2:37,dy,1,1,1,0,形式规整制度、流于表面
2024/8/18 2:37,dy,0,1,1,-1,钓鱼执法
2024/8/18 2:37,dy,0,1,1,-1,青岛特产吗？
2024/8/18 2:37,dy,0,1,1,-1,现在动刀子的越来越多，是有原因的[捂脸][捂脸][捂脸][捂脸][捂脸][捂脸]
2024/8/18 2:37,dy,0,1,1,-1,开除
2024/8/18 2:37,dy,1,0,0,1,[捂脸][捂脸][捂脸]
2024/8/18 2:37,dy,1,0,1,1,青岛和淄博不是一个省吧，区别在哪里[666]
2024/8/18 2:37,dy,1,1,1,0,很多这类人都是想过官瘾，恨不得有一丝权利就要管天管地
2024/8/18 2:37,dy,1,1,1,0,嚣张跋扈
2024/8/18 2:37,dy,0,0,0,0,@[炸弹][炸弹][炸弹][炸弹][炸弹][炸弹][炸弹]
2024/8/18 2:37,dy,1,1,1,0,青岛。不奇怪。
2024/8/18 2:37,dy,1,1,1,0,青岛为了拒绝外地游客也是拼尽全力了！来潍坊玩吧
2024/8/18 2:37,dy,1,1,1,0,这个是拿鸡毛当令箭白典型
2024/8/18 2:37,dy,0,1,1,-1,这个比青岛大虾更出名
2024/8/18 2:37,dy,1,1,1,0,我有钱那不能去，去，你，大，爷，的青岛
2024/8/18 2:37,dy,0,1,1,-1,严查大爷
2024/8/18 2:37,dy,1,1,1,0,青岛美不美没去过不下结论，但是袖章大爷和38元一只的大虾都很美[赞]
2024/8/18 2:37,dy,0,1,0,-1,其实也没多大事！这里明文规定不让摆摊！
2024/8/18 2:37,dy,0,0,0,0,今年青岛出事太多了，青岛市长要加强管理了！
2024/8/18 2:37,dy,1,1,1,0,从哪聘请来的领导他爹，来管事
2024/8/18 2:38,dy,0,1,0,-1,遥遥领先世界第一遥遥领先
2024/8/18 2:38,dy,0,1,0,-1,说是辞退，谁去验证？[捂脸][捂脸][捂脸]顶多避风头歇两天或者换个地方继续干，放心吧
2024/8/18 2:38,dy,0,1,0,-1,创业就这样被扼杀在摇篮里了
2024/8/18 2:38,dy,0,1,0,-1,严查青岛
2024/8/18 2:38,dy,1,1,1,0,黑暗的青岛大爷……
2024/8/18 2:38,dy,1,1,1,0,什么山东人仗义豪爽，看来也有垃圾
2024/8/18 2:38,dy,1,1,1,0,还一囗一个大爷:它也配？
2024/8/18 2:38,dy,1,1,1,0,打死都不去青岛了
2024/8/18 2:38,dy,1,1,1,0,戴个红袖就是大爷[捂脸]
2024/8/18 2:38,dy,0,1,1,-1,要不是学生他也不敢[呲牙]
2024/8/18 2:38,dy,0,1,0,-1,单位?他就是一个临时工，已经辞退了！[泪奔]
2024/8/18 2:38,dy,0,0,0,0,真牛逼……
2024/8/18 2:38,dy,0,0,0,0,本来想去青岛旅游  就改到大连吧[赞]
2024/8/18 2:38,dy,1,1,1,0,把手里那点权力用的淋漓尽致
2024/8/18 2:38,dy,1,1,1,0,这老头不是来解决问题的，而是来制造问题的
2024/8/18 2:38,dy,1,1,1,0,这是把一点点权利用到了极限了！
2024/8/18 2:38,dy,1,1,1,0,都是有背景的人 ！！
2024/8/18 2:38,dy,0,1,1,-1,水鬼升城隍，地保，保长，保丁，保甲。
2024/8/18 2:38,dy,0,1,1,-1,这就是青岛的态度。没啥好说的。青岛美不美我不知道。
2024/8/18 2:38,dy,1,1,1,0,还要抹黑？青岛早黑了。
2024/8/18 2:38,dy,1,1,1,0,我的乖乖辛亏是戴红袖章，如果是什么领导还了得，这权威
2024/8/18 2:38,dy,1,1,1,0,没有关系敢这么嚣张吗
2024/8/18 2:38,dy,0,1,1,-1,现实生活的人不都是这样的吗，何必大惊小怪！
2024/8/18 2:38,dy,1,1,1,0,青岛青岛太骄傲了[赞][赞][赞]
2024/8/18 2:38,dy,1,0,1,1,很不喜欢青岛
2024/8/18 2:38,dy,1,1,1,0,戴上红袖章，天下我最狂！！[尬笑][尬笑]
2024/8/18 2:38,dy,1,1,1,0,这又是哪个主任的爹，蛮横惯了
2024/8/18 2:38,dy,1,1,1,0,给点权利就张狂
2024/8/18 2:38,dy,0,0,0,0,那么大岁数都不知道这样容易吃社会的亏吗
2024/8/18 2:39,dy,0,1,1,-1,这就是一个佩戴袖章就这么嚣张，人民的权利人民的尊严无情的被践踏
2024/8/18 2:39,dy,1,1,1,0,青岛真的好吗[捂脸][捂脸]
2024/8/18 2:39,dy,0,0,0,0,官方通报，临时工
2024/8/18 2:39,dy,1,1,1,0,这老家伙一看就是黑社会
2024/8/18 2:39,dy,0,1,1,-1,因为他没孩子，所以它不知道现在年轻人的苦
2024/8/18 2:39,dy,1,1,1,0,当前流行的是：用手里的权力，尽可能为难他人[大笑]
2024/8/18 2:39,dy,1,1,1,0,沾点官边就不得了啊，我操
2024/8/18 2:39,dy,1,0,1,1,那里人都一个样！现在习惯了。
2024/8/18 2:39,dy,1,1,1,0,老头子就是羡慕你年轻，羡慕你能干很多他干不了的事，所以他们想霍霍你
2024/8/18 2:39,dy,0,0,0,0,说的太对了，小商小贩背后都有一个要生存的家庭。[赞][赞]
2024/8/18 2:39,dy,1,1,1,0,一副小人得志的嘴脸！
2024/8/18 2:39,dy,1,1,1,0,有些人就这样带个红手套就觉得高人一等[抠鼻]
2024/8/18 2:39,dy,1,1,1,0,少年很好，老头没人味
2024/8/18 2:39,dy,0,1,1,-1,这老头子是什么单位，执法权在哪里？
2024/8/18 2:39,dy,0,1,1,-1,权利至上的必然结果
2024/8/18 2:39,dy,1,1,1,0,青岛还用扌
2024/8/18 2:39,dy,1,1,1,0,大爷：你打我呀？你打我呀？
2024/8/18 2:39,dy,1,1,1,0,你碰到这样的执法流氓你还觉得青岛美吗？
2024/8/18 2:39,dy,1,1,1,0,广场管理处，是他儿子管着呢
2024/8/18 2:39,dy,1,1,1,0,它们基本上都是这德行
2024/8/18 2:39,dy,1,1,1,0,这么狂自会有狠人收他
2024/8/18 2:39,dy,0,0,0,0,和谐社会救了你
2024/8/18 2:39,dy,0,1,1,-1,谁是社会矛盾的制造者？让普通人活的这么难，如遇外敌入侵这些普通人还能奋不顾身反抗吗？
2024/8/18 2:39,dy,1,1,1,0,越是底层人民但凡有了一点权利都得把它发挥到极致！[捂脸]
2024/8/18 2:39,dy,0,0,0,0,环境就这样！权力就是高等！
2024/8/18 2:39,dy,1,1,1,0,想当年的街溜子变成了老流氓
2024/8/18 2:39,dy,0,0,0,0,每天报这有啥用，我们都知道，要结果，你也是赚流量
2024/8/18 2:39,dy,0,0,0,0,不用调查了，他是临时工
2024/8/18 2:39,dy,1,1,1,0,跟踪他，黑它板砖[泪奔]
2024/8/18 2:39,dy,0,1,1,-1,主持人，你来做城管呗，我想学一下怎么管
2024/8/18 2:39,dy,0,0,0,0,法就是法要什么温度？多少温度合适?
