timestamp,platform,label1,label2,label3,diff,content
2024/8/19 17:50,dy,0,1,1,-1,人都是自私的，社会就是这样，等你做好人的时候处处碰壁[呲牙]
2024/8/19 17:51,dy,1,1,1,0,戴红箍的……都很牛。
2024/8/19 17:52,dy,0,1,1,-1,退休金太高。介意严肃处理
2024/8/19 17:53,xhs,1,1,1,0,在职时一定是个贪官，严查！！！
2024/8/19 17:53,xhs,1,1,1,0,那是妥妥的地皮流氓
2024/8/19 17:53,xhs,1,0,1,1,什么东西！
2024/8/19 17:53,xhs,0,1,1,-1,有可能这货是个日本种。老人变坏了。这个社会怎么了？
2024/8/19 17:53,xhs,1,1,1,0,他没孩子！他没年轻过！
2024/8/19 17:53,xhs,1,0,1,1,人性
2024/8/19 17:53,xhs,1,1,1,0,为老不尊的典范
2024/8/19 17:57,dy,0,0,0,0,去青岛旅游知道黑不黑
2024/8/19 17:57,dy,1,1,1,0,山东大汉，小人得志
2024/8/19 18:03,dy,0,0,0,0,大爷人越多越兴奋～应该不是山东网友，可能是他家亲戚[捂脸]哪儿都有这种人，作为山东人也看不惯这种人
2024/8/19 18:05,dy,0,0,0,0,[赞]
2024/8/19 18:09,dy,0,1,1,-1,哎，[呲牙]删不了，[呲牙]删不了[呲牙][呲牙][呲牙]
2024/8/19 18:10,dy,0,0,0,0,我想看马翔宇
2024/8/19 18:12,dy,0,0,0,0,走卒贩夫皆有天道，何必 咄咄逼人呢？
2024/8/19 18:13,wb,1,1,1,0,这老头一直在挑衅
2024/8/19 18:14,dy,0,1,1,-1,如果遇上狠人，你戴个红袖章，[捂脸]老头家人就得为它戴黑袖章了[捂脸]
2024/8/19 18:15,dy,0,1,1,-1,这气势让我对青岛有了恐惧感
2024/8/19 18:25,dy,0,1,1,-1,社会上平时没有什么存在感的人一旦得到一点权力发挥极致了
2024/8/19 18:28,dy,0,0,0,0,E
2024/8/19 18:28,dy,0,0,0,0,必须停。
2024/8/19 18:31,dy,0,1,1,-1,上个世纪的产物，早该淘汰了[发怒][发怒][发怒][发怒][发怒]
2024/8/19 18:40,dy,0,1,1,-1,希望他家门口直播
2024/8/19 18:41,dy,0,0,0,0,世界末日来临
2024/8/19 18:41,dy,1,1,1,0,这货运气真好！但儿孙就不一定了！
2024/8/19 18:41,dy,1,1,1,0,红袖章裁上就，就高人一等
2024/8/19 18:44,dy,1,1,1,0,起肖他的退休金
2024/8/19 18:50,dy,1,1,1,0,戴个红袖章就这么狂，如果给它套制服穿着怕是要吃人了[发怒]
2024/8/19 18:56,dy,1,0,1,1,"""青岛的那位红袖章的大爷，"
2024/8/19 18:58,dy,0,1,1,-1,听好了，我是你大爷，我也骂你了，
2024/8/19 19:01,dy,0,1,1,-1,你来抓我呀，"
2024/8/19 19:04,dy,0,1,1,-1,卖不了哎卖不了
2024/8/19 19:12,dy,0,0,0,0,打过交道的都知道
2024/8/19 19:12,dy,0,1,1,-1,青岛还是别去了，大海，大虾，大爷，[捂脸]。
2024/8/19 19:15,dy,0,0,0,0,天黑！！！！睡觉！
2024/8/19 19:15,dy,0,0,0,0,[赞][赞][赞]
2024/8/19 19:20,dy,0,1,1,-1,流氓
2024/8/19 19:20,wb,1,0,1,1,咱们国家不让学生挣钱
2024/8/19 19:22,dy,1,1,1,0,小人嘴脸。那么大岁数跟个学生可有能耐了
2024/8/19 19:25,dy,0,1,1,-1,交保护费就让卖了
2024/8/19 19:33,dy,0,1,1,-1,有没有可能，这才是真实的态度[看]
2024/8/19 19:33,wb,1,0,1,1,贾队长这一刻附身，黄金彪都直呼内行，你细品，有那味儿了不
2024/8/19 19:34,dy,0,0,0,0,青海的兄弟看你们行动了
2024/8/19 19:36,dy,0,0,0,0,走遍山东，淄博真好
2024/8/19 19:38,dy,0,1,1,-1,这是优良传统，根源在哪里大家心知肚明。
2024/8/19 19:38,dy,0,1,1,-1,什么大爷最完犊子。
2024/8/19 19:50,dy,1,1,1,0,退休二资高啊！看这优越感这嘴脸！
2024/8/19 19:51,dy,0,0,0,0,究竟是什么人要人家删视频，你为什么不去找那个老头，让他公开给人家道歉呢
2024/8/19 19:54,dy,0,0,0,0,就是非编制人员
2024/8/19 19:56,dy,0,1,1,-1,简直就无解 一是大爷 二是带个红袖章
2024/8/19 19:59,dy,1,1,1,0,早绝种了还有孩子，你想多了
2024/8/19 20:01,dy,0,1,1,-1,卖不了？卖不了？
2024/8/19 20:02,wb,1,1,1,0,口罩时间这种人可不少，红袖一带，神气着呢
2024/8/19 20:04,dy,1,0,1,1,哼哼…不想评论！！！！
2024/8/19 20:05,wb,0,1,1,-1,莫欺少年穷
2024/8/19 20:06,dy,1,0,1,1,看来青岛没了聂磊翻天了[泪奔][泪奔][泪奔]
2024/8/19 20:07,dy,0,0,0,0,我记得网传：大学生言语不当激怒大爷，原来是断章取义。
2024/8/19 20:10,dy,1,1,1,0,他家哪来的大学生，连儿女都没有
2024/8/19 20:13,dy,0,0,0,0,不用查，是临时工。[捂脸][捂脸][捂脸][捂脸]
2024/8/19 20:16,dy,0,1,1,-1,从大虾到大爷都走在了前列，青岛优秀
2024/8/19 20:17,dy,1,1,1,0,这老头真混！！！
2024/8/19 20:22,wb,1,1,1,0,我们这边街道搞创文的还咒商家倒闭，简直侮辱了创文两个字
2024/8/19 20:27,dy,0,0,0,0,怎么大青岛也变成这样了？！[流泪][流泪]
2024/8/19 20:27,dy,0,1,1,-1,青岛大虾??，青岛大爷更??[捂脸][捂脸][捂脸]
2024/8/19 20:29,dy,0,0,0,0,[呲牙]青岛最近半个月火了四个大爷
2024/8/19 20:31,dy,0,0,0,0,什么管理员就是这个地皮
2024/8/19 20:32,dy,1,1,1,0,你算老几阿！？
2024/8/19 20:36,dy,0,1,1,-1,青岛有什么好的？
2024/8/19 20:36,dy,1,1,1,0,日本来的？
2024/8/19 20:38,wb,1,1,1,0,这大爷，一拳下去得硬挺很久吧
2024/8/19 20:40,xhs,1,0,1,1,是志愿者吗？如不是，哪又是什么单位在用这种年龄的人呢？
2024/8/19 20:40,xhs,1,1,1,0,一个能出来打工的大学生都远比那些啃老的年轻人好了不知多少倍 一个退休的老人还那么嚣张的去驱赶年龄与他孙子的孩子让人不舒服
2024/8/19 20:40,xhs,1,1,1,0,一看就是地痞流氓无赖的嘴脸
2024/8/19 20:43,dy,0,1,1,-1,青岛又一次让人记住了
2024/8/19 20:43,wb,1,0,1,1,人性，被欺负惯了的人有一点小权力就欺负人，比如一些官员本来是不能分的大学生是受气的，当了官就不一样
2024/8/19 20:45,dy,0,0,0,0,这不是很正常吗？
2024/8/19 20:46,dy,0,1,1,-1,青岛那个城市  打算去旅游里[捂脸]
2024/8/19 20:46,dy,1,1,1,0,人家投毒的“大～爷～”都没咋地，慢慢儿等着“大～爷～”们处理“大～爷～”的后续吧[抠鼻]
2024/8/19 20:48,dy,1,1,1,0,我是青岛[呲牙]我有权力[呲牙]我就张扬[呲牙]我就厉害[呲牙]
2024/8/19 20:49,wb,0,0,0,0,不解释不评价
2024/8/19 20:51,dy,0,0,0,0,青岛小哥！！！
2024/8/19 20:52,dy,1,1,1,0,大爷是日本人
2024/8/19 20:53,dy,0,0,0,0,老斯孩子
2024/8/19 20:53,wb,1,0,1,1,本来还想去青岛的，现在有点怕
2024/8/19 20:54,dy,0,1,1,-1,力量来自红袖箍
2024/8/19 20:55,dy,0,1,1,-1,这样的窗口岗位，就不合适这种素质低的人。
2024/8/19 21:02,dy,0,1,1,-1,就是无赖
2024/8/19 21:03,dy,1,1,1,0,青岛人，嗯标准的青岛人！
2024/8/19 21:03,dy,0,1,1,-1,这老头狂傲啊[看]小心闷棍[呲牙][呲牙]
2024/8/19 21:03,dy,0,0,0,0,放心大爷是零时工
2024/8/19 21:04,dy,0,1,1,-1,他就是典型干部作风
2024/8/19 21:06,dy,0,1,1,-1,这个老头，有靠山有保护伞好好查查
2024/8/19 21:07,dy,1,0,1,1,青岛小哥不好惹[捂脸][捂脸][捂脸]老哥也不是吃素的[捂脸][捂脸][捂脸][捂脸]
2024/8/19 21:07,dy,0,1,1,-1,当地熟人介绍一下这个老棉裤
2024/8/19 21:10,dy,0,1,1,-1,青岛海鲜谁敢去消费。
2024/8/19 21:12,wb,1,1,1,0,最后那副嘴脸贱兮兮的
2024/8/19 21:14,dy,0,1,1,-1,真威风
2024/8/19 21:14,dy,1,1,1,0,有权不用，天地不容，到处都有这种小人得志
2024/8/19 21:16,dy,1,1,1,0,典型的“官微”[捂脸]
2024/8/19 21:17,dy,0,1,1,-1,青岛很美，青岛各类管理人员美吗？
2024/8/19 21:20,dy,1,1,1,0,给他点权力看把他横的，小人得志给演绎的淋漓尽致。
2024/8/19 21:20,dy,1,1,1,0,小人嘴脸
2024/8/19 21:21,dy,1,1,1,0,青岛的士很牛，[捂脸]
2024/8/19 21:24,dy,0,0,0,0,[捂脸][捂脸][捂脸]
2024/8/19 21:24,dy,0,1,1,-1,这种阴阳怪调的人当执法者。青岛选人用人有问题。
2024/8/19 21:25,dy,0,1,1,-1,弄0他。
2024/8/19 21:27,dy,0,1,1,-1,青岛牛逼
2024/8/19 21:28,wb,0,0,0,0,大学生在广场卖东西属于什么性质经营？这个老大爷不让卖属于什么性质执法？
2024/8/19 21:31,dy,0,1,1,-1,美丽青岛，今生跟亲人朋友邻居再也不去3。
2024/8/19 21:33,dy,1,1,1,0,红袖章红马甲那是权利的象征
2024/8/19 21:33,dy,1,1,1,0,[流泪]完了，我在家排第二，估计是去不了青岛了
2024/8/19 21:34,dy,0,1,1,-1,取消青岛之旅，不能被它污染喽
2024/8/19 21:36,dy,1,1,1,0,对权力的运用发挥得淋漓尽致！
2024/8/19 21:36,dy,0,1,1,-1,青岛有这位大大爷[赞][赞][赞][赞][捂脸][捂脸][捂脸][捂脸][捂脸]
2024/8/19 21:37,dy,1,1,1,0,青岛的大爷永大爷大爷是。
2024/8/19 21:38,dy,1,0,0,1,大爷的态度实在让人不爽，被处罚也是应该，但是如果这个男子如果真是大学生，一句“我是你爹”合适吗？这就是当代大学生的素质？
2024/8/19 21:41,dy,0,0,0,0,小年轻不懂特权的厉害！
2024/8/19 21:43,dy,0,1,1,-1,这家伙还好没当官！
2024/8/19 21:44,dy,0,1,1,-1,大爷还是你大爷，
2024/8/19 21:49,dy,0,0,0,0,任何地方独特的美来自于大自然的奉献和人类的创造，但最后里面装的是大粪还是鲜花就不得而之了
2024/8/19 21:53,dy,1,1,1,0,青岛还要抹黑吗？天天喝墨水
2024/8/19 21:53,dy,0,0,0,0,把规定拿出来看看
2024/8/19 21:55,dy,0,1,1,-1,符合中国国标
2024/8/19 21:55,dy,0,1,1,-1,请问这是谁造成的？不就是有保护伞吗…
2024/8/19 21:57,dy,0,1,1,-1,现在只要有一点点权力，走起路都横着的！
2024/8/19 21:58,dy,0,1,1,-1,青岛大虾，青岛大爷都挺火[赞]
2024/8/19 21:59,dy,1,1,1,0,带上袖章就皇袍加身了！恨不得张口吃人
2024/8/19 21:59,dy,1,1,1,0,你算老几，他以为他此时威风的老子在这一片最大
2024/8/19 22:01,dy,1,1,1,0,青岛的光辉伟大自大虾开始，一路上啤酒节，中医冤案，导游骂游客，林林总总，起码地方大员不知道啊。
2024/8/19 22:01,wb,1,0,1,1,哎呀老流氓，吓死人了
2024/8/19 22:04,dy,0,0,0,0,你以为山东都是马晓磊吗
2024/8/19 22:04,dy,0,1,1,-1,好大的官威
2024/8/19 22:05,dy,0,1,1,-1,我们离文明还很遥远呢
2024/8/19 22:06,dy,0,0,0,0,青岛就是被这样的人给弄废了
2024/8/19 22:08,dy,0,0,0,0,为什么现在年轻人讨厌这个社会是有原因的
2024/8/19 22:08,dy,0,0,0,0,又拿鸡毛当令箭来说事了。
2024/8/19 22:08,dy,0,0,0,0,对社会底层人民的态度决定了文明的程度
2024/8/19 22:09,dy,0,1,1,-1,流氓
2024/8/19 22:09,dy,0,0,0,0,[赞][赞][赞]
2024/8/19 22:12,dy,0,0,0,0,开了没
2024/8/19 22:13,dy,0,0,0,0,莫欺少年穷
2024/8/19 22:13,wb,1,1,1,0,红袖章旁边还有几个黑皮狗在助威护主！
2024/8/19 22:14,dy,0,1,1,-1,老头五保户，要啥没啥
2024/8/19 22:14,dy,0,1,1,-1,吃着青岛的饭，砸了青岛的锅！不知道你自己家的碗能保住吗？
2024/8/19 22:14,dy,0,1,1,-1,绝对的是退休金太高了
2024/8/19 22:15,dy,0,1,0,-1,青岛[捂脸]
2024/8/19 22:17,dy,0,1,0,-1,青岛[捂脸][捂脸]
2024/8/19 22:17,dy,0,1,0,-1,青岛大爷
2024/8/19 22:18,dy,0,1,1,-1,青岛很美，人不美。
2024/8/19 22:20,dy,1,1,1,0,没有什么稀奇古怪的，国人一旦有一点小小的权利，都是这德行，骨子里的东西永远改变不了[捂脸][捂脸][捂脸]
2024/8/19 22:21,dy,0,1,1,-1,青岛很美，大爷难缠，
2024/8/19 22:22,dy,0,0,0,0,支持大学生勤工俭学
2024/8/19 22:24,dy,1,1,1,0,他都没有孩子 [捂脸]
2024/8/19 22:24,dy,0,0,0,0,全乱的感觉让我有点害怕
2024/8/19 22:25,dy,1,0,1,1,属于烟台下的一个县
2024/8/19 22:25,dy,0,0,0,0,后续要后续
2024/8/19 22:25,dy,1,1,1,0,青岛出了两个大爷，厉害，大家都别去青岛了
2024/8/19 22:27,dy,0,1,1,-1,它是大爷，牛逼
2024/8/19 22:27,dy,1,1,1,0,有没有认识他的。知道电话的。我打电话问候下它[看]
2024/8/19 22:28,dy,0,0,0,0,这位老人有什么权力赶人家走
2024/8/19 22:28,dy,0,0,0,0,山东人这样的人很多
2024/8/19 22:28,dy,1,1,1,0,那个老头就没有孩子
2024/8/19 22:28,dy,0,0,0,0,最讨厌这种新闻类的东西还要打马赛克。
2024/8/19 22:29,dy,1,1,1,0,大爷不是一般人，后台硬
2024/8/19 22:29,dy,1,1,1,0,把那老头的薪资取消，看看他能雄几天。支持的顶起。
2024/8/19 22:30,dy,0,0,0,0,青u新鲜事真多？
2024/8/19 22:31,dy,0,1,1,-1,这样的老头自已教育出来的子女不一定有好人品。
2024/8/19 22:31,dy,1,1,1,0,红袖章的日太朗
2024/8/19 22:32,dy,1,0,1,1,崂山景区雇佣的保安也是都素质很低的人
2024/8/19 22:32,dy,0,0,0,0,乱套了
2024/8/19 22:32,wb,1,1,1,0,是不是当年的红卫兵，造反派变老了
2024/8/19 22:33,dy,0,1,1,-1,这不是现在执法者的标配么
2024/8/19 22:33,dy,0,1,1,-1,这老头的官威好大呀
2024/8/19 22:34,dy,0,1,1,-1,查他
2024/8/19 22:34,dy,1,1,1,0,小人得志的嘴脸
2024/8/19 22:34,dy,0,0,0,0,那位大学生好好读书以后还是去国外发展吧……
2024/8/19 22:35,dy,0,0,0,0,临时工身份
2024/8/19 22:35,dy,0,1,1,-1,青岛美吗？？？青岛大虾！青岛大爷！青岛太美了[赞]
2024/8/19 22:36,dy,0,1,1,-1,祝这老先生像螃蟹一样红
2024/8/19 22:37,dy,0,1,1,-1,青岛的大爷全国最牛逼
2024/8/19 22:37,dy,0,1,1,-1,青岛大爷[赞][赞][赞][比心]
2024/8/19 22:38,dy,1,1,1,0,我敢保证他家没有大学生，因为他培养不出来。
2024/8/19 22:39,dy,0,1,1,-1,老六大爷～
2024/8/19 22:39,dy,0,0,0,0,回头相关单位来句避祸言辞：该大爷非本单位正式职工[捂脸][捂脸][捂脸]
2024/8/19 22:39,wb,0,0,0,0,呃…
2024/8/19 22:40,dy,0,0,0,0,美女谈谈上饶李佩霞的事儿，好吗？好想听听你的说法和看法
2024/8/19 22:40,dy,0,0,0,0,[赞][赞][赞]
2024/8/19 22:40,dy,1,1,1,0,怎么可能摸黑青岛。毕竟是青岛放生的事儿[捂脸][捂脸][捂脸]
2024/8/19 22:40,wb,1,0,1,1,老青岛不少gai溜子的，都是当年的小哥，现在青岛主城区都是外地人了
2024/8/19 22:41,dy,1,1,1,0,带红袖章的之前就是一市井无赖，不信大家人肉搜一下。
2024/8/19 22:42,dy,0,1,1,-1,这不是它们最喜欢用的人么，有啥奇怪的。
2024/8/19 22:43,dy,0,0,0,0,正中青岛市北区口音
2024/8/19 22:45,dy,1,1,1,0,现在有些人就是戴上牌子无法无天
2024/8/19 22:45,dy,0,1,1,-1,取消这个老头的养老金。
2024/8/19 22:49,dy,0,0,0,0,[赞][赞][赞]
2024/8/19 22:49,dy,0,1,1,-1,嚣张气焰惯了一辈子
2024/8/19 22:50,dy,0,0,0,0,实际事没多大，让你们给整大发了[捂脸]
2024/8/19 22:50,dy,0,1,1,-1,老啦都享特权
2024/8/19 22:50,dy,0,0,0,0,[赞][赞][赞]
2024/8/19 22:52,dy,1,1,1,0,取消他的养老金
2024/8/19 22:53,dy,0,0,0,0,领导统一回复，临时聘用人员和领导干部无关系
2024/8/19 22:53,dy,0,0,0,0,临时工，已被开除
2024/8/19 22:54,dy,1,1,1,0,这就是手中有权利的样子的样子的人的嘴脸。
2024/8/19 22:55,dy,0,1,1,-1,这伙计对谁会摇，对谁会咬是贼清楚的！
2024/8/19 22:55,dy,0,1,1,-1,老家伙自己问的，大学生给他回答了有错吗，
2024/8/19 22:55,dy,0,1,1,-1,能在五四广场执勤很娇嗷啊！
2024/8/19 22:57,dy,1,1,1,0,过去的青岛小哥现在的嚣张跋扈大爷
2024/8/19 22:57,dy,0,1,1,-1,年轻人不狂没出息，老年人不狂没退休金
2024/8/19 22:57,dy,0,0,0,0,不用查，临时工[抠鼻][捂脸]
2024/8/19 22:58,dy,0,1,1,-1,人性中的恶，就是哪怕有了芝麻大的权力，都要最大化的为难别人。
2024/8/19 22:58,dy,0,1,1,-1,青岛大虾，还记得吗？
2024/8/19 22:58,dy,0,1,1,-1,为啥说青岛垃圾:到处都是招聘中介！找个工作必须靠中介才能进去[捂脸]
2024/8/19 22:59,dy,0,1,1,-1,为青岛点赞！还有人去吗？自己把自己玩完了？看看一年后的青岛经济？
2024/8/19 22:59,dy,0,0,0,0,临时工，
2024/8/19 22:59,dy,1,1,1,0,牛逼大爷不下岗，我永不去青岛[握手]
2024/8/19 23:00,dy,0,1,1,-1,发生战争他第一个身份证报废
2024/8/19 23:01,dy,1,1,1,0,它应该是个在地方上的混混[捂脸]
2024/8/19 23:01,dy,1,1,1,0,胡汉三式的执法
2024/8/19 23:02,dy,0,1,1,-1,真牛逼[赞]
2024/8/19 23:02,dy,0,0,0,0,那句话怎么说的，不要利用自己手里的小小权力，给别人制造麻烦
2024/8/19 23:03,dy,0,0,0,0,[666][666][666]
2024/8/19 23:03,dy,0,0,0,0,像电视剧里的镜头。
2024/8/19 23:03,dy,0,1,1,-1,其实这才是真正的青岛人，地道！
2024/8/19 23:04,dy,1,1,1,0,这老头都没有儿子，那有孙子，有也应该是别人的[敲打]
2024/8/19 23:05,dy,1,0,1,1,是“青岛啤酒”的那个青岛吗？
2024/8/19 23:06,dy,1,1,1,0,没办法孤寡老人
2024/8/19 23:06,dy,1,1,1,0,大爷果然就是大爷[捂脸][捂脸][捂脸]，送他上热搜
2024/8/19 23:07,dy,0,1,1,-1,本来还准备去青岛，现在不不敢去了，因为害怕
2024/8/19 23:07,dy,1,1,1,0,青岛还有一个从楼上往下扔大便的阿姨。他两估计是一家人。
2024/8/19 23:07,dy,0,1,0,-1,艹，这社会怎么了！
2024/8/19 23:07,dy,0,0,0,0,大连西岗区一女法官在电话中更猖狂！[赞][赞][赞]
2024/8/19 23:08,dy,0,1,1,-1,青岛大爷牛
2024/8/19 23:08,dy,0,0,0,0,都是山东，淄博做的那么好，区别怎么就这么大呢[流泪]
2024/8/19 23:08,dy,0,1,1,-1,应该查查他年轻是做什么的
2024/8/19 23:08,dy,0,1,1,-1,手上有权就横，这就是文化的劣根性！
2024/8/19 23:08,dy,0,1,1,-1,红?与衣服一穿，就是牛啊！
2024/8/19 23:08,dy,0,0,0,0,习惯就好
2024/8/19 23:09,dy,1,1,1,0,人性最大的恶就是用自己有限的是权力去无限为难他人
2024/8/19 23:10,dy,0,0,0,0,东大这种人太多！
2024/8/19 23:12,dy,1,1,1,0,手里稍微有点权利的，都想弄死老百姓
2024/8/19 23:13,dy,0,0,0,0,这些人请清理
2024/8/19 23:14,dy,0,1,1,-1,青岛代言人[捂脸]
2024/8/19 23:15,dy,0,1,1,-1,关系户牛逼得很。
2024/8/19 23:15,dy,0,0,0,0,上一次出名好像是往啤酒里尿尿
2024/8/19 23:15,dy,1,0,1,1,青岛完蛋了[抠鼻]
2024/8/19 23:16,dy,0,0,0,0,不让摆摊，人家非摆有什么办法？你温柔对待摆摊的？他能温柔的走？你们是这些人真是能带流量
2024/8/19 23:16,dy,0,1,1,-1,反正不能去[捂脸][捂脸][捂脸]
2024/8/19 23:16,dy,0,0,0,0,这大爷绝对不是青岛人！老家是南河一带[捂脸]
2024/8/19 23:17,dy,1,1,1,0,青岛不倒，老头要倒
2024/8/19 23:19,dy,0,0,0,0,难道别的城市不是这样子？作为本地人，见过的执法，执勤人员几乎都这气势啊[抠鼻]
2024/8/19 23:20,dy,0,0,0,0,怎么也得给杨威点赞[赞][赞][赞][赞][赞][比心][比心][比心]
2024/8/19 23:20,dy,0,0,0,0,[捂脸][捂脸][捂脸]
2024/8/19 23:21,dy,0,1,1,-1,没有文明
2024/8/19 23:22,dy,1,1,1,0,他配大爷这个词吗？
2024/8/19 23:22,dy,1,1,1,0,让一个等死的人执勤，不就是有事的装死
2024/8/19 23:23,dy,1,1,1,0,查查那个单位的，为老不尊
2024/8/19 23:23,dy,1,1,1,0,小人得志的嘴脸
2024/8/19 23:23,wb,1,1,1,0,删热度了
2024/8/19 23:24,dy,0,0,0,0,复制一个评论:在有限的权力内无限放大自己的刁难。
2024/8/19 23:25,dy,0,1,1,-1,是不是有个明星跟这个男的很像，这个男的演坏人本色出演啊[看]
2024/8/19 23:25,dy,0,1,1,-1,戴上脖套感觉真好
2024/8/19 23:25,dy,0,0,0,0,[赞][赞][赞]
2024/8/19 23:25,dy,0,1,1,-1,有点权利尾巴翘天上了
2024/8/19 23:26,xhs,1,1,1,0,青岛当地人表示这样的老头老麻麻一点也不少，不知道哪来的优越感，市南的看不上市北的，市北的看不上李村的，李村的瞧不起城阳的……
2024/8/19 23:26,xhs,1,0,1,1,算了不再去青岛了！
2024/8/19 23:26,xhs,1,1,1,0,品行极其恶劣，品德极其低下，骨子里就是地痞流氓，一辈子做恶，不会有好下场[生气R][生气R][生气R]
2024/8/19 23:26,xhs,1,0,0,1,青岛怎么了？
2024/8/19 23:26,xhs,1,1,1,0,这个年龄当保安挣钱，背后一定有一个当官的亲戚朋友。
2024/8/19 23:26,xhs,1,1,1,0,对拿个麦杆儿当拐棍儿，用什么玩意儿i
2024/8/19 23:26,xhs,1,0,1,1,青岛又要热一波
2024/8/19 23:26,xhs,1,0,1,1,各地方有各地方的规矩，不给卖就不要卖了。
2024/8/19 23:26,xhs,0,0,0,0,双方都难
2024/8/19 23:26,xhs,1,1,1,0,你去细品青岛人
2024/8/19 23:26,xhs,1,1,1,0,带节奏高手
2024/8/19 23:26,xhs,1,0,1,1,呼叫淄博、呼叫淄博……马书记在吗？
2024/8/19 23:26,xhs,0,0,0,0,说的好，说的对！言词有理有据，
2024/8/19 23:26,xhs,1,1,1,0,老坏种，！
2024/8/19 23:27,dy,1,1,1,0,真是但凡有点权利就必须变成“官”
2024/8/19 23:27,dy,1,0,1,1,同是一个爹青岛与淄博咱就不一样？
2024/8/19 23:28,dy,0,1,1,-1,我觉得挺好的，组织都没给他配把枪
2024/8/19 23:30,dy,0,0,0,0,红了[赞]
2024/8/19 23:30,dy,0,1,1,-1,建议取消这个老人一切。追究责任。
2024/8/19 23:30,dy,0,0,0,0,[666][666][666]
2024/8/19 23:31,dy,1,1,1,0,好好查查这个老头背后肯定有内容
2024/8/19 23:31,dy,0,0,0,0,唉，，青岛，，大爷，，，
2024/8/19 23:32,dy,1,1,1,0,这个老头不简单，一看就是个有背景的人
2024/8/19 23:32,dy,1,1,1,0,他家不配有
2024/8/19 23:33,dy,1,1,1,0,用最小的权力行最大恶。青岛大爷做到了
2024/8/19 23:34,dy,0,1,1,-1,哦，那边人优越性高啊
2024/8/19 23:34,dy,0,0,0,0,就不能学学淄博吗
2024/8/19 23:35,dy,0,1,1,-1,取消他的退休养老保险资金。[捂脸][捂脸][捂脸]
2024/8/19 23:35,dy,0,1,1,-1,为老不尊
2024/8/19 23:35,wb,1,1,1,0,就这人还红袖呢
2024/8/19 23:36,dy,1,1,1,0,如果是奸淫掳掠的黄四狼他就不敢了。
2024/8/19 23:36,dy,0,0,0,0,就一个身份这么难挖吗
2024/8/19 23:36,dy,0,0,0,0,没打没骂比好多城管强百倍了，还被全网斥责，网民典型的欺软怕硬！
2024/8/19 23:37,dy,0,1,1,-1,不知道它权利有多大？
2024/8/19 23:37,dy,0,1,1,-1,青岛大虾我们都还记得
2024/8/19 23:38,dy,1,1,1,0,红袖章就是权利啊[捂脸]
2024/8/19 23:39,dy,1,0,1,1,青岛的车牌牛B
2024/8/19 23:40,dy,0,1,1,-1,时代不缺红袖章先锋
2024/8/19 23:40,dy,0,1,1,-1,应该说法治社会救了他一命
2024/8/19 23:41,dy,1,1,1,0,我有权利我最大，看见领导低头哈腰我最小[呲牙]
2024/8/19 23:41,dy,0,1,1,-1,大虾大爷
2024/8/19 23:41,dy,0,1,1,-1,青岛大虾，大连停车~[九转大肠]
2024/8/19 23:42,dy,0,1,1,-1,拉到吧，就没????的地方
2024/8/19 23:42,dy,1,1,1,0,这才是青岛本地人刻在骨子里狂傲
2024/8/19 23:44,dy,1,1,1,0,古有青岛大虾[捂脸]今有青岛大爷
2024/8/19 23:44,dy,1,1,1,0,微笑大使没有大爷我绝对不同意
2024/8/19 23:45,dy,1,1,1,0,这大爷不但是五保户，还是绝代户，他怕谁？？？？
2024/8/19 23:45,dy,1,1,1,0,青岛一直这个样，官文化的地方
2024/8/19 23:45,dy,0,0,0,0,最烦的一句话：进一步调查！（调查当事人有没有靠山？）
2024/8/19 23:47,dy,0,0,0,0,如果遇到脾气暴的，很可能吃不了兜着走了
2024/8/19 23:47,dy,0,0,0,0,好客山东欢迎你[看]
2024/8/19 23:47,dy,1,0,0,1,这种是普遍现象，只要手里有那么一点点权，就叫你吃不了兜着走
2024/8/19 23:47,dy,0,1,1,-1,山东潍坊人民建议取消嚣张大爷养老金
2024/8/19 23:48,dy,0,0,0,0,中国人没记忆力。一两天就忘记了。
2024/8/19 23:48,dy,1,1,1,0,一看就是那帮子人的嘴脸[抠鼻]
2024/8/19 23:48,dy,0,1,1,-1,对待“黄四郎”他很有礼貌的
2024/8/19 23:48,dy,1,1,1,0,中国人的本性，只要有一点点权利都会发挥的淋漓尽致[赞][赞]
2024/8/19 23:49,dy,0,0,0,0,哈哈哈哈哈[尬笑][尬笑][尬笑]
2024/8/19 23:49,dy,0,0,0,0,[打脸][打脸][打脸][打脸][打脸][打脸][打脸][大笑]
2024/8/19 23:50,dy,0,1,1,-1,太猖狂，要教育他
2024/8/19 23:50,dy,0,0,0,0,你说的都很好，主持人，这种现象在中国是很普遍的，这就是人心了
2024/8/19 23:51,dy,1,1,1,0,这个老人的孩子估计也好不了那去。
2024/8/19 23:51,dy,0,1,1,-1,青岛的执法人不都这么狂吗！
2024/8/19 23:54,dy,0,0,0,0,[赞][赞][赞][赞][赞][赞][赞][赞]
2024/8/19 23:54,dy,0,0,0,0,丢我大山东的脸[发怒]
2024/8/19 23:55,dy,0,1,1,-1,它算老几？
2024/8/19 23:55,dy,0,1,1,-1,恶心
2024/8/19 23:55,dy,0,1,1,-1,青岛大虾很美，青岛大爷很牛
2024/8/19 23:56,dy,0,1,1,-1,戴个红袖章不知道自己是谁了。都是社会底层人。
2024/8/19 23:57,dy,1,1,1,0,在弱者面前是强者，在强者面前是奴才。在善良面前非常凶狠，在罪恶的面前却惊人的沉默
2024/8/19 23:58,dy,0,1,1,-1,还记得青岛大虾不
2024/8/19 23:58,dy,0,1,1,-1,袖章一戴谁都不爱
2024/8/19 23:58,dy,0,1,1,-1,青岛不值得去，勒瑟
2024/8/19 23:59,dy,0,0,0,0,大爷应该是个临时工[呲牙][呲牙][呲牙]
2024/8/19 23:59,dy,0,1,1,-1,可以猜猜这货当年是混哪里的，看谁猜的准，我才这是城管退休的[捂脸]
2024/8/19 23:59,dy,0,1,1,-1,这就是有点权力就上天的人。
2024/8/19 23:59,dy,1,1,1,0,现代黄邪军[捂脸]
2024/8/19 23:59,dy,0,1,1,-1,年纪大，遇事尤其是遇到能做自己孩子的年龄的人，没有点慈心，是没活明白，还是城市没有文化底蕴。
2024/8/19 23:59,dy,0,1,1,-1,拿个鸡毛当令箭
2024/8/19 23:59,dy,1,1,1,0,青岛大虾青岛大爷青岛大的讨厌
2024/8/19 23:59,dy,1,1,1,0,小人得了一点点小势！[捂脸]
2024/8/19 23:59,dy,1,1,1,0,人肉搜索
2024/8/19 23:59,dy,0,0,0,0,权利对国人的诱惑力太大了
2024/8/19 23:59,dy,0,1,1,-1,给他点权利就不知道怎么N瑟了，太过了。
2024/8/19 23:59,dy,0,1,1,-1,拿着扇子执法，看样子是很舒适吧。是不是占用国家资源？是你养老的吗？
2024/8/19 23:59,dy,0,1,1,-1,有退休工资的，就不要再让上班了，在和中年人，年轻人挣工作
2024/8/19 23:59,dy,0,1,0,-1,真牛逼
2024/8/19 23:59,dy,1,1,1,0,九十年代的小混混演变成现在的执勤者[赞][赞]
2024/8/19 23:59,dy,0,1,1,-1,吃着年轻人的养老金
