timestamp,platform,label1,label2,label3,diff,content
2024/8/18 8:36,dy,0,1,0,-1,好客山东吗？？山东有这样吗？？？
2024/8/18 8:36,dy,0,1,1,-1,拿上退休金还挣上便便宜钱不知百姓生活了
2024/8/18 8:37,dy,1,1,1,0,他是孤老体会不了读书的艰辛！
2024/8/18 8:37,dy,1,1,1,0,老|西@下全都JR你了[抠鼻]
2024/8/18 8:37,dy,1,1,1,0,没碰见狠的。不然的话现在可能在地下室了。
2024/8/18 8:37,dy,1,1,1,0,稍微有点权利就露出一副恶心的嘴脸
2024/8/18 8:37,dy,1,1,1,0,鸡毛当令箭
2024/8/18 8:37,dy,1,1,1,0,吃公食哪个都一样的大爷臭毛病
2024/8/18 8:38,dy,0,0,0,0,支持，小扬记者正能量播报公平正义[赞][赞][赞]
2024/8/18 8:38,dy,1,1,1,0,自己上了这个位子、不知道自己姓什么
2024/8/18 8:38,dy,1,1,1,0,最没权利的人  有这最牛逼的权利   可笑
2024/8/18 8:38,dy,0,0,0,0,[赞][赞][赞]
2024/8/18 8:38,dy,1,0,1,1,青岛大虾美
2024/8/18 8:38,wb,1,1,1,0,这副嘴脸不错 小人得志都不太确切 词穷
2024/8/18 8:39,dy,1,1,1,0,穿上制服就是陈佩斯[捂脸][捂脸][捂脸]谁还在乎朱时茂？？？
2024/8/18 8:39,dy,0,0,0,0,临时工而已，好处理
2024/8/18 8:40,dy,0,0,0,0,必须道歉
2024/8/18 8:40,dy,0,0,0,0,不要胡说，没有规矩不成方圆，要么你有能力撤掉城管，难道公园里都去卖东西玩具吗，不知道详情还是不要评论，
2024/8/18 8:40,dy,0,0,0,0,去淄博卖淄博好
2024/8/18 8:40,dy,1,1,1,0,建议取消老头的退休金
2024/8/18 8:41,dy,1,1,1,0,青岛很美，红袖章更美
2024/8/18 8:41,dy,0,1,1,-1,权力使人变坏还是人使权力变坏？
2024/8/18 8:41,dy,0,0,0,0,权利[捂脸]
2024/8/18 8:41,wb,1,1,1,0,有点权利就不知道东南西北了
2024/8/18 8:42,dy,1,1,1,0,这就是青岛的德性
2024/8/18 8:43,dy,1,1,1,0,符合物业人员的气势，我们这物业就是这样，社区也保护物业。[666][赞][赞]
2024/8/18 8:43,dy,0,0,0,0,依法严惩
2024/8/18 8:44,dy,1,1,1,0,这个大爷是个孤老头，一个人的，[得意][得意][得意][得意][得意]
2024/8/18 8:44,dy,1,1,1,0,都一把年纪了还这么惯势。
2024/8/18 8:44,dy,1,1,1,0,"""处罚老百姓罚死罚干"
2024/8/18 8:44,dy,0,0,0,0,出罚有权有钱的自罚三杯"
2024/8/18 8:44,dy,0,0,0,0,又是青岛。
2024/8/18 8:44,dy,0,1,0,-1,这老头代表不了青岛，用它的单位不能用了，…
2024/8/18 8:45,dy,1,1,1,0,这个“人”，口音不像青岛的！有可能是日本建在青岛的学校里毕业的！建议查它三代！
2024/8/18 8:46,dy,1,0,0,1,临时工[捂脸][捂脸][捂脸]肯定又是临时工
2024/8/18 8:46,dy,1,1,1,0,隔着屏幕都觉得大爷还是你大爷
2024/8/18 8:46,dy,1,1,1,0,这是{黑吗？？？这难道不是常态吗
2024/8/18 8:46,dy,0,1,0,-1,这个世上最大的恶就是用自己的权利，最大的为难别人
2024/8/18 8:47,dy,1,1,1,0,小人得志，可怜之人。
2024/8/18 8:47,dy,1,1,1,0,青岛的大爷们火了
2024/8/18 8:48,dy,0,0,0,0,让他们跟我们大淄博学习一下[捂脸]
2024/8/18 8:48,dy,0,0,0,0,哎，青岛也有这样的人！
2024/8/18 8:48,dy,1,0,1,1,青岛大虾[呲牙]
2024/8/18 8:48,dy,1,1,1,0,拿鸡毛当令箭[鼓掌]
2024/8/18 8:49,dy,0,0,0,0,这大爷估计疫情没赶上
2024/8/18 8:49,dy,1,1,1,0,用最小的权力，作作最大的恶。
2024/8/18 8:49,dy,0,1,1,-1,大爷不一定都善良。
2024/8/18 8:50,dy,1,1,1,0,这老头儿要是在我湖北敢这么嚣张跋扈，绝对会被打得磕头认错信不[]
2024/8/18 8:50,dy,0,1,1,-1,哪个部门带这样的袖章，是负责什么的，是不是欺软怕硬呢
2024/8/18 8:51,dy,0,0,0,0,三年疫情说明了一切[看][看][看][看][看][看]
2024/8/18 8:51,dy,1,1,1,0,不止青岛的大爷是大爷，到处多的去了，特别是退休的[捂脸][捂脸]
2024/8/18 8:51,dy,0,0,0,0,支持主播[赞][赞][赞]
2024/8/18 8:52,dy,1,1,1,0,一点点小小权力，大爷的给用到了级限[抠鼻]
2024/8/18 8:52,dy,1,1,1,0,这个老头年青时肯定欺负过很多人，也许还有偷奸过女人
2024/8/18 8:52,dy,0,0,0,0,临时工，没事
2024/8/18 8:53,dy,1,1,1,0,拉黑，还用解释么[抠鼻]
2024/8/18 8:53,dy,0,0,0,0,@正在，进一步，核查，在哪些地方办公，属于哪个部门管？
2024/8/18 8:53,dy,0,0,0,0,不要断章取义
2024/8/18 8:53,dy,0,0,0,0,在中国为什么容不下卖货的商贩呢
2024/8/18 8:53,dy,1,1,1,0,土都埋脖子的人了，给后代积点德
2024/8/18 8:54,dy,0,0,0,0,适合躺平
2024/8/18 8:54,dy,1,1,1,0,老人家应该是收入不错的老干部[大笑][大笑][大笑]
2024/8/18 8:54,dy,0,0,0,0,牛逼
2024/8/18 8:54,dy,0,1,1,-1,青岛很美  但是有这位大爷   我不敢去
2024/8/18 8:54,dy,1,1,1,0,青岛怎么了？丢人
2024/8/18 8:54,dy,1,1,1,0,感觉他比市领导都牛逼
2024/8/18 8:54,dy,1,1,1,0,官越小。人越凶[捂脸][捂脸][捂脸][捂脸][捂脸][捂脸]
2024/8/18 8:55,dy,1,0,1,1,老头还这么大火气
2024/8/18 8:55,dy,0,0,0,0,抖音只是把现实传播更快了[泪奔]
2024/8/18 8:55,dy,0,0,0,0,自带优越感。
2024/8/18 8:55,dy,1,1,1,0,[酷拽]这老头看样子就不是好说话的
2024/8/18 8:56,dy,1,1,1,0,谁家养的打手
2024/8/18 8:57,dy,0,0,0,0,为什么要给老人当爹
2024/8/18 8:57,dy,1,0,0,1,[赞][赞][赞]
2024/8/18 8:57,dy,0,1,1,-1,但凡有点权利，都会发挥的淋漓尽致我
2024/8/18 8:57,wb,1,1,1,0,青岛执法就这么傲慢吗，
2024/8/18 8:58,dy,0,1,1,-1,用工单位有意找这些年龄大的锤不得打不得还骂不得！[捂脸][捂脸][捂脸][捂脸][捂脸]
2024/8/18 8:58,dy,0,0,0,0,还40度，现在都80度了
2024/8/18 8:58,dy,1,1,1,0,假酒喝多了吧[捂脸][捂脸][捂脸]
2024/8/18 8:58,dy,1,1,1,0,这大爷既有退休金又有当保安工资，就瞧不起咱平头百姓的
2024/8/18 8:58,dy,0,0,0,0,又是青岛，唉！
2024/8/18 8:59,dy,0,0,0,0,就是这样让你好好活着
2024/8/18 8:59,dy,1,0,0,1,[捂脸][捂脸][捂脸]
2024/8/18 9:00,dy,1,1,1,0,青岛的小人得势，
2024/8/18 9:00,dy,0,1,1,-1,这个社会就是不一样，你不坏还不让你上岗呢
2024/8/18 9:01,dy,0,1,1,-1,淋漓尽致的中国现状！！！
2024/8/18 9:02,dy,1,1,1,0,看看都白毛了还出来打工，自己生活不如意还难维别人[看]
2024/8/18 9:02,dy,1,1,1,0,什么全球严峻就业形势？  漂亮村樱花村可是全球抢劳工
2024/8/18 9:02,dy,1,1,1,0,牛逼哄哄滴这个劲儿[捂脸]
2024/8/18 9:02,dy,0,1,1,-1,真的不想去青岛！
2024/8/18 9:02,dy,0,1,1,-1,应该去当大官    大官比它还牛B
2024/8/18 9:03,dy,1,1,1,0,倚老卖老！欺人太甚！
2024/8/18 9:04,dy,0,1,1,-1,有权的人执法起来很多些时候很难有温度！
2024/8/18 9:04,dy,1,1,1,0,大半辈子默默无闻，出名即休，大红之日便是……蟹速
2024/8/18 9:04,dy,1,1,1,0,青岛已经黑了，还怎么漂白
2024/8/18 9:05,dy,1,1,1,0,他们部门都撤销养老金，让他知道没有保障他们什么都不是
2024/8/18 9:05,dy,0,1,1,-1,改签，这辈子不去青岛了
2024/8/18 9:06,dy,1,0,1,1,这个大爷可能是光棍一条
2024/8/18 9:06,dy,1,0,1,1,办他
2024/8/18 9:06,wb,1,0,1,1,青岛是吧？好样的。
2024/8/18 9:07,dy,1,1,1,0,看他牛逼的，倚老卖老
2024/8/18 9:07,dy,0,1,1,-1,中国人对中国人就是狠，爱都给外国人
2024/8/18 9:07,dy,1,1,1,0,美丽的青岛的大爷都是爷
2024/8/18 9:07,dy,1,0,1,1,茅台喝多的大y[捂脸]
2024/8/18 9:08,dy,1,1,1,0,青岛很美，人不美
2024/8/18 9:08,dy,0,0,0,0,[赞][赞][赞][赞][赞]
2024/8/18 9:09,dy,0,0,0,0,边上不是还有警察吗
2024/8/18 9:09,dy,0,0,0,0,主持人讲的太好了，给你点赞[赞][赞][赞]。
2024/8/18 9:09,dy,0,0,0,0,严打漏网之鱼，所以现在嚣张。
2024/8/18 9:09,dy,0,1,1,-1,小人得志就是这个样子。
2024/8/18 9:10,dy,0,0,0,0,太可怕了，好好查下
2024/8/18 9:10,dy,1,1,1,0,戴着孝都这么狂，穿上皮的那些不敢想象了
2024/8/18 9:10,dy,0,0,0,0,这帮人就是疫情期间为难老百姓那帮人
2024/8/18 9:11,dy,1,1,1,0,拿根鸡毛当令箭……
2024/8/18 9:11,dy,1,1,1,0,@看它有没有退休费，如果它没有退休费，它也会做一点小买卖看它整么想
2024/8/18 9:11,dy,0,0,0,0,所以，小商小贩都得带把水果刀
2024/8/18 9:11,dy,0,0,0,0,年轻人先骂大叔的吧？
2024/8/18 9:11,dy,0,1,1,-1,倚老卖老   你能把它怎么滴
2024/8/18 9:11,dy,1,1,1,0,五保户，没尝过儿女滋味[捂脸]
2024/8/18 9:12,dy,0,0,0,0,期待你能让我们看到后续。
2024/8/18 9:12,dy,0,0,0,0,学习一淄博
2024/8/18 9:12,dy,0,0,0,0,都是底层人，大爷为了工作，应该是怡养天年的年龄，不知有退休金没有[流泪][流泪]还在为三瓜两枣奋斗，你不听劝，是砸别人饭碗，没拼命就不错了[流泪][流泪][流泪]何苦为难穷人
2024/8/18 9:13,dy,1,0,1,1,这个应该背后下黑手[炸弹][炸弹][炸弹][炸弹][炸弹][炸弹]
2024/8/18 9:14,dy,1,0,1,1,青岛不怕黑
2024/8/18 9:14,dy,1,1,1,0,老头肯定是孤老，无子女的人一般才这样
2024/8/18 9:14,dy,0,0,0,0,果断改去淄博
2024/8/18 9:14,dy,1,1,1,0,这有啥好奇怪的，流氓也会老呀
2024/8/18 9:15,dy,1,1,1,0,抵制青岛大爷[赞]
2024/8/18 9:15,dy,0,0,0,0,讲的好[赞][赞][赞]
2024/8/18 9:16,dy,0,0,0,0,整体美才算美
2024/8/18 9:16,dy,1,0,1,1,街道叫来的临时工。
2024/8/18 9:17,dy,0,1,1,-1,没人味
2024/8/18 9:17,dy,0,1,1,-1,无语
2024/8/18 9:17,dy,0,0,0,0,幸亏这小伙脾气不大，如果脾气大点打你一顿！是不是又有养老地儿啦
2024/8/18 9:17,dy,1,0,1,1,大虾的余热还没褪去，青岛大爷跟进
2024/8/18 9:18,dy,0,0,0,0,青岛频爆雷
2024/8/18 9:19,dy,0,1,1,-1,大爷背后力量大
2024/8/18 9:19,dy,1,1,1,0,青岛老头[赞][赞][赞]
2024/8/18 9:19,dy,0,1,1,-1,老牙刷拿鸡毛当令箭
2024/8/18 9:20,dy,1,0,1,1,孤寡老人，没有孩子
2024/8/18 9:20,dy,0,0,0,0,[赞][赞][赞]为正义发声呐喊[感谢][感谢][感谢]
2024/8/18 9:20,dy,1,0,1,1,他家没孩子[捂脸][捂脸][捂脸]
2024/8/18 9:20,dy,1,1,1,0,青岛的负面真不少，搜索“侯元祥”就知道真实的青岛了。
2024/8/18 9:20,dy,0,1,1,-1,青岛很美，但那些坐在办公室里，不思人间疾苦的领导们，怎么会理解百姓疾苦。
2024/8/18 9:21,dy,0,1,1,-1,都不要来青岛了
2024/8/18 9:21,dy,0,0,0,0,[赞][赞][赞][赞][赞][赞][赞][玫瑰][玫瑰][玫瑰][玫瑰][玫瑰][玫瑰][玫瑰][玫瑰]
2024/8/18 9:21,dy,1,0,1,1,我是青岛的，我想跟大爷混
2024/8/18 9:22,dy,0,1,1,-1,改变了我去青岛的想法
2024/8/18 9:22,dy,0,1,1,-1,整个青岛都这样，市场无边
2024/8/18 9:22,dy,0,1,1,-1,这样的工作人员不下课，难平民愤
2024/8/18 9:22,dy,0,1,1,-1,你去万达门口试试 保安牛得要命
2024/8/18 9:22,dy,0,0,0,0,都几天了，没有后续？？？
2024/8/18 9:23,dy,1,1,1,0,阎王好惹 小鬼难缠
2024/8/18 9:23,dy,0,0,0,0,@老熊[看][看]
2024/8/18 9:23,dy,0,1,1,-1,不给底层困难的人不留一点活路，这是想把他逼成什么样？
2024/8/18 9:23,dy,0,1,1,-1,应该是平常嚣张跋扈惯了！
2024/8/18 9:23,dy,1,1,1,0,应该把这老头拍照片一样全青岛墙上给贴过去
2024/8/18 9:23,dy,1,1,1,0,但凡家里有一个人喜欢他的，这么大年龄了也不会让他出来混日子
2024/8/18 9:24,dy,1,1,1,0,没事哪里没有屎[捂脸][捂脸][捂脸]
2024/8/18 9:24,dy,0,1,1,-1,兄弟还是去淄博吧，青岛看起来和其他城市一样不大好混
2024/8/18 9:24,dy,1,1,1,0,这大爷让人讨厌恶心！
2024/8/18 9:25,dy,1,1,1,0,老头太嚣张了！刚入社会的大学生体会到了什么？
2024/8/18 9:26,dy,0,0,0,0,让人心凉了
2024/8/18 9:26,dy,0,0,0,0,我始终想不明白，为什么不可以沿街叫卖？没有扰民，没有喇叭，没乱丢垃圾，为什么不可以？
2024/8/18 9:26,dy,1,0,1,1,山东大爷[捂脸]，山东的
2024/8/18 9:27,dy,1,1,1,0,有点权利的都高高在上
2024/8/18 9:27,dy,1,0,1,1,暑假刚去青岛了，五四广场很美！
2024/8/18 9:27,dy,0,0,0,0,你说话声音怪怪的，是哪里人？
2024/8/18 9:27,dy,1,1,1,0,日本后裔
2024/8/18 9:27,dy,0,0,0,0,不是生活所迫谁会去挣那点碎银？更何况是个孩子！容易吗
2024/8/18 9:28,dy,0,0,0,0,只能说饱滴不知饿滴[酷拽]
2024/8/18 9:29,dy,0,1,0,-1,哀民生之多艰兮?
2024/8/18 9:29,dy,1,1,1,0,大爷社会人那叫一个狂[赞][赞][666]
2024/8/18 9:29,dy,0,0,0,0,青岛解放了吗
2024/8/18 9:29,dy,1,0,1,1,又是青岛  真出名了[呲牙]
2024/8/18 9:29,dy,0,0,0,0,不用调查了，指定临时请来的
2024/8/18 9:30,dy,1,1,1,0,江西的事还没解决，最近青岛好像大有超越之势
2024/8/18 9:30,dy,1,1,1,0,呼叫宿舍，呼叫班级，呼叫系管理，让大爷变大孙子去！我大学时候，遇到故意欺负人的事情，全系出击，吓得对方求饶报警
2024/8/18 9:30,dy,0,1,1,-1,这种人退休后没有事做，专门门欺负底层人的事??
2024/8/18 9:30,dy,1,1,1,0,这种货不知天高地厚！
2024/8/18 9:31,dy,0,0,0,0,小贩应该去淄博，市长给你撑腰。
2024/8/18 9:31,dy,0,1,1,-1,权力，老头都知道，年轻时没有混好，到老了，总算有了，还不好好玩玩[捂脸][捂脸][捂脸]
2024/8/18 9:31,dy,0,0,0,0,查查他的背景
2024/8/18 9:31,dy,1,1,1,0,给他带个黑色。小人得志…乐极生悲！
2024/8/18 9:31,dy,0,0,0,0,[赞][赞][赞][赞][赞]
2024/8/18 9:32,dy,0,1,1,-1,老头是哪部分的
2024/8/18 9:32,dy,1,0,1,1,这大爷多少年白过了，可能没子女吧
2024/8/18 9:32,dy,0,0,0,0,什么呀
2024/8/18 9:33,dy,1,0,1,1,老头确实是大学生的儿子
2024/8/18 9:33,dy,1,0,1,1,山东自古出好汉！好汉！好好汉！
2024/8/18 9:33,dy,1,0,1,1,因为那老头没子女，[捂脸]
2024/8/18 9:33,dy,0,1,1,-1,开除这位大弟，他不佩做管事的
2024/8/18 9:33,dy,0,0,0,0,好心疼这孩子。
2024/8/18 9:33,dy,0,1,1,-1,给儿女积点德吧，否则会有报应的。
2024/8/18 9:34,dy,0,1,1,-1,你管是代表国家，你这样管是国家没素质，还是你没素质，小活回答的对
2024/8/18 9:34,dy,1,1,1,0,这老人年轻时候肯定是社会混混
2024/8/18 9:34,dy,0,0,0,0,占地要交摊位费。不占地不用交。
2024/8/18 9:34,dy,1,0,1,1,青岛大虾还记得吗？
2024/8/18 9:34,dy,0,0,0,0,支持大学生怼回去[赞]
2024/8/18 9:34,dy,1,1,1,0,戴个红袖章就这么牛，要是穿上黄马褂那还了得。
2024/8/18 9:34,dy,1,1,1,0,那里都是一样的，保安都凶神恶煞
2024/8/18 9:34,dy,1,1,1,0,风景美，人心灵不美有毛线用
2024/8/18 9:35,dy,1,1,1,0,全国都不上青岛旅游
2024/8/18 9:35,dy,0,0,0,0,人间己常态的状况，作为一名职龄和年龄都资深的新闻媒体人，如果不是为了社会新闻热点，能有什么吃惊的？！[捂脸][捂脸][捂脸]
2024/8/18 9:35,dy,0,0,0,0,这小扇子拿的！唉！
2024/8/18 9:35,dy,0,0,0,0,青岛美，人也要美
2024/8/18 9:35,dy,1,0,1,1,这大爷笑的很好帅
2024/8/18 9:36,dy,0,0,0,0,问他你算老几，他说是你爹，没毛病！
2024/8/18 9:36,dy,0,0,0,0,青岛年年都想上分
2024/8/18 9:36,dy,0,0,0,0,又是辞退了事
2024/8/18 9:36,dy,0,1,1,-1,那地方这种人多了去，就这风气
2024/8/18 9:36,dy,1,1,1,0,青岛有大爷
2024/8/18 9:36,dy,0,0,0,0,人家的孩子都在外面
2024/8/18 9:37,dy,1,1,1,0,对弱小咄咄逼人，对上谗媚屈膝。
2024/8/18 9:37,dy,0,0,0,0,青岛应向淄博学习！
2024/8/18 9:38,dy,0,1,1,-1,这几年青岛的臭事多了
2024/8/18 9:38,dy,0,0,0,0,这大爷不是我们青岛人
2024/8/18 9:39,dy,0,0,0,0,是义务工吗这个老头子
2024/8/18 9:39,dy,0,0,0,0,这不就小区保安吗
2024/8/18 9:39,dy,1,0,1,1,他家就没有孩子
2024/8/18 9:39,dy,1,1,1,0,他瞧不起卖小商品的[捂脸][捂脸][捂脸]其实他那里比得了卖小商品的！卖小商品的怎么说也是个做生意的，他算个啥？他不过是他背后主人放出来的一条狗而已[捂脸][捂脸][捂脸]
2024/8/18 9:39,dy,0,0,0,0,[赞][赞][赞][赞][赞][赞][赞][赞]
2024/8/18 9:39,dy,0,1,1,-1,最小的权力，极限的刁难人，悲哀呀
2024/8/18 9:39,dy,0,0,0,0,临时工
2024/8/18 9:40,dy,1,1,1,0,原来感觉青岛应该相当不错的地方啊，看来全国能去的东方越来越少了
2024/8/18 9:40,dy,1,1,1,0,权利要用到极致呀！
2024/8/18 9:40,dy,1,0,1,1,去青岛看这个大爷。风景
2024/8/18 9:40,dy,1,1,1,0,大美青岛没毛病，但如果口误说成大美青岛人就不合适了，骨子里的优越感直追大上海[赞]
2024/8/18 9:40,dy,0,1,1,-1,强盗执法
2024/8/18 9:40,dy,0,1,1,-1,青岛，还有优点吗[捂脸]
2024/8/18 9:41,dy,0,0,0,0,临时工
2024/8/18 9:41,dy,1,1,1,0,眩你能拿我怎么办？我有红袖章！！！
2024/8/18 9:42,dy,1,1,1,0,有点权利，不知道他爹是谁了
2024/8/18 9:43,dy,1,1,1,0,呵呵呵，无语了，隔不了多久就能来一回[恐惧][恐惧][恐惧]
2024/8/18 9:43,dy,1,1,1,0,青岛大爷是真大爷。
2024/8/18 9:43,dy,1,1,1,0,老干部就是牛逼啊
2024/8/18 9:43,wb,1,0,1,1,权力使人傲慢，哪怕是芝麻大点的，这是权力至上的通病
2024/8/18 9:44,dy,1,1,1,0,鸡毛当令箭
2024/8/18 9:44,dy,1,1,1,0,本来想到青岛去玩的，想想还是不去了，我感觉青岛还是有点?
2024/8/18 9:44,wb,1,0,1,1,不去处理真正破坏城市形象的人 反而威胁 曝光影响城市形象的人 真的是本末倒置 掩耳盗铃
2024/8/18 9:45,dy,0,1,0,-1,年轻人不应该说“我是你爹”这句，激化矛盾了，应该直接说“我是爹”，这话老登没法接
2024/8/18 9:45,dy,1,1,1,0,一个臭鱼腥了一锅汤[呲牙][呲牙][呲牙]
2024/8/18 9:46,dy,0,0,0,0,给青岛大爷点赞[赞]
2024/8/18 9:46,dy,1,1,1,0,这大爷小人得志的样子，大学生勤工俭学都不给机会了。
2024/8/18 9:48,dy,1,1,1,0,青岛谁还敢去呀
2024/8/18 9:48,dy,0,0,0,0,这是三年来被疫情期间惯的
2024/8/18 9:48,dy,0,0,0,0,青岛又出问题了，
2024/8/18 9:48,dy,1,1,1,0,关系户，关系户，你看就是关系户！
2024/8/18 9:49,dy,1,1,1,0,这就是标准的小人嘴脸。
2024/8/18 9:50,dy,1,1,1,0,严惩大爷。社会完美不给有这种人
2024/8/18 9:50,dy,1,1,1,0,景美，但人心黑呀
2024/8/18 9:50,dy,0,0,0,0,@山东旅游@
2024/8/18 9:50,dy,0,1,1,-1,还用特意摸黑？
2024/8/18 9:50,dy,0,1,1,-1,进一步核查，核查，核查，最后就没了。
2024/8/18 9:51,dy,0,0,0,0,[赞][赞][赞]
2024/8/18 9:52,dy,1,0,1,1,必须让老丫经下岗
2024/8/18 9:52,dy,0,1,1,-1,穿上衣服就装人[赞]
2024/8/18 9:52,dy,0,0,0,0,怎么处理他
2024/8/18 9:52,dy,0,1,0,-1,没啥！那儿都有这样的人！平常心！[捂脸]
2024/8/18 9:52,dy,1,0,1,1,青岛本地大爷，假不了[捂脸]
2024/8/18 9:52,dy,0,1,1,-1,再也不去青岛了，就这素质[机智]
2024/8/18 9:52,dy,0,0,0,0,哎，删不了，哎，删不了[捂脸][捂脸][捂脸]
2024/8/18 9:52,dy,0,0,0,0,胸前不是有记录仪？有本事让他们把原视频放出来[坏笑][坏笑][坏笑]
2024/8/18 9:52,dy,1,0,1,1,青岛跟福岛什么关系
2024/8/18 9:53,dy,0,0,0,0,要向淄博去学习
2024/8/18 9:53,dy,1,0,1,1,这是什么狗屁部门发放的权利
2024/8/18 9:53,dy,1,1,1,0,??大爷你也真牛逼啊你是小日子做出来的吧
2024/8/18 9:53,dy,0,1,1,-1,这个老人看样子是个当官的
2024/8/18 9:53,dy,1,1,1,0,老头儿呀，老头儿，不能有点权自己都不知道自己是干什么的。
2024/8/18 9:53,dy,1,1,1,0,在文明的地点，藏的也有狼
2024/8/18 9:53,dy,0,1,1,-1,但凡欺弱的人如果遇见比他强的，脸嘴是不一样的
2024/8/18 9:53,dy,1,1,1,0,老头估计是日本来养老的老头
2024/8/18 9:53,dy,0,0,0,0,都是好干部
2024/8/18 9:53,dy,1,1,1,0,为老不尊，不关爱年轻人
2024/8/18 9:54,dy,1,0,1,1,这位大爷但愿别把自己儿子扯进来！[赞][赞][赞]
2024/8/18 9:54,dy,1,0,1,1,他家能有孩子吗
2024/8/18 9:55,dy,1,1,1,0,大爷的有点匪气
2024/8/18 9:55,dy,0,0,0,0,青岛 青岛 又是青岛[捂脸][捂脸][捂脸]
2024/8/18 9:56,dy,0,0,0,0,就是大爷范
2024/8/18 9:56,dy,0,0,0,0,?水浒传?第十二回“汴京城杨志卖刀”：杨志被高太尉赶出了殿帅府，因为身上没钱，只好把祖传的宝刀拿出来卖，遇到了恶霸牛二。牛二一心想霸占杨志的宝刀，于是百般刁难，杨志忍无可忍，便一刀杀了牛二，到官府自首[捂脸]
2024/8/18 9:57,dy,1,1,1,0,呵呵呵红袖章
2024/8/18 9:57,dy,1,1,1,0,拿根鸡.毛就当令箭
2024/8/18 9:58,dy,0,1,1,-1,权力就是全力
2024/8/18 9:58,dy,0,1,1,-1,全国好多地方都比青岛好，去别处吧
2024/8/18 9:59,dy,1,1,1,0,来青岛，大爷喂你吃大虾[捂脸]
2024/8/18 9:59,dy,1,1,1,0,“权力”得用啊，过期就作废了
2024/8/18 9:59,dy,1,1,1,0,大城市这种看东西最可恶，比流氓还流氓。
2024/8/18 9:59,dy,1,0,1,1,青岛大虾，青岛大爷[赞]
2024/8/18 9:59,dy,1,1,1,0,这老头后台肯定是青岛领导[炸弹][炸弹][炸弹]
2024/8/18 9:59,dy,1,1,1,0,五四广场大虾大爷牛逼
2024/8/18 9:59,dy,1,1,1,0,那是红袖章啊   权利的象征   好大的权利
2024/8/18 9:59,dy,0,1,1,-1,你算老几，我退休工资都是你奋斗一年都挣不来[捂脸][捂脸][捂脸]
2024/8/18 10:00,dy,1,0,1,1,他家真没有[捂脸]
2024/8/18 10:00,dy,0,1,1,-1,伪军又回来了吗？
2024/8/18 10:00,dy,0,0,0,0,[赞][赞][赞][赞][赞]
2024/8/18 10:00,dy,1,1,1,0,二十年前的保安一保平安，现在保安简直是祸害灭一方[发怒][发怒]
2024/8/18 10:00,dy,1,1,1,0,有些人穿戴点东西，就不知道他是老几了[猪头]
2024/8/18 10:00,dy,0,0,0,0,又是青岛
2024/8/18 10:01,dy,0,1,1,-1,老头就这点权利，把为难他人发挥的淋漓尽致！
2024/8/18 10:01,dy,0,1,1,-1,给个袖章，情绪暴涨？
2024/8/18 10:01,dy,0,0,0,0,社会怎么了
2024/8/18 10:01,dy,1,1,1,0,我是谁，我是他大爷
2024/8/18 10:01,dy,1,1,1,0,青岛美青岛大爷惹不起
2024/8/18 10:02,dy,0,0,0,0,你闭嘴吧，巴拉巴拉的，好像知道实情的意义
2024/8/18 10:02,dy,0,1,1,-1,青岛很美。。。但我不敢去
2024/8/18 10:02,dy,0,1,1,-1,大爷为什么这么牛？细思极恐[流泪]
2024/8/18 10:03,dy,0,0,0,0,小哥应该也回怼他：你又算老几？
2024/8/18 10:03,dy,0,0,0,0,[微笑]
2024/8/18 10:03,dy,0,0,0,0,又是青岛
2024/8/18 10:04,dy,1,1,1,0,青岛人表示有些大爷大娘真的很恶心 把自己当盘菜[捂脸]
2024/8/18 10:04,dy,1,1,1,0,娘西片以老卖老
2024/8/18 10:04,dy,1,1,1,0,拿着鸡毛当令箭！太拿自己当个人物了吧
2024/8/18 10:05,dy,0,0,0,0,[捂脸][捂脸][捂脸]
2024/8/18 10:05,dy,1,0,1,1,那老人应该是五保户才会这样
2024/8/18 10:05,dy,1,0,1,1,不配称呼他大意儿子搞的一杠
2024/8/18 10:06,dy,1,0,1,1,没事儿又是临时工……
2024/8/18 10:06,dy,1,1,1,0,看到这种管理人员就觉得讨厌
2024/8/18 10:06,wb,1,0,1,1,为啥青岛基层管理都是这种老大爷，老大妈，年轻人都跑哪去了
2024/8/18 10:06,wb,1,1,1,0,在学校那叫大学生，在景区卖东西就叫流动商贩。“大学生勤工俭学”不是破坏规矩的正当理由
2024/8/18 10:07,dy,0,1,1,-1,有些人对待别人为什么就不能善良一点呢
2024/8/18 10:07,dy,0,0,0,0,解释说是自愿者[捂脸]
2024/8/18 10:07,dy,1,1,1,0,不是孩子不孝就是没儿子
2024/8/18 10:07,dy,0,1,1,-1,人性最大的恶，就是手中有一点权力，就千方百计难为他人！
2024/8/18 10:07,dy,1,0,1,1,小年轻你可别当他爹，你孩是人好吧
2024/8/18 10:07,dy,1,1,1,0,青岛很美，这位管理大爷很黑。
2024/8/18 10:07,wb,1,1,1,0,#青岛你算老几#
2024/8/18 10:08,dy,1,1,1,0,戴个红袖套就不知自己姓啥了
2024/8/18 10:08,dy,0,0,0,0,大学生在分有点零花钱也不会去勤工俭学 这样的孩子[赞]支持你
2024/8/18 10:08,dy,0,0,0,0,全国人民都是他爹
2024/8/18 10:08,dy,1,1,1,0,青岛的老人特吓人，跟老害一样
2024/8/18 10:09,dy,1,0,1,1,青岛大哥[赞]
2024/8/18 10:09,dy,1,1,1,0,很多这样的黑皮子
2024/8/18 10:09,dy,1,1,1,0,青岛很美，大爷会赶人[偷笑]
2024/8/18 10:10,dy,0,0,0,0,[强壮][强壮]
2024/8/18 10:10,dy,1,0,1,1,难怪卖38的大虾
2024/8/18 10:11,dy,0,0,0,0,晒它子女出来说两句
2024/8/18 10:11,dy,1,1,1,0,还散去青岛么？
2024/8/18 10:11,dy,0,1,1,-1,底层的的恶你想像不到
2024/8/18 10:11,dy,1,1,1,0,青岛现在还用抹黑吗，青岛这帮土著自己就干了，看看人家济南人的素质，真是没有可比性[赞][赞][赞]
2024/8/18 10:11,dy,1,0,1,1,这个老家伙应该是光棍汉，天生地长的
2024/8/18 10:12,dy,1,1,1,0,青岛大虾名扬天下青岛大爷震惊世界牛逼[赞]
2024/8/18 10:12,dy,0,1,1,-1,文明城市，弱者可欺
2024/8/18 10:12,dy,1,1,1,0,青岛抹黑了，
2024/8/18 10:12,dy,1,0,1,1,老头连老婆都没有！那来的后代孩子？
2024/8/18 10:13,dy,0,0,0,0,不知道淄博的老百姓是怎么生活的
2024/8/18 10:13,dy,1,1,1,0,青岛不用抹黑
2024/8/18 10:13,dy,0,0,0,0,[感谢][感谢][感谢][赞][赞]
2024/8/18 10:13,dy,0,0,0,0,[666][666][666]
2024/8/18 10:14,dy,0,1,1,-1,青岛在我这掉分了，几十年的旅游城市，这操作，店大欺客了的感觉
2024/8/18 10:14,dy,0,1,1,-1,这老头哪个秧歌队的
2024/8/18 10:14,dy,0,0,0,0,正在核查，正在调查，其实都是在拖
2024/8/18 10:15,dy,1,1,1,0,老糊涂了
2024/8/18 10:15,dy,0,0,0,0,牛逼[赞]
2024/8/18 10:15,dy,0,1,0,-1,青岛怎么这样了
2024/8/18 10:15,dy,1,1,1,0,@带个红袖章他就不知道他爹是谁拉。
2024/8/18 10:16,dy,0,0,0,0,临时工
2024/8/18 10:16,dy,1,1,1,0,前有大虾??，后有大爷????，青岛接力，歪锐雇滴
2024/8/18 10:16,dy,1,0,0,1,预约地下室
2024/8/18 10:16,dy,1,1,1,0,这老头以前是社会混混吧[发怒]
2024/8/18 10:17,dy,0,0,0,0,青岛就那么回事吧[捂脸]你去海边在看看[捂脸]
2024/8/18 10:17,dy,1,1,1,0,查一下是不是贪污犯
2024/8/18 10:19,dy,0,1,0,-1,怎么还用这种人
