timestamp,platform,label1,label2,label3,diff,content
2024/9/13 10:41,wb,1,1,1.0,0,不是谁都能吃这碗饭的，有的人给钱也吃不进去呀
2024/9/13 10:42,wb,0,1,0.0,-1,斗因现在不就是吗
2024/9/13 10:42,wb,0,1,0.0,-1,要注意身体啊！有多少这种吃播出事的。
2024/9/13 10:43,wb,1,0,0.0,1,这类的行为太极端，胖到极致就很危险
2024/9/13 10:43,wb,1,1,1.0,0,慢性自杀
2024/9/13 10:43,wb,1,0,0.0,1,就像之前那个青岛dy事件，如果这个事情不被禁止真的很难想象穷人家的女孩子会是一种什么处境…
2024/9/13 10:43,wb,0,0,0.0,0,挺有意思
2024/9/13 10:43,wb,0,0,0.0,0,其实就是美食主播，靠打赏
2024/9/13 10:44,wb,0,0,0.0,0,为什么是大码女孩，吃食物也分男女
2024/9/13 10:45,wb,0,0,0.0,0,英国报姐？？？ 下面绝对有评论女性部分国籍
2024/9/13 10:45,wb,0,0,0.0,0,可怕
2024/9/13 10:45,wb,0,1,0.0,-1,盗月社真的工伤
2024/9/13 10:46,wb,0,1,0.0,-1,这边基本就是假吃，我刷到过一个男的八块腹肌每次都去不同地方推荐吃美食，说能不能吃掉腹肌，但是看视频会发现一大口炫嘴里但是没有一个吞咽镜头。
2024/9/13 10:46,wb,0,1,0.0,-1,挣钱嘛，不敢颤
2024/9/13 10:46,wb,1,1,1.0,0,一个巴掌拍不响，这些大码女孩可以不吃的啊，不过是因为她们好吃懒做，想另辟一条捷径而已。付费的人固然不道德，但是她自己也问题很大，维持生计有很多正常的工作可以找
2024/9/13 10:46,wb,0,0,0.0,0,你的夏天还好吗，里面也有…看着好难受
2024/9/13 10:46,wb,0,0,0.0,0,这是什么操作
2024/9/13 10:46,wb,1,0,0.0,1,现在的吃播就是这种意思
2024/9/13 10:47,wb,0,0,0.0,0,还是要控制控制，要不然会挂了
2024/9/13 10:47,wb,0,0,0.0,0,养猪呢
2024/9/13 10:48,wb,1,1,1.0,0,吃死了算是自然选择
2024/9/13 10:49,wb,0,1,0.0,-1,这是什么逻辑，自己为了赚钱做的吃播，胖了反过来怪观众付费？开始倒果为因了。按这种逻辑，游戏主播天天坐那玩游戏，眼睛手腕腰脖子都累，是不是也可以怪观众了？还有离谱的拿宠物做比喻，说这种逻辑跟主人想把宠物喂的白胖一样，宠物有选择权吗？主播没有选择权吗？
2024/9/13 10:49,wb,0,0,0.0,0,真是太可怕了
2024/9/13 10:49,wb,0,1,0.0,-1,不是 我这看不懂 最近热搜怎么了嘛 都是有流量的人各种上热搜 给谁挡劫呢
2024/9/13 10:49,wb,0,0,0.0,0,这是自由的赚钱么 是双向选择么
2024/9/13 10:50,wb,1,0,1.0,1,有人喜欢极致胖，有人喜欢极致瘦，都挺变态的
2024/9/13 10:50,wb,0,0,0.0,0,付费养猫都能直播，付费养猪有何不能
2024/9/13 10:50,wb,0,0,0.0,0,当前的主要任务是找到白菜豆腐和粉条
2024/9/13 10:50,wb,1,1,1.0,0,一个愿打一个愿挨，不好说啥，自己完全可以选择不接受，却又不拒绝....
2024/9/13 10:50,wb,0,0,0.0,0,太恐怖了
2024/9/13 10:51,wb,1,1,1.0,0,自我践踏
2024/9/13 10:51,wb,1,0,0.0,1,这个世界上精神病的种类每天都在更新
2024/9/13 10:51,wb,0,0,0.0,0,好恐怖?
2024/9/13 10:51,wb,1,1,1.0,0,湖北长辈控制欲太强
2024/9/13 10:51,wb,1,1,1.0,0,死变态
2024/9/13 10:51,wb,1,0,1.0,1,当变态遇上变态
2024/9/13 10:52,wb,1,0,0.0,1,不是吧，意林说西方特别文明
2024/9/13 10:52,wb,0,0,0.0,0,这时候知道老中做家长有多负责了
2024/9/13 10:52,wb,1,1,1.0,0,这是什么鬼癖好？简直绝了真服了
2024/9/13 10:53,wb,0,0,0.0,0,好可怕..
2024/9/13 10:53,wb,1,1,1.0,0,黑镜的含金量还在上升（说愿打愿挨的去看看黑镜第一季第二集呗。）
2024/9/13 10:54,wb,1,0,0.0,1,无力自救，所以加速自毁，也是一种重获主动权和控制感的方式
2024/9/13 10:54,wb,0,0,0.0,0,阿风和我都很馋啊，所以喜欢互相投喂
2024/9/13 10:55,wb,0,0,0.0,0,天哪，都好可怕
2024/9/13 10:55,wb,0,1,1.0,-1,间接杀人
2024/9/13 10:56,wb,0,0,0.0,0,新名词，大码女孩
2024/9/13 10:57,wb,0,0,0.0,0,有病
2024/9/13 10:57,wb,0,0,0.0,0,“胖”这个字不能提了是吗？大码女孩又是什么新词
2024/9/13 10:57,wb,0,0,0.0,0,大可传媒么
2024/9/13 10:57,wb,0,0,0.0,0,咦，什么怪癖
2024/9/13 10:58,wb,1,1,1.0,0,这种鬼物不就是靠猎奇不劳而获吸引猎奇网友打赏？不是加粗字体说自己多惨，给别人生造一个什么什么主义就能把这种人放到受害者位置上去的。还吃播是唯一经济来源，这话你们也能认同啊？找个活干吧。即便直播也有播游戏播才艺播整活的。干啥啥不行只能靠吃还要反手骂投喂。
2024/9/13 10:59,wb,0,0,0.0,0,一般这种时候集美们就美美隐身了评论区也看不见讨论男女的了
2024/9/13 10:59,wb,1,1,1.0,0,蠢猪
2024/9/13 10:59,wb,1,1,1.0,0,还是一句话，袁老让一些人吃得太饱了
2024/9/13 10:59,wb,1,0,1.0,1,这种癖好太变态了
2024/9/13 10:59,wb,1,0,1.0,1,害人不浅，健健康康多好
2024/9/13 11:00,wb,1,1,1.0,0,变态……
2024/9/13 11:00,wb,0,1,0.0,-1,一直给别人夹菜是不是也是一种投喂癖。
2024/9/13 11:02,wb,0,0,0.0,0,真是涨见识了
2024/9/13 11:02,wb,1,1,1.0,0,这种暴饮暴食呀，对身体也不好
2024/9/13 11:02,wb,1,1,1.0,0,这么喜欢胖自己变胖不就好了，癖好变态就是变态还说什么爱好
2024/9/13 11:03,wb,1,0,0.0,1,不要吃太多比较好
2024/9/13 11:03,wb,0,0,0.0,0,现实中真的有，就昨天我跟老公在外面吃饭，隔壁桌女孩子特别出眼目测300多斤，对面她男朋友说话言行举止肯定是情侣，两个人大概七八个菜基本都是肉，男的很贴心一直夹菜给她，手边一杯蜜雪冰城一杯喜茶，面前一大碗应该是牛肉面。这不是害她么为什么要这么对女朋友。
2024/9/13 11:03,wb,1,0,0.0,1,我与这个变态的世界格格不入
2024/9/13 11:03,wb,0,0,0.0,0,太可怕了
2024/9/13 11:04,wb,0,0,0.0,0,我滴天
2024/9/13 11:04,wb,0,0,0.0,0,太罕见了
2024/9/13 11:04,wb,1,1,1.0,0,被关笼子里还觉得主子做的对，这样我们更安全鸭
2024/9/13 11:06,wb,1,1,1.0,0,你是不会打胖这个字吗？胖就胖，什么大码女孩？？就跟大雷一样。胸就是胸，什么大雷小雷？
2024/9/13 11:07,wb,0,1,0.0,-1,说实话我总感觉国内各种大胃王吃播就是变相宣传这种变态行为，虽然以前不知道这种“圈养投喂”行为，但是我个人非常恶心看吃播 现在还有一直就是吃网友点餐这一天吃什么都是网友说的，有时候撑死有时候能饿死……我觉得这种也很不合适一开始好奇还会看，后来都屏蔽了
2024/9/13 11:07,wb,1,1,1.0,0,果然，这个世界对胖人都充满了恶念！有人能替狗说话，都没人为胖人说一句话，有人做?会有人说为了生存，有人为了赚钱做吃播却被人恶心攻击
2024/9/13 11:07,wb,0,1,0.0,-1,木下已经把自己吃出毛病了 最近才复出
2024/9/13 11:07,wb,0,0,0.0,0,任何东西都不能过度，真的
2024/9/16 8:07,xhs,0,0,0.0,0,张律师，您好，已点关注哈！我通过中介跟卖方签订购房合同，约定中介费由卖方出，交了1万元定金。刚签完合同，卖方就违约，我向卖方主张定金罚则，卖方赔给我1万元（明确只是赔给我的，不包含赔给中介的佣金）。中介根据合同条款，要求我将1万元优先用于赔偿他们的中介费（佣金），这样的格式条款合法吗？法院会支持吗？
2024/9/29 9:36,xhs,0,0,0.0,0,交了定金5万，中介费也交了，合同签了，卖家反悔，合同上写了任何一方反悔赔偿百分之20，最后能赔多少，
