timestamp,platform,label1,label2,label3,diff,content
2024/8/29 6:03,dy,1,1,1,0,"首先 矿区工人本身工资就相对偏低 所以照顾物价低 当然如果你想要你的物价和他们一样 可以 干和他们不相上下的工作量那和他们不相上下的工资 享受不相上下的物价
况且这本身就属于慈善了 是因为相熟的老乡之类的 你谁啊我请问[尬笑]"
2024/8/29 6:05,dy,0,1,0,1,愧疚的人不应该是我[苦涩]
2024/8/29 6:05,dy,1,1,1,0,不知道啊，我说矿工不容易，有个山东的说我没长眼睛[猪头]
2024/8/29 6:06,dy,0,1,0,-1,七块钱的刀削面是给农民工，矿工的优惠价，每个人都是劳动所得收入我知道，但是矿工挖煤随时都会有生命危险，风险高，还可能被压榨，景区那么多吃饭的地方，非要驱车去矿上吃吗，而且还穿拖鞋上高速 ，十一块还加蛋加豆干，就因为贵了几块钱就把人家饭碗砸了，况且人家老板当时还退了一部分钱，还要把我人家挂网上，现在那里的煤矿工人吃不到便宜的面了，你拍拍屁股回江苏了
2024/8/29 6:06,dy,0,0,0,0,11快啊，正常价啊，东方削面就是11
2024/8/29 6:07,dy,0,1,0,1,善良的人没有一点活路吗[流泪][流泪]， [微笑]我能买到十一的刀削面我都笑着吃[微笑]服了
2024/8/29 6:08,dy,0,0,0,0,超市还有会员价呢，在矿区开店的老板给辛苦劳作的旷工优惠点怎么了
2024/8/29 6:09,dy,0,1,0,-1,我学的旅游管理 19年10月去山西旅游 有个矿上工人在路边哭 他们干着最累的活儿 挣最少的工资 不是一直这样么 工人工资低 煤老板挣的多 [微笑][微笑]
2024/8/29 6:09,dy,0,0,0,0,这不是11块钱正常的吗 我在其他外省都基本上18或者20多块钱[流泪]
2024/8/29 6:09,dy,1,1,1,0,如果这个要被罚的话，那么爱心食堂也别干了[微笑]
2024/8/29 6:09,dy,1,1,1,0,用这我们的煤，打了一堆白条，还让我们的矿工没饭吃！百般委屈，我们咬咬牙咽下去了，饭都不让吃！何等居心！
2024/8/29 6:09,dy,0,0,0,0,11块钱一点都不贵，老板照顾工人也是大义之人，老板当时也没说清楚而已，如果是我碰见我自己的价格跟别人不一样，我也不舒服，希望山西文旅可以酌情考虑，老板以后在门口贴上公告[呲牙]有机会去山西肯定去尝尝
2024/8/29 6:10,dy,1,1,1,0,就应该给仨鼠辈让看看赚11块钱得挖多少铲子。
2024/8/29 6:10,dy,0,1,0,1,虽然都是自己孩子，但偏偏对自己最亲的孩子最差
2024/8/29 6:11,dy,1,1,1,0,真的很让人怀疑那个人为什么不去景区那边吃饭而去矿场那边吃呢？他来的目的虽然是旅游，但是我觉得官方应该好好查查他来的真正目的是什么[再见]
2024/8/29 6:11,dy,0,0,0,0,在深圳商场吃碗面26.7，11的物价真的很便宜了
2024/8/29 6:13,dy,0,0,0,0,山河四省，护[流泪][发怒]
2024/8/29 6:13,dy,0,0,0,0,价格不太贵，我觉得可以理解，但说人家阴阳面，这是不是有点过分了，山西人有自己的善良，又没多收你钱，原价原卖，你可以不吃不买，但真的没必要说它阴阳面，老板人善良让矿工吃上一碗好吃便宜的面不行吗？
2024/8/29 6:13,dy,0,0,0,0,11块不是很便宜了嘛[流泪]
2024/8/29 6:14,dy,0,0,0,0,看到评论区大部分都是山西我绷不住了[流泪][流泪]
2024/8/29 6:14,dy,0,0,0,0,每次一快到冬天就开始宣传山西了[泪奔]我都不想说
2024/8/29 6:15,dy,0,0,0,0,我们这一碗都要十五十六[流泪]十一到底贵在哪里呢
2024/8/29 6:15,dy,0,0,0,0,就是，十一块到底贵不贵，凭良心说话
2024/8/29 6:16,dy,0,0,0,0,七月刚去那里旅游回来 物价真的很便宜 真不懂说阴阳面的到底有什么心理 北京上海一碗面四五十元怎么没人说
2024/8/29 6:16,dy,0,0,0,0,11块钱很贵吗？一次外卖比这个贵一倍[尬笑]
2024/8/29 6:16,dy,0,0,0,0,我感觉人家只是接受不了被区别对待而不知情[泣不成声]
2024/8/29 6:17,dy,0,0,0,0,阴阳面这不是很正常的吗，就像工作的公司食堂里吃内部员工吃饭要比外来的要折扣一些
2024/8/29 6:18,dy,1,1,1,0,阴阳煤，只有山西人知道吧[微笑][微笑]
2024/8/29 6:20,dy,0,0,0,0,山西对得起外省，河南对得起外省，山东，河北对得起外省，东三省对得起外省。北方对得起南方
2024/8/29 6:21,dy,0,0,0,0,广东网友来守护 并且11元有蛋有肉的面真的是白菜价了！
2024/8/29 6:21,dy,0,1,0,1,江西人看到啦！已经传出省了你们放心[流泪]
2024/8/29 6:23,dy,0,0,0,0,"从小生活在二电厂大烟囱下，天天听着二电厂轰隆隆的排气声，看着浓浓的烟，都已经成了习惯，供的却是北京的电保的是14省的万家灯火，好不容易火一次，因为11块一碗面却要被人这么黑，疫情最严重的那一个寒冬，大秦线员工阳了都只能坚守在火车上，都没有休息的时间，阳一批顶一批，只为了一车车的乌金能供上，却只有本市人知道，如今好不容易发展旅游有点热点，就要被这么黑？

11块一碗面加鸡蛋难道不是正常的价格吗？本地人去吃也是市场价，不针对外地人，人家只是给老邻居和矿工的优惠价，山西好多饭店还给环卫工免费的，但是这不是你不愿意花钱吃饭的理由，山西人只是老实不会说，评论区多少本地人解释，都没人看一下，不要为了黑而黑，今天看到一条评论难道只有山西有煤吗？有水吃了就忘了挖井人了吗？"
2024/8/29 6:23,dy,0,0,0,0,我一个山西人真的好想哭 山西一直都是不起眼的城市 能不能被看到啊
2024/8/29 6:25,dy,0,0,0,0,好多山河四省的人啊，有不是山河四省的吗[泣不成声]
2024/8/29 6:25,dy,0,0,0,0,每年暑假都会在山西，山西真的很好，物价很便宜的，矿工真的很辛苦
2024/8/29 6:25,dy,0,0,0,0,11块带肉带蛋的面还不满足啊，而且是手工面，在南方价格要翻一倍
2024/8/29 6:26,dy,1,1,1,0,骂的人是不是50万啊，谁不知道采煤多危险多辛苦他们吃的便宜点怎么了，而且店在矿区谁会闲的没事干跑矿区吃一碗面啊，除非他是故意去的[微笑]
2024/8/29 6:27,dy,0,1,0,-1,我只知道山西煤贵100太原变上海 我不知道他们有什么脸来喷山西 几十年保供无人问 差4块钱的面天下知 凭什么[流泪][流泪][流泪]！
2024/8/29 6:27,dy,1,1,1,0,不是，跑到人家矿区里吃饭他们还有理了
2024/8/29 6:27,dy,0,0,0,0,明明不是自己干的，但感觉好难受，好揪心，感觉好愧疚。[酷拽]
2024/8/29 6:27,dy,1,1,1,0,又是只能山西人看到的视频？???
2024/8/29 6:27,dy,1,1,1,0,到底是谁挑起地域歧视，山西被骂，东北也被骂，各地都被骂，都是卧底挑拨离间吧[酷拽]
2024/8/29 6:27,dy,0,0,0,0,看看这个
2024/8/29 6:28,dy,0,0,0,0,刷到这个视频我才了解到了这件事，如果这个人真是抱着一颗吃饭的心态去面馆，发现自己吃面的价格不对，找老板说可以理解，当他们得知是对于矿工优惠时，我觉得他们这时就不应该在纠缠了吧[微笑]矿工真的很不易，我爷爷外公和舅舅都在外地矿上干了一辈子，为这些辛苦劳作的群众让利一份，未尝不可吧，要是对于这点扯着不放，那我觉得这个人和之前看不起农民群众的出生没有区别
2024/8/29 6:28,dy,0,0,0,0,出山西了哦，到东北了[玫瑰]
2024/8/29 6:30,dy,0,1,0,1,今年是山西，去年是云南，到底是哪个省在享福[泣不成声]
2024/8/29 6:31,dy,1,1,1,0,刷到那个阴阳怪气的博主，好家伙，他说跟矿工无关。跟价格有关。现在出去吃个饭，洗个头发，买个衣服，经常去买东西办个卡和偶尔去没办卡的，买东西价格都不一样，他有病吧。矿工经常去便宜一点怎么了？很生气。
2024/8/29 6:31,dy,0,0,0,0,11块不是正常价格吗，满满的肉还加了个鸡蛋啊
2024/8/29 6:32,dy,0,1,0,-1,那个我想问一下是不是刷到的都是在外地的山西人[流泪]
2024/8/29 6:34,dy,0,0,0,0,就算是一碗十一块钱真的很贵吗，只是给矿工一个员工价就被说阴阳面？
2024/8/29 6:34,dy,1,1,1,0,很简单，骂阴阳面的都是50万，直接抓就好了
2024/8/29 6:34,dy,1,1,1,0,神经 专门跑煤矿去吃面然后不小心打开了摄像头是吗[捂脸]
2024/8/29 6:34,dy,0,0,0,0,11的面很贵吗
2024/8/29 6:35,dy,0,1,0,-1,这几个人确实过分了，加肉加蛋的面11块真的好便宜，好不
2024/8/29 6:36,dy,0,0,0,0,我觉得给矿工低价一点不是一个很暖心的事吗？我记得在我们这有一次我去一个面店，面店所有面对老年人都便宜一两块，我当时就觉得石河子是一个有温度的城市，就很感动啊，不会去想为什么自己多掏钱了什么的，本来我们的价格就是正常啊，对于特殊人群优惠有什么问题吗？为什么看到这种事不是觉得有温度而是去抨击呢？？？我真的想不通
2024/8/29 6:38,dy,0,1,0,1,够苦了，不准再欺负我们山西了[发怒]
2024/8/29 6:38,dy,0,0,0,0,11块 有肉 有蛋 有菜 我想问问贵在哪里
2024/8/29 6:39,dy,0,0,0,0,看着真的很心痛啊，这人怎么这样啊[流泪]
2024/8/29 6:40,dy,0,0,0,0,好吃
2024/8/29 6:40,dy,1,1,1,0,谁在说我们山西人，老子就给他一豆撅子
2024/8/29 6:41,dy,0,0,0,0,我有点搞不明白，喷子真的不会先去网上查一下具体事件吗？一次两次就算了，年年都这样[尬笑]
2024/8/29 6:42,dy,0,0,0,0,真的假的 在山西买煤比外地还贵[发呆]
2024/8/29 6:43,dy,0,0,0,0,我们所有省都是一家人[流泪][流泪]为山西发声
2024/8/29 6:43,dy,1,1,1,0,这三个大男人，你们究竟是何心理？欺负我们山西人憨厚老实呢？
2024/8/29 6:43,dy,1,1,1,0,有肉有蛋有面，就是在东北，11也不贵。能吃吃，吃不起饿死[微笑][微笑][微笑]
2024/8/29 6:48,dy,1,1,1,0,11块还加蛋加豆腐，来我学校吃一碗15的就老实了
2024/8/29 6:48,dy,1,1,1,0,到底是哪个地区的小姐少爷在搞地域歧视啊[尬笑]？
2024/8/29 6:48,dy,1,1,1,0,就好像我免费送给环卫工一瓶矿泉水我卖你两块你说我阴阳价[尬笑]
2024/8/29 6:49,dy,0,1,0,-1,你就说谁吃面去矿区吃啊，3碗面的价钱才33[尬笑]
2024/8/29 6:49,dy,0,0,0,0,[流泪]我不许有人说山西[流泪]因为我的爱人是山西人
2024/8/29 6:49,dy,0,0,0,0,听他口音他东北的吧，关键东北的山西刀削面也是十几块啊[尬笑]11块到底哪里贵了
2024/8/29 6:50,dy,1,1,1,0,谁啊神经病吧
2024/8/29 6:51,dy,0,0,0,0,很像我四川的朋友说，四川给大家供电，自己那里却停电，有些老人都中暑得热射病[流泪]
2024/8/29 6:52,dy,0,1,0,-1,用人家的煤的时候不说了，照顾自己市工人还有错了[流泪][流泪]
2024/8/29 6:53,dy,0,0,0,0,[流泪][流泪]补药骂俺们了。
2024/8/29 6:53,dy,0,1,0,1,我看解释不是说他们平常卖的价钱就是七八块钱，不只是对工人，本地人也是，店主已经承认了自己是专门加价卖给外地人的
2024/8/29 6:54,dy,0,0,0,0,11块别太便宜了[泪奔]方便面都要5块了
2024/8/29 6:54,dy,1,1,1,0,呵[微笑]谁骂谁没母，用煤的时候在这夸，不用的时候给骂的狗血淋头哦呦~牛逼的不得了了[微笑][OK]
2024/8/29 6:55,dy,1,1,1,0,不许欺负他……我们山西人同意他“阴阳”[流泪][流泪]
2024/8/29 6:55,dy,0,0,0,0,为什么本地人买煤要贵，我觉得对本地的人不公平，我是外地人，但是我觉得这对他们不公平。
2024/8/29 6:56,dy,0,0,0,0,也不知道是不是因为我是山西的，我在上海刷到了[流泪]
2024/8/29 6:57,dy,0,0,0,0,山西的面真的是我见过除了东北最大方的一个地方十五一大盆！是盆！而且很好吃[泣不成声][泣不成声]
2024/8/29 6:57,dy,0,0,0,0,为啥感觉山西总是被说不好  跟广西一样[捂脸]
2024/8/29 6:57,dy,0,1,0,1,为什么本地人还要贵？不是应该反过来的吗？外地人不理解[尬笑]
2024/8/29 6:58,dy,0,0,0,0,挖煤真的很危险
2024/8/29 6:59,dy,0,1,0,1,憨厚老实的山西好不容易靠演唱会和黑神话努力打造旅游城市……结果还要被黑[流泪]我去海南一个旅游景点一晚麻酱拌面卖38，你说我们11块的面还加鸡蛋贵[流泪]有多少人知道山西是西部计划中的一员啊[流泪]明明那么努力了
2024/8/29 6:59,dy,0,1,0,1,他们不是嫌面贵，只是因为觉得矿工能吃七块钱的面，自己是11块没占到那4块钱的便宜，本着我占不到谁也别想占到这种心态去举报罢了，不患寡而患不均，古人诚不欺我[微笑]
2024/8/29 7:00,dy,0,0,0,0,本地买煤贵[宕机]
2024/8/29 7:01,dy,0,0,0,0,不许说山西！！！！！
2024/8/29 7:01,dy,0,0,0,0,之前那个男的视频搞得我以为一碗面33 结果是三个人33[尬笑]见不见啊掐头去尾的[尬笑]
2024/8/29 7:01,dy,1,1,1,0,谁骂的，良心不会痛吗[尬笑]
2024/8/29 7:02,dy,0,0,0,0,俺蒙蒙就在这放话了不许欺负晋晋
2024/8/29 7:03,dy,0,0,0,0,各地的朋友们当时帮我们云南说话 我们云南人帮助现在的各地各位朋友们的困难[比心]
2024/8/29 7:03,dy,0,1,0,1,山西本地买煤贵就像四川本地限电一样
2024/8/29 7:03,dy,0,0,0,0,为什么要这么对他们 他们拿命干活 面庄老板是心疼他们 这样有什么问题能不能只看片面[微笑]
2024/8/29 7:04,dy,1,1,1,0,11块钱一碗手擀面还有鸡蛋豆干 这些外地人跟去年哈尔滨冰雪大世界退票的同一批吧[疑问]
2024/8/29 7:04,dy,1,1,1,0,俺吉吉就在这放话了不许欺负晋晋[你不大行]
2024/8/29 7:06,dy,0,1,0,1,我服了，三个人33，一碗面11还加蛋，不是这么便宜还要骂有病吧[微笑]我去景点吃一碗要38[微笑][微笑][微笑][微笑][微笑][微笑][微笑][微笑][微笑][微笑][微笑][微笑][微笑][微笑][微笑][微笑][微笑][微笑][微笑][微笑][微笑][微笑][微笑][微笑][微笑][微笑][微笑][微笑][微笑][微笑]
2024/8/29 7:07,dy,0,0,0,0,感谢博主第一次知道了阴阳煤，[给跪了][给跪了][给跪了]想问一下哪里有400一吨的煤，家里不太富裕去年给老人买的煤是1800一吨的[给跪了]
2024/8/29 7:07,dy,0,1,0,1,比我分手还难受 天杀的我山西怎么了
2024/8/29 7:08,dy,0,1,0,1,四川的电也比外地贵[尬笑]四川一个发电大省，年年夏天断电[尬笑]
2024/8/29 7:09,dy,0,1,0,-1,人家一个矿工优惠被有心人拿来做文章 还真就有人信了[捂脸]就这么见不得经济倒数第一的山西好？ 哇靠 也没见你门阴阳小日子和老美
2024/8/29 7:09,dy,0,0,0,0,印象里山西是煤大省，应该很富裕，直到去了山西旅游，到了平遥古城，也是个景区啊，可是还周围都是低矮房子的村庄，山西真的不像是想象中的那么富裕，到大槐树附近买一大坛醋，店主还帮忙放车里，山西人真的很好啊
2024/8/29 7:09,dy,0,0,0,0,其实饭店并不是不想明码标价，很多开在矿上的饭店都没有菜单，因为没什么必要，因为只是单纯卖刀削面的小店，开的地方又偏远，唯一的客流量就是工人，不知道外地人能不能理解，
2024/8/29 7:13,dy,0,0,0,0,山西的宝子们，我看到啦[流泪]
2024/8/29 7:13,dy,0,0,0,0,这个博主好像把号给注销了，这会儿找不到了[宕机]
2024/8/29 7:15,dy,1,1,1,0,有病，为了火找个话题没完没了，景区38，58的面没人说，11块正常价叭叭个没完。人家自己家人去吃饭便宜怎么了，免费都正常，人家老乡，人家乐意。
2024/8/29 7:17,dy,0,0,0,0,为啥本地反而贵呀，这不公平吧
2024/8/29 7:18,dy,0,0,0,0,我爸20岁左右的因为家里没钱挖过2年煤，因为煤矿里没有电话错过了大学录取通知，我叔叔那时候还在读书，爷爷不做工，太奶奶身体不好，家里只有奶奶工作。他后面的工作环境也是无尘车间和办公室（除了他自己爱给老家和买的两套房搞装修）到现在快三十年了都时不时咳血，支气管很大毛病，肺部也有问题，更别说那些一直在煤矿工作的工人了[流泪]。
2024/8/29 7:20,dy,0,1,0,1,你可以不吃你也可以不来，但是不许说[流泪]
2024/8/29 7:23,dy,0,1,0,1,上次就是因为醋的事情为难山西，这次又因为善良的老板难为山西人，我不知道这些人为什么要这么做，这么刁难我的家[流泪]
2024/8/29 7:23,dy,0,0,0,0,陕西收到了[流泪]我那天坐火车去太原玩，一路上全是黑黑的装着煤的火车[流泪]
2024/8/29 7:25,dy,0,0,0,0,我们这里都不让烧煤，说是为了环保，冬天太冷了
2024/8/29 7:26,dy,0,0,0,0,而且人家老板还把五块钱退给他了 三碗面27块钱 加了蛋还加了豆干 然后还被掐头去尾的发在网上
2024/8/29 7:26,dy,0,0,0,0,山河四省，列阵
2024/8/29 7:28,dy,0,1,0,1,不要来欺负老实人了好吗[流泪]人家老板可能都是大字不识几个的人 这样欺负人家有意思吗[流泪]从小到大受的什么教育
2024/8/29 7:29,dy,0,0,0,0,正好在吃饭，拍一张，十一块真不贵
2024/8/29 7:30,dy,0,0,0,0,贵吗现在的奶茶动不动不也二三十[流泪]有些果茶又和普通饮料有什么区别呢[流泪]
2024/8/29 7:30,dy,0,0,0,0,这个视频下好多山西ip，放心，四川已到
2024/8/29 7:30,dy,0,0,0,0,我们山河四省的一定要团结，我们为山西人发声。麻烦大家不要对山西人这么不公平！[流泪][流泪]
2024/8/29 7:31,dy,0,0,0,0,[拳头][拳头][拳头][拳头][拳头][拳头][拳头][拳头][拳头][拳头][拳头]
2024/8/29 7:32,dy,0,0,0,0,11块也没多贵吧[捂脸][捂脸]
2024/8/29 7:32,dy,0,0,0,0,真的好奇怪，我之前去新疆旅游，他们也是本地加油比外地贵，运输出去的油反而会便宜，为什么啊
2024/8/29 7:33,dy,0,0,0,0,又快到冬天了吗[捂脸]
2024/8/29 7:33,dy,0,0,0,0,就算11元我觉得也很正常啊[流泪]怎么能和工人的裸面比
2024/8/29 7:34,dy,1,1,1,0,能吃吃，不能吃就滚。十多块钱嫌贵。不要钱给你吃你不怕往里放?啊
2024/8/29 7:36,dy,0,0,0,0,能吃吃不能吃滚 想吃实惠的去上海吃呗[调皮]
2024/8/29 7:36,dy,1,1,1,0,神金，专门去矿地吃面条，11块很贵吗？深井冰
2024/8/29 7:36,dy,0,0,0,0,11块的面有鸡蛋有豆干[蜜蜂狗]我想请问现在外卖煮个火鸡面都需要二十，从哪里还能吃到这么经济实惠的面[蜜蜂狗]
2024/8/29 7:37,dy,0,1,0,1,气死我了气死我了 那个男的换小号儿 播放面馆被处理结果啊啊啊啊啊啊啊啊啊啊啊啊啊啊啊啊啊啊啊啊啊啊啊啊啊啊啊啊啊啊啊啊
2024/8/29 7:37,dy,0,1,0,1,人家都开在矿区边上了 我都不知道这些人怎么找到的 不去景区就去煤矿边上吃饭是吧 路上飙车还不系安全带 提前打开摄像头拍摄 不知道是何居心 有啥目的 这么欺负人家 就为了博得流量吗 良心能安吗
2024/8/29 7:40,dy,0,0,0,0,本来11也不贵啊。。。
2024/8/29 7:41,dy,1,0,0,1,我是老板我明码标价了，我不会多收钱，但是我少收别人的钱跟你也没关系[尬笑]
2024/8/29 7:41,dy,0,1,0,1,"如果按本地人400一吨，外地人1000一吨那可真的是山西都是煤老板了[尬笑]
可现实是本地人1000 外地人400
我的爷爷82岁了还为了省点煤钱每年都会劈一面墙的柴[流泪][流泪]"
2024/8/29 7:44,dy,0,0,0,0,山西煤真比别的省都贵吗？知道的说下
2024/8/29 7:45,dy,1,1,1,0,我请问呢，我这边随便一个烤冷面加个肠就十块了，十一一碗面嫌贵，真是见不得自己比别人在任何一方面吃亏一点啊
2024/8/29 7:45,dy,0,0,0,0,那就直接写，矿区工人凭工作证打折，不就行了
2024/8/29 7:48,dy,0,0,0,0,就是啊，那些去矿区测评的人，什么心理啊[酷拽][酷拽]
2024/8/29 7:48,dy,0,0,0,0,谁知道晋晋的委屈 就好像所有的省份都在往前走 山西在往后退 还要被骂9元的刀削面贵[流泪]
2024/8/29 7:50,dy,1,0,0,-1,至少 全网实名制道歉
2024/8/29 7:50,dy,0,0,0,0,出省了吗[大哭][大哭][大哭][大哭][大哭][大哭][大哭]
2024/8/29 7:50,dy,0,0,0,0,我想到了四川的电
2024/8/29 7:52,dy,0,0,0,0,11块哪里贵了，给他们2块钱我觉得都很合理，因为我们外地人就是偶尔出去外面尝尝鲜，不要为了流量无底线，明码标价，接受不了就不吃
2024/8/29 7:53,dy,1,1,1,0,阴阳煤价无人问，面贵四块天下知[流泪]
2024/8/29 7:53,dy,1,1,1,0,诺顿啊我希望你也能吃到这样的阴阳面[流泪]
2024/8/29 7:54,dy,0,0,0,0,到云南啦！[宕机]可是我们的云南米线都十多块一碗了，九块的面为什么贵[宕机]
2024/8/29 7:54,dy,0,0,0,0,十一块钱有肉有蛋真的不贵了[宕机]很便宜我说真的
2024/8/29 7:55,dy,0,0,0,0,好看吗
2024/8/29 7:57,dy,0,1,0,-1,[微笑]我这一碗12，几片肉而已，11还给加蛋还想要自行车是咋的
2024/8/29 7:57,dy,0,0,0,0,不是挺便宜的吗？怎么还有人喷
2024/8/29 7:57,dy,0,1,0,1,听着，以后全国所有商户一律不准接受讨价还价，敢便宜一毛就是阴阳价格，无论是老客户还是熟人，取消所有的积分制度、二杯半价、买一送一、超市限时促销，全部都是变相阴阳价格。[看]
2024/8/29 7:58,dy,0,0,0,0,不要在黑山西了[流泪]，我们山西人都将土地下的宝贝分给全国了
2024/8/29 7:59,dy,0,1,0,-1,十一块钱有肉有蛋，开在我们学校，天天炫[舔屏][舔屏]
2024/8/29 7:59,dy,0,0,0,0,干啥了啊，阴阳面是啥
2024/8/29 8:00,dy,1,1,1,0,看到有些评论区说什么国家还用煤吗，他们的存在只会让我怀疑国家教育资源
2024/8/29 8:00,dy,0,0,0,0,出省了，传到四川了。
2024/8/29 8:02,dy,0,0,0,0,[泣不成声][泣不成声][泣不成声][泣不成声]
2024/8/29 8:02,dy,0,0,0,0,我在学校吃个面要12块钱，要是在外面点学校的外卖不加运费还要15呢，怎么就阴阳了？[尬笑]
2024/8/29 8:02,dy,0,0,0,0,希望祖国繁荣昌盛，各省儿女就是一家人，没有必要
2024/8/29 8:03,dy,0,1,0,1,去吃北京的50一碗兰州拉面吧[捂脸]
2024/8/29 8:03,dy,1,1,1,0,不是哥们，喷完河南喷山西，下一个是什么，我不知道有什么好喷的[尬笑]
2024/8/29 8:06,dy,0,0,0,0,看到了 但是11元加面加肉真的不贵
2024/8/29 8:06,dy,1,1,1,0,有些人如苍蝇，看到黄金当粑粑，过去啃两口发现啃不动，然后到处嗡嗡嗡乱叫唤，引起别人关注来展示自己歌喉，谁知最后被人厌恶驱赶[呲牙]
2024/8/29 8:08,dy,0,0,0,0,[宕机]不是，就遭罪的永远是付出的多的呗[尬笑]
2024/8/29 8:08,dy,0,0,0,0,山河四省都有一个身不由己的理由[流泪]
2024/8/29 8:10,dy,0,0,0,0,我爸当阳煤工人这么多年了，他有多辛苦我知道，一碗面11就很贵吗？[难过][难过][难过][难过]
2024/8/29 8:12,dy,0,1,0,-1,11贵啥啊，有些地方面都三四十一碗，贵的话还要五六十七八十都有
2024/8/29 8:12,dy,0,0,0,0,刀削面11块还贵呀，我的妈[微笑][左上]
2024/8/29 8:12,dy,0,0,0,0,十一块还加了东西的面不是很便宜了么，而且人家是重体力劳动，只吃面营养能跟上么[躺平]
2024/8/29 8:13,dy,0,0,0,0,为什么我以前都不知道！不要欺负山西
2024/8/29 8:15,dy,0,0,0,0,刚刚好跑到矿区 刚刚好拿起了手机打开了相机 刚刚好让他吃到了11块的面  就是这么刚刚好[微笑]
2024/8/29 8:16,dy,0,0,0,0,我还以为111呢结果就11!平时喝杯奶茶都不止11吧
2024/8/29 8:21,dy,0,0,0,0,老板这样做本来就是一个很好的人啊，这还要去举报，不懂那举报人怎么想？
2024/8/29 8:22,dy,0,0,0,0,传出来了 能改变什么呢[流泪]我希望能改变什么[流泪]但是真的会改变什么吗[流泪]
2024/8/29 8:23,dy,0,0,0,0,不准欺负山西
2024/8/29 8:26,dy,0,0,0,0,不是我这里什么肉也不带的纯葱油面都要11啊那么多肉你还挑啥[流泪]
2024/8/29 8:29,dy,0,0,0,0,不准这样对待山西[流泪]
2024/8/29 8:29,dy,1,1,1,0,吃不起你就别出去玩[尬笑][尬笑][尬笑]觉得有问题你倒是跟人家老板问清楚啊[尬笑][尬笑]乱嚼舌根[尬笑][尬笑]男长舌妇[尬笑][尬笑][尬笑]
2024/8/29 8:30,dy,0,0,0,0,不准欺负山西[微笑]
2024/8/29 8:30,dy,0,0,0,0,所以现在社会到底怎么了[流泪]
2024/8/29 8:31,dy,1,0,0,-1,老子山河四省的兄弟就守在这了，看谁敢骂山西
2024/8/29 8:31,dy,0,0,0,0,不是，11块到底在贵什么，我吃面11块只能有四五块肉
2024/8/29 8:31,dy,0,0,0,0,不管是哪个省，我都觉得每个省都在发光发热[流泪][流泪]
2024/8/29 8:32,dy,1,0,0,1,不会有间谍在这边挑拨离间
2024/8/29 8:33,dy,0,0,0,0,"本地景点对本地人免费不是很正常的操作吗
老板给熟悉的人便宜点不对吗，我经常吃一家烤鱼，阿姨看到我也会给我一瓶饮料[微笑]"
2024/8/29 8:34,dy,0,0,0,0,抓住这一个事一直说，没人觉得不妥啊，不就那个博主自己一开始不清楚情况吗，刷一下午全是这种视频，山西人没有辜负任何人，不要搞这种意识上的对立吧。都是中国人，当然没有谁对不起谁，有不了解的地方说开了就好了，说的多了反而似乎在挑起矛盾，好多山西人的评论已经开始对外省有偏见了[尬笑]
2024/8/29 8:34,dy,0,1,0,1,我看看谁敢欺负俺西边兄弟[微笑]
2024/8/29 8:37,dy,0,1,0,1,不准这样污蔑山西[流泪][流泪][流泪]你们烧的煤都是我们的家呀[流泪][流泪][流泪]
