timestamp,platform,label1,label2,label3,diff,content
2024/9/7 10:34,dy,0,0,0,0,[九转大肠][九转大肠][九转大肠][九转大肠]
2024/9/7 10:36,dy,0,1,0,-1,客观的说一下，11块加蛋的手工刀削面，贵吗？[泣不成声]新疆30多的拌面，贵吗？大家自行体会[泣不成声]
2024/9/7 10:37,dy,0,0,0,0,11元，贵吗？
2024/9/7 10:38,dy,1,0,0,-1,那些带节奏拿矿工消费的的才是在打山西人的脸，大同火了，晋华宫那么多民宿，好多游客住着呢，真相大家都明白
2024/9/7 10:39,dy,1,0,0,-1,热度没完没了，眼看要吃不到了赶紧在讨一波[抠鼻]
2024/9/7 10:40,dy,1,1,1,0,穿拖鞋开车，好厉害呀
2024/9/7 10:42,dy,0,0,0,0,价格卖家确实给你们算多了，但是可以和卖家说嘛！这样一个小事情发布到网上，造成的舆论真不小。这件事绝对给卖家带来了很大的影响，当然对当事人的你也带了诸多不便。
2024/9/7 10:42,dy,1,1,1,0,首先作为山西人我不否认阴阳价是事实，其次我要为了我们山西个别商户老板的阴阳价行为给你们仨道个歉，然后我也理解你们为了博眼球赚流量在可以选择协商解决或者打12315举报的情况下，最终选择了流量最大的平台和最能引导舆论的表达方式来在全国9亿抖音用户面前处理这碗11块钱的面，但最后我要说的是，你们这种行为真的是无比生动的诠释了江东鼠辈这四个字，现在再说多少山西好的话也无济于事，你们打着为了其他游客好的幌子掩饰自己巴不得山西死的心理真的是一览无余，建议尔等江东鼠辈永远别再来山西，我们山西供不起你们这三尊道德制高点的大佛，说的直白点，我们不欢迎江东鼠辈。
2024/9/7 10:44,dy,1,0,0,-1,不管如何，比起那个出尔反尔，无底线博取流量的货色，感谢你的客观的陈述和设身处地的思考，看到了你做视频号的初衷和坚持。山西欢迎你，希望你能再来，还有好多美食和大好河山等你。[送心]
2024/9/7 10:44,dy,1,1,1,0,还再蹭流量，长点脸吧。
2024/9/7 10:45,dy,1,1,1,0,博主请你介绍一下发视频的初衷，你作为一个中国人你是怎么想的，钱退给你了，不代表人不犯错吗？谈谈钱退给你了这是事实。再发阴阳视频你的目的是什么，执法者也有人性的一面，今天这样的狡辩觉得你的人品怎么样？钱给你退了没有？是不是事实？
2024/9/7 10:47,dy,0,0,0,0,山西不需要你这样的人喜欢，请您以后绕道山西而行，愿你永远有好运。
2024/9/7 10:50,dy,1,1,1,0,11块钱的面就是不贵，但不论什么样的事实，是你们一方把视频扩大。真的是你们自找的，本来山西的，今年经济就很低很低，一直是拖国家的后腿，你们一来在大力宣传山西不好的同时，是不是就带动不了经济？你们不考虑这一些吗？所有的补贴里面没有山西，我们都不会讲这那的，好不容易能火一次，结果被你们一泡尿给浇灭了
2024/9/7 10:51,dy,1,1,1,0,阴阳刀削面接着就是悬空寺停车场收费，连着两条都和你们的旅游一点关系没有，说说你们是开干嘛的？
2024/9/7 10:53,dy,1,1,1,0,别发了好不，别人都被整停业了[捂脸]
2024/9/7 10:54,dy,1,1,1,0,大火的山西，唾手可得的流量，送到脸上的阴阳面。幻想成为一呼百应互联网判官，挟巨额流量带货爆富。结果却误判了互联网的局限性，在偌大的互联网山西网民毫无存在感，但却忽略了每一个山西词条视频评论区清一色的山西人。阴阳价格的确坏，但却忽略了仍然便宜实惠的事实。我平时吃碗面还得十来块，你们11元加个蛋还用剪辑手法？我不喷你去喷11元加蛋刀削面？你咋想的，还是觉得我好骗
2024/9/7 10:57,dy,0,0,0,0,正好你来了，问一问你，我就想知道最后那个退了多少钱？[晕][晕][晕][晕][晕][晕][晕][晕][晕][晕][晕][晕][晕][晕][晕][晕][晕][晕][晕][晕][晕][晕][晕][晕][晕][晕][晕][晕][晕][晕]
2024/9/7 10:58,dy,1,1,1,0,懒得听你废话，送你一个投诉表示支持
2024/9/7 11:00,dy,0,1,0,1,希望您以后做个正能量的博主，不是所有视频只能通过发视频解决，也不要一概代面，也许是人家服务员和老板娘交接算错了，你却不饶人，希望你以后善良
2024/9/7 11:01,dy,1,1,1,0,倾一省之力网暴三个人
2024/9/7 11:02,dy,1,1,1,0,才发现是江苏的，靠。丢人
2024/9/7 11:03,dy,1,0,1,1,你就是想蹭热度，没蹭明白
2024/9/7 11:05,dy,1,1,1,0,老板算错价格给你们退钱了，你们还发视屏出去，赚够了流量又说不是自己的本意[赞]
2024/9/7 11:06,dy,1,1,1,0,你个渣渣
2024/9/7 11:07,dy,0,0,0,0,祝你走出困境[感谢][感谢][感谢]
2024/9/7 11:07,dy,1,1,1,0,笑死，现在哪个饭店没个会员价，你去打下来啊，阴阳价，真有意思[九转大肠]
2024/9/7 11:08,dy,1,1,1,0,穿拖鞋开车，高速157公里速度咋解释？
2024/9/7 11:08,dy,1,1,1,0,就问你一句，三个人三碗面33块钱很贵吗？在你所说的去过那么多地方，你们吃面这11块一碗面，你说句实话拍着胸口问问自己贵吗？？？你就像??人看着??发展太快就开始抹黑，用尽一切手段来拖慢??发展的脚步，其实反观你自己却像个小丑一样丑态毕露，真的很不理解你们这种抹黑自己国家的人，国家旅游业发展起来不好吗？为了那点流量，把小事放大化加黑化。我请问您，如果您去上海吃一碗一样的面花了100你会不会专门拿出来说这个事，你不会，因为你觉得那种地方卖的贵没问题，觉得村里一碗面不配让你出11块钱是吗？？您的视频我看完了，没有感觉到一点您认识到您认知有错的反醒，与其说这是道歉，不如说这是一片为自己的狡辩，一点歉意一点诚意没看到，只看到你敢做敢想却不敢当。
2024/9/7 11:09,dy,0,0,0,0,所以把你们拱上热搜的是那些无良媒体的转发，本地人表示也莫名其妙放这么大[笑哭]
2024/9/7 11:09,dy,0,0,0,0,山西的物价真不贵，如果你再来还是欢迎
2024/9/7 11:09,dy,1,1,1,0,表达出那些会引起争议客观事实真没有必要了。你能把帐号做到这个程度，全程表达对你有利的所谓的事实。给人的感觉就是又想立又想当，你要么大格局承认自己的不足就足够了，要么干脆不发声。
2024/9/7 11:10,dy,0,1,0,-1,那个大姨一看他们是外地的就是给的阴阳价，只不过她们比较幸运，有底层的煤矿工人给她们店做了加持而已，大家脑子清楚一点，跟工人一点关系都没有好吗？面的原价就是6块加鸡蛋7块，给他们的价格也真是11块，不知道你们都在迷什么，，旷工是辛苦，卖面的也不傻，不是为了赚钱谁也不会去做这个买卖，，比如工地附近的早餐摊位，谁敢说不是为了赚钱？只不过价格不会很贵，别说很贵了就是贵一块，他们工人也不会去吃，，所以商家的心思到底正不正只有她们自己心里清楚，，不要拿不相干的底层工人说事，别人也没有享受过那个待遇，谢谢！
2024/9/7 11:12,dy,1,0,0,-1,一毛钱也是钱呐，像她们那种年龄的人都是从苦日子过来的，几毛钱都会精打细算的，你多下乡感受一下，不是所有农村人都有善心，不然也不会有缺斤少两那一说，像山东淄博那一阵子，他们的市领导安排每天那么多的人去监管缺斤少两，为的是什么呢，不就是预防这种没良心的商家吗，他们哪里知道至于不至于呢，他们又不会玩网络，哪知道拍一下手机就能让全国人民都知道，我们这个时代的年轻人对这几块钱当然不会很太在乎，但是你问问你爸爸妈妈的那个时代到底对钱在不在乎，什么时代就养什么样的心性，不要说现在都不缺钱的那种话，如果过过穷日子的人很容易适应现在的消费观念，那也不会有代沟这一说，好好想想吧你，我们都是受过教育的人，我绝对相信那三个人绝对不是为了钱，而且一个公道，就像小时候被同学冤枉你偷拿了他橡皮一样（橡皮在你盒子里)这时候所以人包括老师也对你说:橡皮还给他，这事就过去了。那你还觉得只是一个橡皮的事情吗，那你还觉得这事能这样过去吗？年轻人的时代有年轻人的脆弱，工作生活的压力已经压榨的喘不过气，再遇到这种不公的打击，凭什么啊？如果不幸遇到那种生活压力大的，绝对不会承受这种委屈，早就提刀去砍了
2024/9/7 11:12,dy,1,1,1,0,我不懂的是为什么人家店里的老板已经把钱退给你了，你们还要死抓住不放呢？不要又在这保持中立态度了，也许你跟你朋友说一句算了，为了生活都不容易，这事就过去了。但你选择了沉默，选择默认让朋友伸张正义，我也承认你们做的没错。饭店遭到了停业，但你们遭受到的网暴也请你一定要吞下自己种的苦果。六子吃几碗粉是难以证明的伪命题，因为直到最后大家才都清楚他吃了一碗，就像你说你胸闷气短也是伪命题，至少我认为是！
2024/9/7 11:14,dy,0,0,0,0,在舆论一边倒的浪潮中敢于说出事实、讲出真相这是值得肯定的。每个人都会犯错，面馆也是人也是。遇到错误积极改正积极面对这很难能可贵。
2024/9/7 11:14,dy,0,0,0,0,很多人想玩转抖音，结果被抖音玩儿了！
2024/9/7 11:14,dy,1,1,1,0,呵呵送给你
2024/9/7 11:15,dy,0,0,0,0,事出必有因
2024/9/7 11:17,dy,0,0,0,0,风过去了去迎接明天了
2024/9/7 11:17,dy,1,0,0,-1,吃面三杰吗？无所谓了。
2024/9/7 11:19,dy,0,0,0,0,正义不会偏袒任何一个人，也不会放过任何一个人，如果面馆不认错就让他们从新学习该怎么做人，不要拉扯旷地的底层工人来做垫背，他们也不会给你们做任何的加持，本来跟他们也没有任何的关系，也从未享受过你们给予的任何待遇，商家一直都是均价，工人也一直都均价消费，旁边不止你一家卖面的，为什么会临时涨价到7元一碗呢，我看你们不光大胆载客，还对别家进行恶意竞争，怎么？是怕了吗？怕隔壁的邻居爆料你之前协商的价格都是7块？你偷偷摸摸的变成6块？人在做天在看，该是你的就是你的，不该是你的早晚有一天会全部还回去，不是不报时候未到，，大家脑子都清醒起来，现实社会哪天都有插曲，我们理性的看待这些插曲来磨炼自己的心智，看透插曲里的人性
2024/9/7 11:19,dy,1,1,1,0,讨口子，你也就值这7块了[尬笑][OK]
2024/9/7 11:19,dy,1,0,0,-1,你为11块钱道歉
2024/9/7 11:21,dy,1,1,1,0,穿拖鞋开车超速的事是绝口不提呀
2024/9/7 11:22,dy,1,0,0,-1,支持你，因为那家面就是那个价钱没有什么所谓的矿工价！我以前就在那条路上上班，去哪里吃了很多吃根本没有什么所谓的矿工价，气死了
2024/9/7 11:24,dy,0,0,0,0,以后千万别来大同了
2024/9/7 11:24,dy,1,1,1,0,以后别来了。
2024/9/7 11:25,dy,1,1,1,0,骂你们没有任何风险，还能立出道貌岸然的人设，更能吸引流量，他们不会承认错误，更不会道歉。营销号用你们的身败名裂，换得了流量
2024/9/7 11:29,dy,1,1,1,0,这个不是价格高低问题，而是阴阳价格问题
2024/9/7 11:30,dy,1,1,1,0,作为路人最无语的是人家退你们钱了，你们还发网上，是想干什么，你们感觉被网暴不舒服，你们想过店家吗？
2024/9/7 11:31,dy,0,1,0,-1,"无论是七块还是十一块相关部门已经处理，也给山西一个警示，这难道不是你们的初衷???
我是太原人，去大同当地人给我推荐的是东方削面，一个连锁店。没吃过这些小馆子，也真佩服你们[赞]
山西欢迎八方游客[比心]"
2024/9/7 11:31,dy,0,0,0,0,我以为我们河南最委屈了，原来山西老兄也这么怨[流泪][流泪][流泪]
2024/9/7 11:33,dy,0,0,0,0,谢谢您们的所作所为帮我们大山西带来流量[感谢]
2024/9/7 11:35,dy,0,0,0,0,把无剪辑的原视频发一下呗
2024/9/7 11:35,dy,0,1,0,1,‘‘正宗的大同刀削面”满地的垃圾，退了几块钱，这怎么解释？
2024/9/7 11:39,dy,1,1,1,0,真恶心
2024/9/7 11:49,dy,0,0,0,0,谢谢你，不再相信你发的任何东西了。
2024/9/7 11:49,dy,1,1,1,0,11元钱的面都花不起，呆在你的老家别出来！
2024/9/7 11:51,dy,1,1,1,0,和你说维权渠道那么多发视频开直播就是变味，你和你现在说别人的营销号是一样的。同样的事同样的人 你说别的营销号。你却尊重了你朋友的选择。谁还没点私心？山西人没格局的 为什么呢？因为穷怕了
2024/9/7 11:51,dy,1,1,1,0,剪辑的视频恶意引导，放大事件，无底线炒作。他们被多了钱，是占理的。当然这么干也确实不违法，道德上的事情就不好说了[看]
2024/9/7 11:51,dy,1,1,1,0,从一进门就把镜头对准那些角落，根本就不是你说的初衷
2024/9/7 12:00,dy,1,1,1,0,就算你说的是事实，别人骂你们也不冤，因为本身十一元带蛋的面就不贵，大部分骂你们的也信你们说的，骂你们住要原因应该是：这么个不值一提的事。让你们整得满城风云的。事事的，还拿央视采访说事，央视就权威吗？
2024/9/7 12:04,dy,1,1,1,0,要不要我请你吃刀削面？你在阴阳什么？山西刀削面怎么了？吃不起说话，我请你吃
2024/9/7 12:06,dy,1,1,1,0,你不是当事人？在阴阳什么？穿个大拖鞋子，发什么声？
2024/9/7 12:07,dy,1,1,1,0,所有人为了这座城市努力，就像你为了有流量努力想到阴阳价标题。出门旅游多少该了解到当地消费水平，三块五块的委屈不应该是你博取流量的手段。同样面馆老板也不见得说的真话，显然她都没搞懂大碗小碗，加了什么只是为了凑够11块。
2024/9/7 12:07,dy,1,1,1,0,你在你家门口吃一口饭就不止11吧。？
2024/9/7 12:08,dy,1,0,0,1,不是他们  这个人长得和他们不一样[看]   也是一个蹭热点的
2024/9/7 12:10,dy,1,1,1,0,都退款了、还举报了，都举报了，还再发视频。而且镜头一进门对的是哪？
2024/9/7 12:11,dy,1,1,1,0,那你爸爸不收你的吃饭钱就是三观正了？
2024/9/7 12:15,dy,1,1,1,0,你们也怕网爆呀，因为几块钱要把人家发网上网爆
2024/9/7 12:18,dy,1,1,1,0,仔细看骂人的都是山西人 ip[看]
2024/9/7 12:23,dy,0,1,0,-1,我就是大同矿工，这里好多矿上的削面小碗不加蛋大多都是六七块，其实给我的感觉是饭店阿姨应该说了假话。
2024/9/7 12:25,dy,1,1,1,0,你不无辜。说再多都是苍白的。你就是罪人。
2024/9/7 12:25,dy,1,1,1,0,没什么对错，只是你，特别是你朋友，格局也太小了。要做视频做账号也没有必要让自己粘上斤斤计较的感觉
2024/9/7 12:26,dy,1,1,1,0,网络舆论的力量不是常人能想想的，你很不幸，祝你好运吧[感谢]
2024/9/7 12:29,dy,1,0,0,-1,山西你变了
2024/9/7 12:35,dy,1,0,0,1,这是事情过去了又开始煽动舆论了
2024/9/7 12:35,dy,1,1,1,0,还觉得没什么不妥，去那种地方吹毛求疵有必要吗？
2024/9/7 12:37,dy,1,0,0,-1,刀郎那个是怎么唱的来，怎么洗也洗不清
2024/9/7 12:38,dy,1,1,1,0,这一定是为了带火山西搞得流量！
2024/9/7 12:44,dy,1,1,1,0,拉黑
2024/9/7 12:45,dy,1,0,0,1,这流量也蹭，以后你这个账号算是废了！
2024/9/7 12:48,dy,1,1,1,0,你没被骂死是因为还有很多人不知道你是吃面三鼠之一。
2024/9/7 12:51,dy,1,1,1,0,试问7元还是11元在你们那里能吃到什么，我们只是穷 而不是傻，大美山西不欢迎你这种人！！
2024/9/7 12:55,dy,1,0,0,-1,你快逼上那个班级哇
2024/9/7 12:57,dy,1,1,1,0,店家有没有退你们钱？还有你们是不是高速150以上？开车穿拖鞋？后排不系安全带[疑问]
2024/9/7 12:58,dy,0,0,0,0,已经说不清楚了 还有人说拍摄视角很奇怪为什么不对着人拍 而对着地拍
2024/9/7 12:59,dy,0,0,0,0,穿拖鞋开车是真的吗？高速开157迈是真的吗？[看]
2024/9/7 12:59,dy,0,0,0,0,当时是不是人多 老板记错了 是不是有其他人点了加丸子豆腐干鸡蛋
2024/9/7 13:01,dy,0,0,0,0,希望你结交一些真正的朋友吧！无论怎样，希望你下次能宣传一下我们大同的文化历史和深厚底蕴，哪怕关注一下其他的生活问题。
2024/9/7 13:01,dy,0,0,0,0,其实作为一个山西人……没事！你感觉贵了！他就贵了！你感觉他不贵！他就不贵！我带不了谁！我只代表自己！山西欢迎你！下次再来……我请你吃美食！不玩虚的！我在太原！多大点事！兄弟！我不支持你也不网爆你！（我就是山西小老百姓）[呲牙][呲牙][呲牙][呲牙]
2024/9/7 13:04,dy,0,0,0,0,什么都不要说了，山西不欢迎你
2024/9/7 13:05,dy,1,1,1,0,说得很好，没有在这个账号上说却在别的账号上说，好大一个阴阳师[OK]
2024/9/7 13:08,dy,1,1,1,0,这无论真相如何这个事是这个结果也得接受，本来退钱事情已经解决，再发视频就是为了博眼球引流量，目的不正。不过在路上那个目的也达到了，号也有了好几万粉丝了。
2024/9/7 13:10,dy,1,0,0,-1,拍的视频前期发出来全是不好的环境，不知道怎么解释？高速157穿拖鞋不知道技术怎么评级？
2024/9/7 13:12,dy,1,1,1,0,不了解就不要乱说，惹人骂
2024/9/7 13:13,dy,1,0,0,1,把原视频放出来，是非对错一目了然，用得着解释这么多吗
2024/9/7 13:16,dy,1,0,0,-1,捏忙班级
2024/9/7 13:16,dy,1,1,1,0,有病，有大病
2024/9/7 13:19,dy,1,1,1,0,就是两个价，这么多人真的是脑子没有
2024/9/7 13:21,dy,1,1,1,0,就说你们把11块一碗的刀削面剥开来发布到自媒体，难道你没想过11块是非常合理的价格了吗，你想的只是店家欺你了，欺你啥了，这能算阴阳价？你觉得阴阳价就是这么定义的？大众不能理解的是9块和11块的区别，就2块钱你在这喊阴阳价，大家铺天盖地批评你的时候你觉得委屈了？你想没想过店家要承受的后果？反正不管你们道不道歉，反正我是不会原谅的，就这。。。
2024/9/7 13:24,dy,0,0,0,0,你知道吗？三家刀削面馆都涨价了！[泣不成声]
2024/9/7 13:30,dy,0,0,0,0,加油～
2024/9/7 13:30,dy,0,0,0,0,那高速穿拖鞋超速是真的吗？
2024/9/7 13:31,dy,1,1,1,0,快不要丢人现眼了
2024/9/7 13:33,dy,1,0,0,-1,你小子还算有点良心，
2024/9/7 13:36,dy,0,0,0,0,知道为什么会有这么大反响吗？不能以偏概全，随便下定论！
2024/9/7 13:37,dy,1,1,1,0,“XX鼠辈”，那就把完整视频发出来。看看你们发的视频，视角[捂脸][捂脸][捂脸]
2024/9/7 13:40,dy,1,1,1,0,活在小恶不算恶的世界里真可悲，相比我还是喜欢桂林和哈尔滨了，民风淳朴[偷笑]
2024/9/7 13:42,dy,1,1,1,0,孔乙己窃书被吊起来打，边上人虽然不觉得他真的作恶，仅仅笑话他，但还是认同打的对的，而不是组团去何家堵门谩骂，这就是区别。时代的洪流不可逆转，如果依然抱着“窃书不算偷”的思想，被吊起来打，被旁人围起来笑的情况只会更多，某些人细品[偷笑][偷笑][偷笑]
2024/9/7 13:44,dy,0,0,0,0,我在北京，门口有个超市，平时买东西老板基本都会给我们把零头抹去，买多了还会优惠几块，有些陌生人去了老板也不会给他优惠，或者优惠很少。那你说这个是不是也算阴阳价，也该举报？
2024/9/7 13:45,dy,0,1,0,-1,我是山西人，这个视频让我知道了真相，不说面贵贱，面馆确实做的不对，有点欺负外地人的感觉
2024/9/7 13:45,dy,1,0,0,-1,江东杰瑞啊。[看]
2024/9/7 13:50,dy,1,0,0,-1,早是拢猫儿丘了，现在后怕了 [捂脸]
2024/9/7 13:52,wb,1,1,1,0,在消费矿工的什么，是没日没夜给资本家煤老扳挖矿吗，另外是十多省在燃烧你的故土吗？吃了上顿没下顿的矿工，不存在的少4矿工优惠价，你值得拥有！
2024/9/7 13:53,dy,0,0,0,0,欢迎来大美新疆！事先说明，新疆没有预制菜，所以臊子面15，炸酱面18，羊腿抓饭40，羊排抓饭40，碎肉抓饭30，大盘鸡123，馕5…希望你们不要说新疆饭菜贵，因为我们在祖国的西边，很多东西贵在运费，尤其是景区，运输不便，汽油油费人工费都不便宜，还望理解…给你们做个心理准备。风景真的很美。一生值得来一次的地方。
2024/9/7 13:56,dy,0,1,0,-1,算了无所谓了网络真真假假拉黑了
2024/9/7 13:57,dy,0,0,0,0,你说的我都信，那这个照片我们能不能相信？
2024/9/7 13:59,dy,0,0,0,0,昨天才从山西回京，在山西打车的时候司机是矿工，他说，面店就在他家附近，最近已经重新开门了
2024/9/7 14:01,dy,0,0,0,0,说说告诉穿拖鞋超速的事
2024/9/7 14:02,dy,0,0,0,0,错就是错了[尬笑]还不承认
2024/9/7 14:02,dy,1,1,1,0,退钱的事你是只字不提
2024/9/7 14:03,dy,1,0,0,-1,"关键一般人进入一家面馆发现阴阳价,问老板为啥阴阳价也不说啥原因,谁不生气?难道吃个面还要背景调查?"
2024/9/7 14:07,dy,1,1,1,0,我就寻思，11一碗面，你们咋好意思提出来的呢？知道啦，你只是吃了一碗面，你不知道也不赞同发视频！就是这11块钱的面，你们以前都是去哪儿旅游了呀？
2024/9/7 14:08,dy,1,1,1,0,从头到尾的，把你们一进门开始的那原视频发一遍，也不用你们在这旁白，直接发原声原始视频就行。现在抖音都能发19个小时的视频了。我就不信你吃个饭能吃20个小时。从头到尾，你们录制的原声都发出来。自然就清晰明了了，写一堆编文，事实澄清。那不比你发整体原声视频来的好？还是说，你们这中间有点啥说不清道不明的话呢？比如抹黑之类的腌H事呢？
2024/9/7 14:08,dy,1,1,1,0,说到底不是为了做账号吗？还谈上初心了[尬笑]
2024/9/7 14:09,dy,0,0,0,0,我就想问一下你们是不是真的穿拖鞋开车？？？
2024/9/7 14:16,dy,0,1,0,1,谈谈拖鞋开车，超速开车？？？？
2024/9/7 14:16,dy,1,1,1,0,你阴阳的 不是给你价钱高了  而是给人家认识的人低了  你不了解 为什么要发阴阳价钱呢？
2024/9/7 14:19,dy,1,1,1,0,作为一个大同人，我知道商家有不对的地方，所以我觉得停业整顿是应该的，我也不觉得那是矿工特惠价，但是你那个朋友视频扣的帽子太大了，为什么标题写33元，那个视频发的就是带节奏。如果你朋友也是这样的发视频，没人会骂你们，你们那个朋友用心不良，不能因为一碗面就去否定整个山西，如果他善良的去发声，那么别人也不会骂他。
2024/9/7 14:23,dy,0,0,0,0,正常11元没问题！
2024/9/7 14:33,dy,1,0,0,1,清者自清，无论如何阴阳价都不对，无关实惠与否，当然朋友的剪辑也给广大网友造成误解，现店家已经明码标价也得到了惩戒和流量，希望大家理性，也祝您越来越来。实现双赢
2024/9/7 14:35,dy,0,0,0,0,高速157超速啥情况？
2024/9/7 14:36,dy,1,1,1,0,你不用自正，大多数群众说你错了你就是错了，这个世界没有绝对的对错，只有相对论[看]
2024/9/7 14:38,dy,1,1,1,0,"漂亮话谁不会说，事实就是你把人家干关闭了。那几天的损失，
你给人家陪了吗？[酷拽]还有视频都是掐头去尾的，什么意思，视频拍的都是脏乱，居心何在？心眼子坏透了。"
2024/9/7 14:40,dy,1,1,1,0,都快忘了，又要提起来
2024/9/7 14:41,dy,1,1,1,0,钱也退了，罚也罚了，不依不饶的，没完没了的，热度一降，当事人就出来了，到底怎么回事？真是恶心，不要带上地域？你也知道山西人在守护自己的家园？双标
2024/9/7 14:41,dy,1,1,1,0,事后的深情，一文不值
2024/9/7 14:42,dy,1,1,1,0,三个讨吃货[尬笑]
2024/9/7 14:46,dy,1,1,1,0,11块钱的面你要计较阴阳价，我觉得流量在你心中肯定比命都重要吧
2024/9/7 14:46,dy,0,0,0,0,我要看全部未删减视频！
2024/9/7 14:47,dy,1,0,0,1,山西人懂得都懂[捂脸][捂脸][捂脸]
2024/9/7 14:48,dy,1,0,0,-1,退钱是真退了还是假退了？没想过她真算错了的情况么？
2024/9/7 14:49,dy,1,0,0,-1,热度本来都快退了，每次都是热度快退的时候出来一个人发个视频解释一下，让这件事一直发酵。那能不能解释下高速穿拖鞋开157迈这件事呢？有人说江苏交警已处罚，并没有看到公告
2024/9/7 14:52,dy,1,1,1,0,现在都这样了，还有什么好说的，已经说不清
2024/9/7 14:53,dy,1,0,0,1,别道歉，你本有错，你解释都很无力！
2024/9/7 14:53,dy,1,0,0,-1,朋友来了，有好酒。若是那豺狼来了，迎接它的有猎枪！
2024/9/7 14:53,dy,0,0,0,0,我是山西的，我骄傲怎么着？[抠鼻]
2024/9/7 14:54,dy,1,1,1,0,为了流量，可以理解，要有底线
2024/9/7 14:55,dy,1,1,1,0,其心可诛！
